Meldungsart;Datensatzart;"Lost Art ID";Hersteller/Künstler/Autor:in;Titel;Datierung;Objektart;Inventarnummer/Signatur;Beschreibung;Provenienz;"Veröffentlicht seit";Kontakt;Link;"Literatur / Quelle"
Suchmeldung;Einzelobjekt;531517;"Deiters, [1. Heinrich]? [Künstler:in]";"Spaziergang im Walde";;Malerei;"319 (Achenbach)469 (Achenbach)";"Quellen: D - LAB, A Rep. 243-04, Nr. 8, Achenbach, Sammelliste der Auktion vom 22.09.1936, Auftrag 1017, Dr. v. Klemperer; Ebd. Auktion vom 13.10.1936, ebs; Ebd., Nr. 57, Klemperer, Victor von, Achenbach, Auktion vom 22.O9.1936, Versteigerungsauftrag.";"Sammlung Dr. Victor von Klemperer, DresdenAuktion Achenbach, Berlin 22.09.1936, Lot 319Auktion Achenbach, Berlin 13.10.1936, Lot 469 (verkauft an unbekannt)";2016-01-27;"Dr. Sabine Rudolph (Rechtsanwältin)+49 (0)351 / 448 333-0s.rudolph@steinmeier.eu";https://www.lostart.de/de/Verlust/531517;
Suchmeldung;Einzelobjekt;531518;"Dyck, Anton van (Kopie nach | Copy after) [Künstler:in]";"Anna van Thielen mit ihrer Tochter Anna Maria Rombouts";;Malerei;"462 (Achenbach), 455 (Achenbach)";"Kopie. Portrait of Anna van Thielen, wife of the painter Theodor Rombouts with their daughterauch Mutter und Kind.";"Sammlung Dr. Victor von Klemperer, DresdenAuktion Achenbach, Berlin 29.06.1937, Lot 462Auktion Achenbach, Berlin 27.07.1937, Lot 455";2016-01-27;"Dr. Sabine Rudolph (Rechtsanwältin)+49 (0)351 / 448 333-0s.rudolph@steinmeier.eu";https://www.lostart.de/de/Verlust/531518;"Quellen: D - LAB, A Rep. 243-04, Nr. 10, Achenbach, Sammelliste, Auktion vom 29.06.1937, Auftrag 1196, Dr. v. Klemperer; Ebd. Auktion vom 27.07.1937, ebs."
Suchmeldung;Einzelobjekt;531519;"Unbekannt (Englisch (Meister)) [Künstler:in]";"König Jacob II. von England";"1750 (um) [Datierung]";Malerei;"433 (Lepke)341 (Lepke)";"Kniestück von vorn in Rüstung mit dem Mantel der Maltheserritter. Holzgeschnitzter G.-R.Quellen: Rudolph Lepke's Kunst-Auctions-Haus: Kunstsammlung F. - Berlin: Gemälde neuerer Meister, Skulpturen, Möbel, Porzellane, Fayencen (Katalog Nr. 2114). Auktion vom 16.-17-06.1937. Berlin 1937; Rudolph Lepke's Kunst-Auctions-Haus: Antiquitäten, Möbel, Tapisserien, Kunstgewerbe: Gemälde alter und neuerer Meister (Katalog Nr. 2120). Berlin 1938.";"Sammlung Dr. Victor von Klemperer, DresdenAuktion Lepke, Berlin 16.-17-06.1937, Lot 433Auktion Lepke, Berlin o.D. 1938, Lot 341";2016-01-27;"Dr. Sabine Rudolph (Rechtsanwältin)+49 (0)351 / 448 333-0s.rudolph@steinmeier.eu";https://www.lostart.de/de/Verlust/531519;
Suchmeldung;Einzelobjekt;531521;"Jost, Prof. [Josef]? [geb. 1888] [Künstler:in]";"Patrouille an der Kärntner Front";;Malerei;"321 (Achenbach)
471 (Achenbach)
391 (Achenbach)";"Quellen: D - LAB, A Rep. 243-04, Nr. 8, Achenbach, Sammelliste der Auktion vom 22.09.1936, Auftrag 1017, Dr. v. Klemperer; Ebd. Auktion vom 13.10.1936, ebs; Ebd. Auktion vom 10.11.1936, ebs; Ebd., Nr. 57, Klemperer, Victor von, Achenbach, Auktion vom 22.O9.1936, Versteigerungsauftrag.";"Sammlung Dr. Victor von Klemperer, DresdenAuktion Achenbach, Berlin 22.09.1936, Lot 321Auktion Achenbach, Berlin 13.10.1936, Lot 471Auktion Achenbach, Berlin 10.11.1936, Lot 391";2016-01-27;"Dr. Sabine Rudolph (Rechtsanwältin)+49 (0)351 / 448 333-0s.rudolph@steinmeier.eu";https://www.lostart.de/de/Verlust/531521;
Suchmeldung;Einzelobjekt;531523;"nach Lancret, Nicolas [Künstler:in]";"Gesellschaft im Garten";;Malerei;"314 (Achenbach)";"Alte Supraporte.Quellen: D - LAB, A Rep. 243-04, Nr. 8, Achenbach, Sammelliste der Auktion vom 22.09.1936, Auftrag 1017, Dr. v. Klemperer; Ebd., Nr. 57, Klemperer, Victor von, Achenbach, Auktion vom 22.O9.1936, Versteigerungsauftrag.";"Sammlung Dr. Victor von Klemperer, DresdenAuktion Achenbach, Berlin 22.09.1936, Lot 314Käufer Achenbach: Jung";2016-01-27;"Dr. Sabine Rudolph (Rechtsanwältin)+49 (0)351 / 448 333-0s.rudolph@steinmeier.eu";https://www.lostart.de/de/Verlust/531523;
Suchmeldung;Einzelobjekt;531525;"nach Raffael [Künstler:in]";"Raffaelsche Engelsköpfe";;Malerei;"463 (Achenbach)
456 (Achenbach)";"Kopie.Quellen: D - LAB, A Rep. 243-04, Nr. 10, Achenbach, Sammelliste, Auktion vom 29.06.1937, Auftrag 1196, Dr. v. Klemperer; Ebd. Auktion vom 27.07.1937, ebs.";"Sammlung Dr. Victor von Klemperer, DresdenAuktion Achenbach, Berlin 29.06.1937, Lot 463Auktion Achenbach, Berlin 27.07.1937, Lot 456";2016-01-27;"Dr. Sabine Rudolph (Rechtsanwältin)+49 (0)351 / 448 333-0s.rudolph@steinmeier.eu";https://www.lostart.de/de/Verlust/531525;
Suchmeldung;Einzelobjekt;531526;"Ruprecht, Tini [Künstler:in]";Frauenkopf;;Malerei;"467 (Achenbach)
460 (Achenbach)";"Quellen: D - LAB, A Rep. 243-04, Nr. 10, Achenbach, Sammelliste, Auktion vom 29.06.1937, Auftrag 1196, Dr. v. Klemperer; Ebd. Auktion vom 27.07.1937, ebs.";"Sammlung Dr. Victor von Klemperer, DresdenAuktion Achenbach, Berlin 29.06.1937, Lot 467Auktion Achenbach, Berlin 27.07.1937, Lot 460";2016-01-27;"Dr. Sabine Rudolph (Rechtsanwältin)+49 (0)351 / 448 333-0s.rudolph@steinmeier.eu";https://www.lostart.de/de/Verlust/531526;
Suchmeldung;Einzelobjekt;531528;"Steffeck, Carl Constantin Heinrich [Künstler:in]";"Braunes Reiterpferd";;Malerei;"429 (Lepke)
339 (Lepke)";"nach rechts stehend, monogrammiertQuellen: Rudolph Lepke's Kunst-Auctions-Haus: Kunstsammlung F. - Berlin: Gemälde neuerer Meister, Skulpturen, Möbel, Porzellane, Fayencen (Katalog Nr. 2114). Auktion vom 16.-17-06.1937. Berlin 1937; Rudolph Lepke's Kunst-Auctions-Haus: Antiquitäten, Möbel, Tapisserien, Kunstgewerbe: Gemälde alter und neuerer Meister (Katalog Nr. 2120). Berlin 1938.";"Sammlung Dr. Victor von Klemperer, DresdenAuktion Lepke, Berlin 16.-17-06.1937, Lot 429Auktion Lepke, Berlin o.D. 1938, Lot 339";2016-01-27;"Dr. Sabine Rudolph (Rechtsanwältin)+49 (0)351 / 448 333-0s.rudolph@steinmeier.eu";https://www.lostart.de/de/Verlust/531528;
Suchmeldung;Einzelobjekt;531532;"Tischbein, Johannes Heinrich [Künstler:in]";"Bildnis der Prinzessin Wilhelmine von Preußen";;Malerei;;"Quellen: US - NARA, RG 260, A3389. Records Concerning the Central Collecting Points (""Ardelia Hall Collection""): Selected Microfilm Reproductions And Related Records, 1945-1949. Roll 66. ""Linz Film"". 14.3, Vols. 8a–11a. LF/X/25/129. Blatt 134.";"Sammlung Viktor von Klemperer, - 30.04.1937Auktion Walter Achenbach, Berlin 30.04.1937, nicht verkauftRA Dr. jur. Wilhelm Mielck, Mai 1942Staatliche Gemäldesammlung Dresden, - Oktober 1943 -Restituiert 1991.Statusrestituiert";2016-01-27;"Dr. Sabine Rudolph (Rechtsanwältin)+49 (0)351 / 448 333-0s.rudolph@steinmeier.eu";https://www.lostart.de/de/Verlust/531532;
Suchmeldung;Einzelobjekt;531533;"Unbekannt [Künstler:in]";"Brustbild eines Geharnischten mit Allongeperücke auch Herr in Hoftracht und Perücke";;Malerei;"464 (Achenbach), 457 (Achenbach)";"alt, Barockzeit, weisser Rahmen.";"Sammlung Viktor von Klemperer, Dresden - 30.04.1937Auktion Achenbach, Berlin 29.06.1937, Lot 464Auktion Achenbach, Berlin 27.07.1937, Lot 457 (nicht verkauft) - August 1942RA Dr. jur. Wilhelm Mielck, Dresden Mai/Juni 1942Staatliche Gemäldesammlung Dresden, August 1942 - Oktober 1943 -";2016-01-27;"Dr. Sabine Rudolph (Rechtsanwältin)+49 (0)351 / 448 333-0s.rudolph@steinmeier.eu";https://www.lostart.de/de/Verlust/531533;"LF X/15/82 - LF X/29/143 , (hier LF/X/18/94, LF/X/24/118, LF/X/25/129 - 130), hier Blatt 317, 323ff."
Suchmeldung;Einzelobjekt;531534;"Unbekannt [Künstler:in]";Chocolatiere;;Malerei;"313 (Achenbach)";"Kopie.Quellen: D - LAB, A Rep. 243-04, Nr. 8, Achenbach, Sammelliste der Auktion vom 22.09.1936, Auftrag 1017, Dr. v. Klemperer; Ebd., Nr. 57, Klemperer, Victor von, Achenbach, Auktion vom 22.O9.1936, Versteigerungsauftrag.";"Sammlung Dr. Victor von Klemperer, DresdenAuktion Achenbach, Berlin 22.09.1936, Lot 313Käufer Achenbach: Schellhase";2016-01-27;"Dr. Sabine Rudolph (Rechtsanwältin)+49 (0)351 / 448 333-0s.rudolph@steinmeier.eu";https://www.lostart.de/de/Verlust/531534;
Suchmeldung;Einzelobjekt;531535;"Unbekannt [Künstler:in]";Seestück;;Malerei;"315 (Achenbach)";"antiker G.R., SupraporteQuellen: D - LAB, A Rep. 243-04, Nr. 8, Achenbach, Sammelliste der Auktion vom 22.09.1936, Auftrag 1017, Dr. v. Klemperer; Ebd., Nr. 57, Klemperer, Victor von, Achenbach, Auktion vom 22.O9.1936, Versteigerungsauftrag.";"Sammlung Dr. Victor von Klemperer, DresdenAuktion Achenbach, Berlin 22.09.1936, Lot 315Käufer Achenbach: Jung";2016-01-27;"Dr. Sabine Rudolph (Rechtsanwältin)+49 (0)351 / 448 333-0s.rudolph@steinmeier.eu";https://www.lostart.de/de/Verlust/531535;
Suchmeldung;Einzelobjekt;585343;"Unbekannt [Künstler:in]";"Vier Fragmente einer Wanddekoration";"1486/1500 [Datierung]";Malerei;"WRM 329-332";"Rankenornament und figürliche Darstellungen.";"Vor 1915 Wallraf-Richartz-Museum, Köln. Kunstgewerbemuseum, Köln. Seit 1945 Verbleib unbekannt.";2020-01-30;"Wallraf-Richartz-Museum & Fondation CorboudObermarspforten50667 Köln+49(0)221/221-22372+49(0)221/221-22629http://www.wallraf.museumDezernat für Kunst und Kultur der Stadt Köln (Museumsreferat, Provenienzforschung)+49(0)221/221-22520provenienzforschung@stadt-koeln.de";https://www.lostart.de/de/Verlust/585343;
Suchmeldung;Einzelobjekt;585344;"Unbekannt [Künstler:in]";"Die Heiligen Andreas und Anno";"1600 (um) [Datierung]";Malerei;"WRM 570";"Die Heiligen Andreas und Anno.";"1824 Wallraf-Richartz-Museum, Köln. Verbleib unbekannt.";2020-01-30;"Wallraf-Richartz-Museum & Fondation CorboudObermarspforten50667 Köln+49(0)221/221-22372+49(0)221/221-22629http://www.wallraf.museumDezernat für Kunst und Kultur der Stadt Köln (Museumsreferat, Provenienzforschung)+49(0)221/221-22520provenienzforschung@stadt-koeln.de";https://www.lostart.de/de/Verlust/585344;
Suchmeldung;Einzelobjekt;585345;"Meister von St. Severin, Schule (?) [Künstler:in]";Kreuzigung;"1500 (um?) [Datierung]";Malerei;"WRM 571";Kreuzigung.;"Vor 1915 Wallraf-Richartz-Museum. Vor 1944 vermisst.";2020-01-30;"Wallraf-Richartz-Museum & Fondation CorboudObermarspforten50667 Köln+49(0)221/221-22372+49(0)221/221-22629http://www.wallraf.museumDezernat für Kunst und Kultur der Stadt Köln (Museumsreferat, Provenienzforschung)+49(0)221/221-22520provenienzforschung@stadt-koeln.de";https://www.lostart.de/de/Verlust/585345;
Suchmeldung;Einzelobjekt;585346;"Unbekannt [Künstler:in]";Wanddekoration;"1486/1500 [Datierung]";Malerei;"WRM 600";;"Vor 1915 Wallraf-Richartz-Museum. Verbleib unbekannt.";2020-01-30;"Wallraf-Richartz-Museum & Fondation CorboudObermarspforten50667 Köln+49(0)221/221-22372+49(0)221/221-22629http://www.wallraf.museumDezernat für Kunst und Kultur der Stadt Köln (Museumsreferat, Provenienzforschung)+49(0)221/221-22520provenienzforschung@stadt-koeln.de";https://www.lostart.de/de/Verlust/585346;
Suchmeldung;Einzelobjekt;585347;"Martini, Simone (Schule (?)) [Künstler:in]";"Johannes der Täufer und Apostel Petrus";"1390 [Datierung]";Malerei;"WRM 615";;"1867 Wallraf-Richartz-Museum, Köln. 2.11.1940 Abgabe an den Stadtkonservator der Stadt Köln. Seit 1945 Verbleib ungekannt.";2020-01-30;"Wallraf-Richartz-Museum & Fondation CorboudObermarspforten50667 Köln+49(0)221/221-22372+49(0)221/221-22629http://www.wallraf.museumDezernat für Kunst und Kultur der Stadt Köln (Museumsreferat, Provenienzforschung)+49(0)221/221-22520provenienzforschung@stadt-koeln.de";https://www.lostart.de/de/Verlust/585347;
Suchmeldung;Einzelobjekt;585348;"Martini, Simone (Schule (?)) [Künstler:in]";"Die Apostel Paulus und Jakobus";"1390 [Datierung]";Malerei;"WRM 616";"Apostel Paulus und Jakobus.";"1867 Wallraf-Richartz-Museum, Köln. 2.11.1940 Abgabe an den Stadtkonservator der Stadt Köln. Seit 1945 Verbleib ungekannt.";2020-01-30;"Wallraf-Richartz-Museum & Fondation CorboudObermarspforten50667 Köln+49(0)221/221-22372+49(0)221/221-22629http://www.wallraf.museumDezernat für Kunst und Kultur der Stadt Köln (Museumsreferat, Provenienzforschung)+49(0)221/221-22520provenienzforschung@stadt-koeln.de";https://www.lostart.de/de/Verlust/585348;
Suchmeldung;Einzelobjekt;585351;"Beckenkamp, Kaspar Bendikt [Künstler:in]";"Bildnis eines Mannes";"1701/1900 [Datierung]";Malerei;"WRM 1102";;"Ab 1828 Wallraf-Richartz-Museum, Köln. Ab 1927 als Leihgabe an das Rheinische Museum, Köln/Deutz. Seit 1945 Verbleib unbekannt.";2020-01-30;"Wallraf-Richartz-Museum & Fondation CorboudObermarspforten50667 Köln+49(0)221/221-22372+49(0)221/221-22629http://www.wallraf.museumDezernat für Kunst und Kultur der Stadt Köln (Museumsreferat, Provenienzforschung)+49(0)221/221-22520provenienzforschung@stadt-koeln.de";https://www.lostart.de/de/Verlust/585351;
Suchmeldung;Einzelobjekt;585352;"Greferath, Johannes [Künstler:in]";"Landschaft - Park in Sevilla";"1923 [Datierung]";Malerei;"WRM 1222";"Signatur, unten rechts: ""J. Greferath 23"".";"04.10.1923 Wallraf-Richartz-Museum, Köln. Bis 29.07.1944 Schloß Gaibach (?). Zum Verkauf nach Köln zurückgebracht. Seit 1945 Verbleib unbekannt.";2020-01-30;"Wallraf-Richartz-Museum & Fondation CorboudObermarspforten50667 Köln+49(0)221/221-22372+49(0)221/221-22629http://www.wallraf.museumDezernat für Kunst und Kultur der Stadt Köln (Museumsreferat, Provenienzforschung)+49(0)221/221-22520provenienzforschung@stadt-koeln.de";https://www.lostart.de/de/Verlust/585352;
Suchmeldung;Einzelobjekt;585354;"Braun, Augustin [Künstler:in]";"Bildnis einer Frau";;Malerei;"WRM 1547";"Wappen rechts: Familienwappen.";"Bis 1824 Ferdianand Franz Wallraf. 1824 Wallraf-Richartz-Museum, Köln. 1927 als Leihgabe an Rheinisches Museum Köln-Deutz. Seit 1945 Verbleib unbekannt.";2020-01-30;"Wallraf-Richartz-Museum & Fondation CorboudObermarspforten50667 Köln+49(0)221/221-22372+49(0)221/221-22629http://www.wallraf.museumDezernat für Kunst und Kultur der Stadt Köln (Museumsreferat, Provenienzforschung)+49(0)221/221-22520provenienzforschung@stadt-koeln.de";https://www.lostart.de/de/Verlust/585354;
Suchmeldung;Einzelobjekt;585362;"Unbekannt ((Französisch, lt. Karteikarte von einem Bonner Maler)) [Künstler:in]";Schlachtenbild;"1601/1800 [Datierung]";Malerei;"WRM 1846";"Teil eines Objektes: Zwei Gefechtsszenen. (Reitergefecht WRM 1860, 1942 nach Wien (private Sammlung) verkauft).";"Bis 1824 Ferdinand Franz Wallraf. Ab 1824 Wallraf-Richartz-Museum, Köln. Ab 1936 Gauamtsleitung. Bis 1944 Gebäude des ""Westdeutschen Beobachters"". Seit 1944 Verbleib unbekannt (vermutlich verbrannt).";2020-01-30;"Wallraf-Richartz-Museum & Fondation CorboudObermarspforten50667 Köln+49(0)221/221-22372+49(0)221/221-22629http://www.wallraf.museumDezernat für Kunst und Kultur der Stadt Köln (Museumsreferat, Provenienzforschung)+49(0)221/221-22520provenienzforschung@stadt-koeln.de";https://www.lostart.de/de/Verlust/585362;
Suchmeldung;Einzelobjekt;585363;"Geldorp, Gortzius ((?)) [Künstler:in]";"Catharina Pfingsthorn";"1612/1614 [Datierung]";Malerei;"WRM 1877";"Junge Frau Pfingshorn in schwarzem Kleid mit Pelz verbrämt, Faltenkragen, Spitzenkäppchen und Manschetten, goldener Gürtelkette, an einem grün behangenem Tisch, lebensgroß. Datierung: Ao 1614. Familienwappen (Pfingsthorn und Moers).";"Bis 1824 Ferdinand Franz Wallraf. 1824 Wallraf-Richartz-Museum, Köln. Ab 1927 als Leihgabe im Rheinischen Museum, Köln-Deutz. Seit 1945 Verbleib unbekannt.";2020-01-30;"Wallraf-Richartz-Museum & Fondation CorboudObermarspforten50667 Köln+49(0)221/221-22372+49(0)221/221-22629http://www.wallraf.museumDezernat für Kunst und Kultur der Stadt Köln (Museumsreferat, Provenienzforschung)+49(0)221/221-22520provenienzforschung@stadt-koeln.de";https://www.lostart.de/de/Verlust/585363;
Suchmeldung;Einzelobjekt;585364;"Unbekannt ((Kölnisch)) [Künstler:in]";"Bildnis eines jungen Mannes";"1700/1800 [Datierung]";Malerei;"WRM 1894";"Junger Mann am Tisch sitzend, auf dem Tisch drei kleine Kronen, oben ein Vogel.";"Ab 1927 als Leihgabe im Rheinischen Museum, Köln-Deutz. Seit 1945 Verbleib unbekannt.";2020-01-30;"Wallraf-Richartz-Museum & Fondation CorboudObermarspforten50667 Köln+49(0)221/221-22372+49(0)221/221-22629http://www.wallraf.museumDezernat für Kunst und Kultur der Stadt Köln (Museumsreferat, Provenienzforschung)+49(0)221/221-22520provenienzforschung@stadt-koeln.de";https://www.lostart.de/de/Verlust/585364;
Suchmeldung;Einzelobjekt;585366;"Unbekannt ((van der Smitten/Schmitten?)) [Künstler:in]";"Bildnis eines Geistlichen";"1800 [Datierung]";Malerei;"WRM 1956";;"Bis 1824 Ferdinand Franz Wallraf, Köln. 1824 Wallraf-Richartz-Museum, Köln. Ab 1927 als Leihgabe im Rheinischen Museum, Köln-Deutz. Seit 1945 Verbleib unbekannt.";2020-01-30;"Wallraf-Richartz-Museum & Fondation CorboudObermarspforten50667 Köln+49(0)221/221-22372+49(0)221/221-22629http://www.wallraf.museumDezernat für Kunst und Kultur der Stadt Köln (Museumsreferat, Provenienzforschung)+49(0)221/221-22520provenienzforschung@stadt-koeln.de";https://www.lostart.de/de/Verlust/585366;
Suchmeldung;Einzelobjekt;585368;"Unbekannt (Deutsch) [Künstler:in]";"Bildnis eines Mannes";"1700/1800 [Datierung]";Malerei;"WRM 2002";"Männliches Brustbild mit blonder Allongeperücke, schwarzem Kleid mit Spitzenjabot und Armspitzen.";"1824 Ferdinand Franz Wallraf. 1824 Wallraf-Richartz-Museum, Köln. Ab 1927 als Leihgabe im Rheinischen Museum, Köln-Deutz. Seit 1945 Verbleib unbekannt.";2020-01-30;"Wallraf-Richartz-Museum & Fondation CorboudObermarspforten50667 Köln+49(0)221/221-22372+49(0)221/221-22629http://www.wallraf.museumDezernat für Kunst und Kultur der Stadt Köln (Museumsreferat, Provenienzforschung)+49(0)221/221-22520provenienzforschung@stadt-koeln.de";https://www.lostart.de/de/Verlust/585368;
Suchmeldung;Einzelobjekt;585370;"Unbekannt (Niederländisch) [Künstler:in]";"Bildnis eines Mannes";"1601/1700 [Datierung]";Malerei;"WRM 2104";;"Wallraf-Richartz-Museum. Ab 1942 als Leihgabe im Haus der Rheinischen Heimat, Köln-Deutz. Seit 1945 Verbleib unbekannt.";2020-01-30;"Wallraf-Richartz-Museum & Fondation CorboudObermarspforten50667 Köln+49(0)221/221-22372+49(0)221/221-22629http://www.wallraf.museumDezernat für Kunst und Kultur der Stadt Köln (Museumsreferat, Provenienzforschung)+49(0)221/221-22520provenienzforschung@stadt-koeln.de";https://www.lostart.de/de/Verlust/585370;
Suchmeldung;Einzelobjekt;585372;"Greferath, Johannes [Künstler:in]";Gardasee;"1801/2000 [Datierung]";Malerei;"WRM 2371";"Signatur, unten rechts: ""J. Greferath"".";"23.04.1929 Wallraf-Richartz-Museum, Köln. Seit 1945 Verbleib unbekannt.";2020-01-30;"Wallraf-Richartz-Museum & Fondation CorboudObermarspforten50667 Köln+49(0)221/221-22372+49(0)221/221-22629http://www.wallraf.museumDezernat für Kunst und Kultur der Stadt Köln (Museumsreferat, Provenienzforschung)+49(0)221/221-22520provenienzforschung@stadt-koeln.de";https://www.lostart.de/de/Verlust/585372;
Suchmeldung;Einzelobjekt;585376;"Greferath, Johannes [Künstler:in]";Rheinufer;"1801/2000 [Datierung]";Malerei;"WRM 2450";;"1932 Wallraf-Richartz-Museum, Köln. Seit 1945 Verbleib ungeklärt.";2020-01-30;"Wallraf-Richartz-Museum & Fondation CorboudObermarspforten50667 Köln+49(0)221/221-22372+49(0)221/221-22629http://www.wallraf.museumDezernat für Kunst und Kultur der Stadt Köln (Museumsreferat, Provenienzforschung)+49(0)221/221-22520provenienzforschung@stadt-koeln.de";https://www.lostart.de/de/Verlust/585376;
Suchmeldung;Einzelobjekt;585378;"Flecken, Emil [Künstler:in]";Blumenstillleben;"1901/2000 [Datierung]";Malerei;"WRM 2582";;"Wallraf-Richartz-Museum, Köln. Seit 1945 Verbleib unbekannt.";2020-01-30;"Wallraf-Richartz-Museum & Fondation CorboudObermarspforten50667 Köln+49(0)221/221-22372+49(0)221/221-22629http://www.wallraf.museumDezernat für Kunst und Kultur der Stadt Köln (Museumsreferat, Provenienzforschung)+49(0)221/221-22520provenienzforschung@stadt-koeln.de";https://www.lostart.de/de/Verlust/585378;
Suchmeldung;Einzelobjekt;585382;"Greferath, Johannes [Künstler:in]";"Dorfteich unter Bäumen";"1901/2000 [Datierung]";Malerei;"WRM 2612";"Signatur unten rechts: ""Greferath"".";"1933 Köln, Wallraf-Richartz-Museum, Köln. Seit 1945 Verbleib unbekannt.";2020-01-30;"Wallraf-Richartz-Museum & Fondation CorboudObermarspforten50667 Köln+49(0)221/221-22372+49(0)221/221-22629http://www.wallraf.museumDezernat für Kunst und Kultur der Stadt Köln (Museumsreferat, Provenienzforschung)+49(0)221/221-22520provenienzforschung@stadt-koeln.de";https://www.lostart.de/de/Verlust/585382;
Suchmeldung;Einzelobjekt;583702;"Gebhardt, Eduard von [Künstler:in]";Frauenkopf;;Gemälde;;;"Sammlung Joseph Schönemann, Düsseldorf; Beschlagnahme der Vermögenswerte durch die Nationalsozialisten; Versteigerung durch Finanzamt Düsseldorf 1938";2019-06-25;"Von Trott zu Solz - Lammek (Rechtsanwälte - Notar)+49 (0) 30 59 00 33 00kanzlei@vontrott-lammek.de";https://www.lostart.de/de/Verlust/583702;
Suchmeldung;Einzelobjekt;583703;"Hagemann, Oskar [Künstler:in]";"Mädchen, Apfel schälend";;Gemälde;;;"Sammlung Joseph Schönemann, Düsseldorf; Beschlagnahme der Vermögenswerte durch die Nationalsozialisten; Versteigerung durch Finanzamt Düsseldorf 1938";2019-06-25;"Von Trott zu Solz - Lammek (Rechtsanwälte - Notar)+49 (0) 30 59 00 33 00kanzlei@vontrott-lammek.de";https://www.lostart.de/de/Verlust/583703;
Suchmeldung;Einzelobjekt;583704;"Jarnberg, ? [Künstler:in]";Landschaft;;Gemälde;;;"Sammlung Joseph Schönemann, Düsseldorf; Beschlagnahme der Vermögenswerte durch die Nationalsozialisten; Versteigerung durch Finanzamt Düsseldorf 1938";2019-06-25;"Von Trott zu Solz - Lammek (Rechtsanwälte - Notar)+49 (0) 30 59 00 33 00kanzlei@vontrott-lammek.de";https://www.lostart.de/de/Verlust/583704;
Suchmeldung;Einzelobjekt;583705;"Kessel, Jan van [Künstler:in]";"Gracht in einer Stadt";;Gemälde;;;"Sammlung Joseph Schönemann, Düsseldorf; Beschlagnahme der Vermögenswerte durch die Nationalsozialisten; Versteigerung durch Finanzamt Düsseldorf 1938";2019-06-25;"Von Trott zu Solz - Lammek (Rechtsanwälte - Notar)+49 (0) 30 59 00 33 00kanzlei@vontrott-lammek.de";https://www.lostart.de/de/Verlust/583705;
Suchmeldung;Einzelobjekt;583706;"Madrid, de [Künstler:in]";Kircheninneres;;Gemälde;;;"Sammlung Joseph Schönemann, Düsseldorf; Beschlagnahme der Vermögenswerte durch die Nationalsozialisten; Versteigerung durch Finanzamt Düsseldorf 1938";2019-06-25;"Von Trott zu Solz - Lammek (Rechtsanwälte - Notar)+49 (0) 30 59 00 33 00kanzlei@vontrott-lammek.de";https://www.lostart.de/de/Verlust/583706;
Suchmeldung;Einzelobjekt;583707;"Reimer Gowyn (?) [Künstler:in]";Kücheninterieur;;Gemälde;;;"Sammlung Joseph Schönemann, Düsseldorf; Beschlagnahme der Vermögenswerte durch die Nationalsozialisten; Versteigerung durch Finanzamt Düsseldorf 1938";2019-06-25;"Von Trott zu Solz - Lammek (Rechtsanwälte - Notar)+49 (0) 30 59 00 33 00kanzlei@vontrott-lammek.de";https://www.lostart.de/de/Verlust/583707;
Suchmeldung;Einzelobjekt;583708;"Techmeier, W. [Künstler:in]";Stillleben;;Gemälde;;;"Sammlung Joseph Schönemann, Düsseldorf; Beschlagnahme der Vermögenswerte durch die Nationalsozialisten; Versteigerung durch Finanzamt Düsseldorf 1938";2019-06-25;"Von Trott zu Solz - Lammek (Rechtsanwälte - Notar)+49 (0) 30 59 00 33 00kanzlei@vontrott-lammek.de";https://www.lostart.de/de/Verlust/583708;
Suchmeldung;Einzelobjekt;583709;"Thiem, Paul [Künstler:in]";"Niederrheinische Landschaft";;Gemälde;;;"Sammlung Joseph Schönemann, Düsseldorf; Beschlagnahme der Vermögenswerte durch die Nationalsozialisten; Versteigerung durch Finanzamt Düsseldorf 1938";2019-06-25;"Von Trott zu Solz - Lammek (Rechtsanwälte - Notar)+49 (0) 30 59 00 33 00kanzlei@vontrott-lammek.de";https://www.lostart.de/de/Verlust/583709;
Suchmeldung;Einzelobjekt;583710;"Uhde, Fritz von [Künstler:in]";"Frau am Wasser";;Gemälde;;;"Sammlung Joseph Schönemann, Düsseldorf; Beschlagnahme der Vermögenswerte durch die Nationalsozialisten; Versteigerung durch Finanzamt Düsseldorf 1938";2019-06-25;"Von Trott zu Solz - Lammek (Rechtsanwälte - Notar)+49 (0) 30 59 00 33 00kanzlei@vontrott-lammek.de";https://www.lostart.de/de/Verlust/583710;
Suchmeldung;Einzelobjekt;583711;"Weisgerber, Carl [Künstler:in]";Hahnenkampf;;Gemälde;;;"Sammlung Joseph Schönemann, Düsseldorf; Beschlagnahme der Vermögenswerte durch die Nationalsozialisten; Versteigerung durch Finanzamt Düsseldorf 1938";2019-06-25;"Von Trott zu Solz - Lammek (Rechtsanwälte - Notar)+49 (0) 30 59 00 33 00kanzlei@vontrott-lammek.de";https://www.lostart.de/de/Verlust/583711;
Suchmeldung;Einzelobjekt;583697;"Bochmann, Gregor von [Künstler:in]";"Kleine estnische Landschaft";;Gemälde;;;"Sammlung Joseph Schönemann, Düsseldorf; Beschlagnahme der Vermögenswerte durch die Nationalsozialisten; Versteigerung durch Finanzamt Düsseldorf 1938; Verbleib unbekannt";2019-06-25;"Von Trott zu Solz - Lammek (Rechtsanwälte - Notar)+49 (0) 30 59 00 33 00kanzlei@vontrott-lammek.de";https://www.lostart.de/de/Verlust/583697;
Suchmeldung;Einzelobjekt;583698;"Bochmann, Gregor von [Künstler:in]";"Kleine estnische Landschaft";;Gemälde;;;"Sammlung Joseph Schönemann, Düsseldorf; Beschlagnahme der Vermögenswerte durch die Nationalsozialisten; Versteigerung durch Finanzamt Düsseldorf 1938";2019-06-25;"Von Trott zu Solz - Lammek (Rechtsanwälte - Notar)+49 (0) 30 59 00 33 00kanzlei@vontrott-lammek.de";https://www.lostart.de/de/Verlust/583698;
Suchmeldung;Einzelobjekt;583699;"Braun, ? [Künstler:in]";Schimmel;;Gemälde;;;"Sammlung Joseph Schönemann, Düsseldorf; Beschlagnahme der Vermögenswerte durch die Nationalsozialisten; Versteigerung durch Finanzamt Düsseldorf 1938";2019-06-25;"Von Trott zu Solz - Lammek (Rechtsanwälte - Notar)+49 (0) 30 59 00 33 00kanzlei@vontrott-lammek.de";https://www.lostart.de/de/Verlust/583699;
Suchmeldung;Einzelobjekt;583700;"Burgh, Hendrick van der [Künstler:in]";Bauerninterieur;;Gemälde;;;"Sammlung Joseph Schönemann, Düsseldorf; Beschlagnahme der Vermögenswerte durch die Nationalsozialisten; Versteigerung durch Finanzamt Düsseldorf 1938";2019-06-25;"Von Trott zu Solz - Lammek (Rechtsanwälte - Notar)+49 (0) 30 59 00 33 00kanzlei@vontrott-lammek.de";https://www.lostart.de/de/Verlust/583700;
