Meldungsart;Datensatzart;"Lost Art ID";Hersteller/Künstler/Autor:in;Titel;Datierung;Objektart;Inventarnummer/Signatur;Beschreibung;Provenienz;"Veröffentlicht seit";Kontakt;Link;"Literatur / Quelle"
Suchmeldung;Einzelobjekt;5000002309;"Schmidt-Rottluff, Karl [Künstler:in]";"3 Porträts Ruth Arndt";;Malerei;;Aquarelle;"Familie Arndt, Sommerhaus Beerberg/Marklissa; nach 1938 verschollen";2003-08-14;"Peri Arndt (Enkelin Dr. Adolf Arndt)+49 (0)174 - 211 59 58arndt.sarrafzadeh@t-online.de";https://www.lostart.de/de/Verlust/5000002309;
Suchmeldung;Einzelobjekt;5000002296;"Scholz, Werner [Künstler:in]";Reliquienschrein;;Malerei;;;"Familie Arndt, Sommerhaus Beerberg/Marklissa; nach 1938 verschollen";2003-08-14;"Peri Arndt (Enkelin Dr. Adolf Arndt)+49 (0)174 - 211 59 58arndt.sarrafzadeh@t-online.de";https://www.lostart.de/de/Verlust/5000002296;
Suchmeldung;Einzelobjekt;5000002295;"Scholz, Werner [Künstler:in]";"Die alte Nonne";;Malerei;;;"Familie Arndt, Sommerhaus Beerberg/Marklissa; nach 1938 verschollen";2003-08-14;"Peri Arndt (Enkelin Dr. Adolf Arndt)+49 (0)174 - 211 59 58arndt.sarrafzadeh@t-online.de";https://www.lostart.de/de/Verlust/5000002295;
Suchmeldung;Einzelobjekt;5000002297;"Müller, Otto [Künstler:in]";"Zwei Mädchen am See";;Malerei;;;"Familie Arndt, Sommerhaus Beerberg/Marklissa; nach 1938 verschollen";2003-08-14;"Peri Arndt (Enkelin Dr. Adolf Arndt)+49 (0)174 - 211 59 58arndt.sarrafzadeh@t-online.de";https://www.lostart.de/de/Verlust/5000002297;
Suchmeldung;Einzelobjekt;199982;"Lauri, Filippo [Künstler:in]";"Jupiter und Io von Juno belauscht";;Malerei;"Inv.-Nr. JESt: 1015";;;2001-08-08;"Kulturstiftung Dessau Wörlitz
HauptverwaltungSchloss Großkühnau06846 Dessau-Roßlau+49 (0)340 646 15 0+49 (0)340 646 15 10http://www.gartenreich.comDr. Anette Froesch (Leiterin Abteilung Schlösser und Sammlungen)anette.froesch@gartenreich.deProf. Dr. Harald Meller (Kommissarischer Direktor und Vorstand)+49 (0) 340 646 1540sekretariat@gartenreich.de";https://www.lostart.de/de/Verlust/199982;
Suchmeldung;Einzelobjekt;596684;"Carlevarijs, Luca [Künstler:in]";"Ansicht von Korfu";"1720/1728 [Datierung]";Gemälde;;"Vedutenmalerei. Eine große, in Öl gemalte Ansicht der Stadt Korfu, gesehen von der Straße von Korfu aus.Die Gemälde aus den Beständen des Feldmarschalls Matthias Johann von der Schulenburg waren nach heutigem Stand des Wissens auf der Rückseite wortgleich oder annähernd wortgleich zu den Einträgen in seinen Inventaren beschriftet. Bei Restaurierungen können diese Beschriftungen aber zumindest teilweise entfernt worden sein.";"Seit mindestens 1736 mit einem Pendant in der Sammlung des General-Feldmarschalls in venezianischen Diensten Matthias Johann von der Schulenburg (* 1661, † 1747), mit Sicherheit von diesem bei dem Künstler, der im letzten Jahren seines Lebens nicht mehr tätig gewesen ist, in Auftrag gegeben; mit der ersten Versendung von Gemälden nach Berlin am 12. 9. 1736 in das von dessen Neffen Adolf Friedrich von der Schulenburg (* 1685, † 1741) bewohnte Familienpalais in der dortigen Wilhelmstraße verbracht; nach dessen Tod in der Schlacht von Mollwitz in Besitz von dessen Bruder Christian Günther (* 1684, † 1765); Fideikommiss Matthias Johann von der Schulenburg; durch Erbfolge in den Wolfsburger Zweig der Familie von der Schulenburg; vor 1942 Schloß Wolfsburg (bis 1932 Landkreis Gardelegen, Provinz Sachsen; danach Landkreis Gifhorn, Provinz Hannover; heute Stadt Wolfsburg); danach verbracht in das neuerbaute Schloss Neumühle bei Tangeln, Gemeinde Beetzendorf im Altmarkkreis Salzwedel; wohl wegen seiner Größe 1945 bei der Flucht der Familie von der Schulenburg dort zurückgelassen. Zuletzt nachgewiesen durch Parisius/Brinkmann 1897; Verbleib unbekannt";2021-11-19;"Graf von der Schulenburg (Verwaltung)+49 (0) 5363 97190info@graf-schulenburg.de";https://www.lostart.de/de/Verlust/596684;"Dokumentiert in der Sammlung des Feldmarschalls M. J. von der Schulenburg und seiner Erben in Venedig und Berlin durch eine Vielzahl von Inventaren und andere zeitgenössische Quellen; Inventarliste zum Fideikommiss Friedrich Gebhard Werner von der Schulenburg-Wolfsburg, 7. 8. 1860, Hausarchiv der Grafen von der Schulenburg-Wolfsburg, 1169, unter Teil B „Verzeichnis …“, S. 277; [wohl]: unbezeichnete Inventarliste von Schloß Wolfsburg, Winter 1889, Wolfsburg, Hausarchiv der Grafen von der Schulenburg-Wolfsburg, 659; Parisius, A./Brinkmann, A.: Beschreibende Darstellung der älteren Bau- und Kunstdenkmäler des Kreises Gardelegen, Hrsg.: Historische Commission der Provinz Sachsen, Halle a. d. Saale 1897, S. 203; Binion, A.: La galleria scomparsa del maresciallo von der Schulenburg, Milano 1990, S. 116 (mit falschen Annahmen zur weiteren Provenienz nach Tod des Feldmarschalls M. J. von der Schulenburg); Krellig, H.: Feldmarschall und Kunstsammler. Matthias Johann von der Schulenburg (1661–1747). Ein unbekannter Bestand von Kunstwerken aus seiner Sammlung im Besitz der Grafen von der Schulenburg-Wolfsburg, Wolfsburg 2011 [Wolfsburger Beiträge zur Geschichte und Kunstgeschichte, 4], S. 66."
Suchmeldung;Einzelobjekt;596685;"Carlevarijs, Luca [Künstler:in]";"Ansicht von Korfu";"1720/1728 [Datierung]";Gemälde;;"Vedutenmalerei. Eine große, in Öl gemalte Ansicht der Insel Korfu und des gegenüberliegenden Festlandes.Die Gemälde aus den Beständen des Feldmarschalls Matthias Johann von der Schulenburg waren nach heutigem Stand des Wissens auf der Rückseite wortgleich oder annähernd wortgleich zu den Einträgen in seinen Inventaren beschriftet. Bei Restaurierungen können diese Beschriftungen aber zumindest teilweise entfernt worden sein.";"Seit mindestens 1736 mit einem Pendant in der Sammlung des General-Feldmarschalls in venezianischen Diensten Matthias Johann von der Schulenburg (* 1661, † 1747), mit Sicherheit von diesem bei dem Künstler, der im letzten Jahren seines Lebens nicht mehr tätig gewesen ist, in Auftrag gegeben; mit der ersten Versendung von Gemälden nach Berlin am 12. 9. 1736 in das von dessen Neffen Adolf Friedrich von der Schulenburg (* 1685, † 1741) bewohnte Familienpalais in der dortigen Wilhelmstraße verbracht; nach dessen Tod in der Schlacht von Mollwitz in Besitz von dessen Bruder Christian Günther (* 1684, † 1765); Fideikommiss Matthias Johann von der Schulenburg; durch Erbfolge in den Wolfsburger Zweig der Familie von der Schulenburg; vor 1942 Schloß Wolfsburg (bis 1932 Landkreis Gardelegen, Provinz Sachsen; danach Landkreis Gifhorn, Provinz Hannover; heute Stadt Wolfsburg); danach verbracht in das neuerbaute Schloss Neumühle bei Tangeln, Gemeinde Beetzendorf im Altmarkkreis Salzwedel; wohl wegen seiner Größe 1945 bei der Flucht der Familie von der Schulenburg dort zurückgelassen. Zuletzt nachgewiesen durch Parisius/Brinkmann 1897; Verbleib unbekannt";2021-11-19;"Graf von der Schulenburg (Verwaltung)+49 (0) 5363 97190info@graf-schulenburg.de";https://www.lostart.de/de/Verlust/596685;"Dokumentiert in der Sammlung des Feldmarschalls M. J. von der Schulenburg und seiner Erben in Venedig und Berlin durch eine Vielzahl von Inventaren und andere zeitgenössische Quellen; Inventarliste zum Fideikommiss Friedrich Gebhard Werner von der Schulenburg-Wolfsburg, 7. 8. 1860, Hausarchiv der Grafen von der Schulenburg-Wolfsburg, 1169, unter Teil B „Verzeichnis …“, S. 277; [wohl]: unbezeichnete Inventarliste von Schloß Wolfsburg, Winter 1889, Wolfsburg, Hausarchiv der Grafen von der Schulenburg-Wolfsburg, 659; Parisius, A./Brinkmann, A.: Beschreibende Darstellung der älteren Bau- und Kunstdenkmäler des Kreises Gardelegen, Hrsg.: Historische Commission der Provinz Sachsen, Halle a. d. Saale 1897, S. 203; Binion, A.: La galleria scomparsa del maresciallo von der Schulenburg, Milano 1990, S. 116 (mit falschen Annahmen zur weiteren Provenienz nach Tod des Feldmarschalls M. J. von der Schulenburg); Krellig, H.: Feldmarschall und Kunstsammler. Matthias Johann von der Schulenburg (1661–1747). Ein unbekannter Bestand von Kunstwerken aus seiner Sammlung im Besitz der Grafen von der Schulenburg-Wolfsburg, Wolfsburg 2011 [Wolfsburger Beiträge zur Geschichte und Kunstgeschichte, 4], S. 66."
Suchmeldung;Einzelobjekt;596710;"Unbekannt (Deutsch) [Künstler:in]";"Königin Sophie Dorothea von Hannover, Gemahlin von König Friedrich Wilhelm I. (* 1687, † 1757)";;Gemälde;;;"Nach Hammerschmidt 2001 „ein Geschenk des Königs Friedrich Wilhelm I. an Gr. Adolf Friedrich v. d. Schulenburg.“; durch Vererbung weitergegeben innerhalb des Hauses von der Schulenburg-Wolfsburg; vor 1942 Schloß Wolfsburg (bis 1932 Landkreis Gardelegen, Provinz Sachsen; danach Landkreis Gifhorn, Provinz Hannover; heute Stadt Wolfsburg); danach verbracht in das neuerbaute Schloss Neumühle bei Tangeln, Gemeinde Beetzendorf im Altmarkkreis Salzwedel, ehemaliger Standort: „Halle, 1. Obergeschoß“; 1945 Zurücklassung bei dem fluchtartigen Verlassen von Schloß Neumühle vor der Übernahme durch die Rote Armee; Schloss Neumühle wurde der Sowjetischen Besatzungszone zugeordnet und enteignet; Verbleib unbekannt";2021-11-19;"Graf von der Schulenburg (Verwaltung)+49 (0) 5363 97190info@graf-schulenburg.de";https://www.lostart.de/de/Verlust/596710;"Hammerschmidt, G. (i. A. der Grafen von der Schulenburg-Wolfsburg): Das Schicksal des Kunst- und Kulturgutes von Schloss Wolfsburg-Neumühle im Altmarkkreis Salzwedel ab dem Zeitpunkt des Erlasses der Provinzialverwaltung Sachsen, Stand: November 2001 (Maschinenschrift, Nov. 2001, Hausarchiv der Grafen von der Schulenburg-Wolfsburg), lfd. Nr. 06.093."
Suchmeldung;Einzelobjekt;312898;"Daumier, Honoré [Künstler:in]";"Kinder unter einem Baum";"1850/1854 [Datierung]";Malerei;;;;2006-02-13;"Rowland & Petroff (Attorneys at Law)+1 212-685-5509info@rowlandlaw.com";https://www.lostart.de/de/Verlust/312898;
Suchmeldung;Einzelobjekt;623365;"Pissarro, Camille Jacob [Künstler:in]";"Haus auf dem Land";;Gemälde;;"derzeit keine weiteren Angaben verfügbar";"Sammlung Edgar Dreyfus. Der Inhalt des Hôtel particulier am 24 square du Bois de Boulogne, Paris (16) wurde nach Angaben eines Zeugen im Sommer 1943 von den deutschen Behörden beschlagnahmt. Verbleib unbekannt";2024-09-26;"Mondex Corporationinfo@mondexcorp.com";https://www.lostart.de/de/Verlust/623365;"Berlin, Germany, Landesarchiv, Brüg claim, 51 WGA 725_62; Viviane Forrester, Ce soir après la guerre, 1992; France, Paris, Archives de Paris, Building requisition 24 square Bois de Boulogne Edgar Dreyfus, 143w483; Paris, France, Archives de Paris, Dommages de guerre, Edgar Dreyfus 1131W2 dossier 1235 DOM; La Courneuve, France, Archives diplomatiques, 209SUP627; La Courneuve, France, Archives diplomatiques, 209SUP502"
Suchmeldung;Einzelobjekt;623366;"Martin, Henry [Künstler:in]";"Junge Frau in einem Garten";;Gemälde;;"derzeit keine weiteren Angaben verfügbar";"Sammlung Edgar Dreyfus. Der Inhalt des Hôtel particulier am 24 square du Bois de Boulogne, Paris (16) wurde nach Angaben eines Zeugen im Sommer 1943 von den deutschen Behörden beschlagnahmt. Verbleib unbekannt";2024-09-26;"Mondex Corporationinfo@mondexcorp.com";https://www.lostart.de/de/Verlust/623366;"Berlin, Germany, Landesarchiv, Brüg claim, 51 WGA 725_62; Viviane Forrester, Ce soir après la guerre, 1992; France, Paris, Archives de Paris, Building requisition 24 square Bois de Boulogne Edgar Dreyfus, 143w483; Paris, France, Archives de Paris, Dommages de guerre, Edgar Dreyfus 1131W2 dossier 1235 DOM; La Courneuve, France, Archives diplomatiques, 209SUP627; La Courneuve, France, Archives diplomatiques, 209SUP502"
Suchmeldung;Einzelobjekt;623367;"Lépine, Stanislas [Künstler:in]";"Die Seine am Pont Neuf";;Gemälde;;"derzeit keine weiteren Angaben verfügbar";"Sammlung Edgar Dreyfus. Der Inhalt des Hôtel particulier am 24 square du Bois de Boulogne, Paris (16) wurde nach Angaben eines Zeugen im Sommer 1943 von den deutschen Behörden beschlagnahmt. Verbleib unbekannt";2024-09-26;"Mondex Corporationinfo@mondexcorp.com";https://www.lostart.de/de/Verlust/623367;"Berlin, Germany, Landesarchiv, Brüg claim, 51 WGA 725_62; Viviane Forrester, Ce soir après la guerre, 1992; France, Paris, Archives de Paris, Building requisition 24 square Bois de Boulogne Edgar Dreyfus, 143w483; Paris, France, Archives de Paris, Dommages de guerre, Edgar Dreyfus 1131W2 dossier 1235 DOM; La Courneuve, France, Archives diplomatiques, 209SUP627; La Courneuve, France, Archives diplomatiques, 209SUP502"
Suchmeldung;Einzelobjekt;623368;"Unbekannt (Französische Schule) [Künstler:in]";"Die kleinen Gärtner";;Gemälde;;"derzeit keine weiteren Angaben verfügbar";"Sammlung Edgar Dreyfus. Der Inhalt des Hôtel particulier am 24 square du Bois de Boulogne, Paris (16) wurde nach Angaben eines Zeugen im Sommer 1943 von den deutschen Behörden beschlagnahmt. Verbleib unbekannt";2024-09-26;"Mondex Corporationinfo@mondexcorp.com";https://www.lostart.de/de/Verlust/623368;"Berlin, Germany, Landesarchiv, Brüg claim, 51 WGA 725_62; Viviane Forrester, Ce soir après la guerre, 1992; France, Paris, Archives de Paris, Building requisition 24 square Bois de Boulogne Edgar Dreyfus, 143w483; Paris, France, Archives de Paris, Dommages de guerre, Edgar Dreyfus 1131W2 dossier 1235 DOM; La Courneuve, France, Archives diplomatiques, 209SUP627; La Courneuve, France, Archives diplomatiques, 209SUP502"
Suchmeldung;Einzelobjekt;623373;"Lebourg [Künstler:in]";"Notre Dame bei untergehender Sonne";;Gemälde;;"derzeit keine weiteren Angaben verfügbar";"Sammlung Edgar Dreyfus. Der Inhalt des Hôtel particulier am 24 square du Bois de Boulogne, Paris (16) wurde nach Angaben eines Zeugen im Sommer 1943 von den deutschen Behörden beschlagnahmt. Verbleib unbekannt";2024-09-26;"Mondex Corporationinfo@mondexcorp.com";https://www.lostart.de/de/Verlust/623373;"Berlin, Germany, Landesarchiv, Brüg claim, 51 WGA 725_62; Viviane Forrester, Ce soir après la guerre, 1992; France, Paris, Archives de Paris, Building requisition 24 square Bois de Boulogne Edgar Dreyfus, 143w483; Paris, France, Archives de Paris, Dommages de guerre, Edgar Dreyfus 1131W2 dossier 1235 DOM; La Courneuve, France, Archives diplomatiques, 209SUP627; La Courneuve, France, Archives diplomatiques, 209SUP502"
Suchmeldung;Einzelobjekt;623375;"Boudin, Eugène [Künstler:in]";"Segelmacher im Hafen von Le Havre";;Gemälde;;"derzeit keine weiteren Angaben verfügbar";"Sammlung Edgar Dreyfus. Der Inhalt des Hôtel particulier am 24 square du Bois de Boulogne, Paris (16) wurde nach Angaben eines Zeugen im Sommer 1943 von den deutschen Behörden beschlagnahmt. Verbleib unbekannt";2024-09-26;"Mondex Corporationinfo@mondexcorp.com";https://www.lostart.de/de/Verlust/623375;"Berlin, Germany, Landesarchiv, Brüg claim, 51 WGA 725_62; Viviane Forrester, Ce soir après la guerre, 1992; France, Paris, Archives de Paris, Building requisition 24 square Bois de Boulogne Edgar Dreyfus, 143w483; Paris, France, Archives de Paris, Dommages de guerre, Edgar Dreyfus 1131W2 dossier 1235 DOM; La Courneuve, France, Archives diplomatiques, 209SUP627; La Courneuve, France, Archives diplomatiques, 209SUP502"
Suchmeldung;Einzelobjekt;623374;"Courbet, Gustave [Künstler:in]";"Fluss mit Personen";;Gemälde;;"derzeit keine weiteren Angaben verfügbar";"Sammlung Edgar Dreyfus. Der Inhalt des Hôtel particulier am 24 square du Bois de Boulogne, Paris (16) wurde nach Angaben eines Zeugen im Sommer 1943 von den deutschen Behörden beschlagnahmt. Verbleib unbekannt";2024-09-26;"Mondex Corporationinfo@mondexcorp.com";https://www.lostart.de/de/Verlust/623374;"Berlin, Germany, Landesarchiv, Brüg claim, 51 WGA 725_62; Viviane Forrester, Ce soir après la guerre, 1992; France, Paris, Archives de Paris, Building requisition 24 square Bois de Boulogne Edgar Dreyfus, 143w483; Paris, France, Archives de Paris, Dommages de guerre, Edgar Dreyfus 1131W2 dossier 1235 DOM; La Courneuve, France, Archives diplomatiques, 209SUP627; La Courneuve, France, Archives diplomatiques, 209SUP502"
Suchmeldung;Einzelobjekt;623376;"Avercamp [Künstler:in]";"Eislaufszene (mit zahlreichen Personen)";;Gemälde;;"derzeit keine weiteren Angaben verfügbar";"Sammlung Edgar Dreyfus. Der Inhalt des Hôtel particulier am 24 square du Bois de Boulogne, Paris (16) wurde nach Angaben eines Zeugen im Sommer 1943 von den deutschen Behörden beschlagnahmt. Verbleib unbekannt";2024-09-26;"Mondex Corporationinfo@mondexcorp.com";https://www.lostart.de/de/Verlust/623376;"Berlin, Germany, Landesarchiv, Brüg claim, 51 WGA 725_62; Viviane Forrester, Ce soir après la guerre, 1992; France, Paris, Archives de Paris, Building requisition 24 square Bois de Boulogne Edgar Dreyfus, 143w483; Paris, France, Archives de Paris, Dommages de guerre, Edgar Dreyfus 1131W2 dossier 1235 DOM; La Courneuve, France, Archives diplomatiques, 209SUP627; La Courneuve, France, Archives diplomatiques, 209SUP502"
Suchmeldung;Einzelobjekt;623371;"Oudry, Jean-Baptiste [Künstler:in]";"Aufbruch zur Jagd";;Gemälde;;"Rahmen aus geschnitztem und vergoldetem Holz, zeitgemäß Epoche Louis XV; zusammengehörig mit dem Gemälde ""Heimkehr von der Jagd"",  Lost Art-Eintrag ID 623372";"Sammlung Edgar Dreyfus. Der Inhalt des Hôtel particulier am 24 square du Bois de Boulogne, Paris (16) wurde nach Angaben eines Zeugen im Sommer 1943 von den deutschen Behörden beschlagnahmt. Verbleib unbekannt";2024-09-26;"Mondex Corporationinfo@mondexcorp.com";https://www.lostart.de/de/Verlust/623371;"Berlin, Germany, Landesarchiv, Brüg claim, 51 WGA 725_62; Viviane Forrester, Ce soir après la guerre, 1992; France, Paris, Archives de Paris, Building requisition 24 square Bois de Boulogne Edgar Dreyfus, 143w483; Paris, France, Archives de Paris, Dommages de guerre, Edgar Dreyfus 1131W2 dossier 1235 DOM; La Courneuve, France, Archives diplomatiques, 209SUP627; La Courneuve, France, Archives diplomatiques, 209SUP502"
Suchmeldung;Einzelobjekt;623372;"Oudry, Jean-Baptiste [Künstler:in]";"Heimkehr von der Jagd";;Gemälde;;"Rahmen aus geschnitztem und vergoldetem Holz, zeitgemäß Epoche Louis XV; zusammengehörig mit dem Gemälde ""Aufbruch zur Jagd"",  Lost Art-Eintrag ID 623371";"Sammlung Edgar Dreyfus. Der Inhalt des Hôtel particulier am 24 square du Bois de Boulogne, Paris (16) wurde nach Angaben eines Zeugen im Sommer 1943 von den deutschen Behörden beschlagnahmt. Verbleib unbekannt";2024-09-26;"Mondex Corporationinfo@mondexcorp.com";https://www.lostart.de/de/Verlust/623372;"Berlin, Germany, Landesarchiv, Brüg claim, 51 WGA 725_62; Viviane Forrester, Ce soir après la guerre, 1992; France, Paris, Archives de Paris, Building requisition 24 square Bois de Boulogne Edgar Dreyfus, 143w483; Paris, France, Archives de Paris, Dommages de guerre, Edgar Dreyfus 1131W2 dossier 1235 DOM; La Courneuve, France, Archives diplomatiques, 209SUP627; La Courneuve, France, Archives diplomatiques, 209SUP502"
Suchmeldung;Einzelobjekt;312900;"Manet, Edouard [Künstler:in]";"Hund Bob";"1876 [Datierung]";Malerei;;;"2022 gütliche EinigungStatusgütliche Einigung";2006-02-13;"Rowland & Petroff (Attorneys at Law)+1 212-685-5509info@rowlandlaw.com";https://www.lostart.de/de/Verlust/312900;
Suchmeldung;Einzelobjekt;399598;"Renoir, Auguste [Künstler:in]";"Kleines Blumenstück / drei Rosen auf einem Tisch verstreut";;Malerei;;;"Beschlagnahme in Berlin durch die Gestapo";2008-02-08;"von Trott zu Solz Lammek (Rechtsanwälte Notar)+49 (0) 30 59 00 33 0-0kanzlei@vontrott-lammek.de";https://www.lostart.de/de/Verlust/399598;
Suchmeldung;Einzelobjekt;5000001452;"Renoir, Auguste [Künstler:in]";"Schwager des Künstlers";;Malerei;;;"Otto Gerstenberg; Margarethe Scharf; Verlust am Auslagerungsort Flakturm am Zoo, Berlin 1945";2003-02-04;;https://www.lostart.de/de/Verlust/5000001452;
Suchmeldung;Einzelobjekt;5000001450;"Renoir, Auguste [Künstler:in]";"Liebespaar (Im Garten) Dans le jardin";"1885 [Datierung]";Malerei;;"Signiert und datiert unten rechts: Renoir 85";"Otto Gerstenberg; Margarethe Scharf; Verlust am Auslagerungsort Flakturm am Zoo, Berlin 1945";2003-02-04;;https://www.lostart.de/de/Verlust/5000001450;
Suchmeldung;Einzelobjekt;522475;"Renoir, Auguste [Künstler:in]";"Kleines Bild (Titel unbekannt)";;Malerei;;"Quelle: Privatarchiv Knize";"Sammlung Annie und Friedrich Wolff-Knize, Wien; Verlust aufgrund nationalsozialistischer Verfolgung, Wien 1938";2014-12-18;"Rosbach & Fremy (Rechtsanwälte)Tel:  +49 (0) 30 280 70 71/72office@ra-rff.de";https://www.lostart.de/de/Verlust/522475;
Suchmeldung;Einzelobjekt;5000001451;"Renoir, Auguste [Künstler:in]";Blumenstilleben;;Malerei;;;"Otto Gerstenberg; Margarethe Scharf; Verlust am Auslagerungsort Flakturm am Zoo, Berlin 1945";2003-02-04;;https://www.lostart.de/de/Verlust/5000001451;
Suchmeldung;Einzelobjekt;5000001453;"Renoir, Auguste [Künstler:in]";"Schwägerin des Künstlers";;Malerei;;;"Otto Gerstenberg; Margarethe Scharf; Verlust am Auslagerungsort Flakturm am Zoo, Berlin 1945";2003-02-04;;https://www.lostart.de/de/Verlust/5000001453;
Suchmeldung;Einzelobjekt;9759;"Oldach, Julius [Künstler:in]";"Die Familie des Düsseldorfer Kunstverlegers F. Buddeus bei der Hausmusik";;Malerei;1331;;"1941 von der Kunstausstellung Kühl, Dresden, erworben. 1945 am Auslagerungsort Rochlitz abhanden gekommen.";2001-08-08;"Katharinenstr. 1004109 Leipzig(0341) 216 999 0(0341) 216 999 99mdbk@leipzig.dehttp://www.mdbk.deDr. Jan Nicolaisen  (Chefkurator Malerei und Skulptur)+49 (0) 341 216 999 45jan.nicolaisen@leipzig.deDr. Jeannette Stoschek (Chefkuratorin Grafische Sammlung)+49 (0) 341 216 999 40jeannette.stoschek@leipzig.de";https://www.lostart.de/de/Verlust/9759;
Suchmeldung;Einzelobjekt;9587;"Unbekannt [Künstler:in]";"Amor von Psyche im Schlafe betrachtet";;Malerei;380;;"1853 (?) Schletterscher Nachlaß (?), Leipzig. Seit 1946 vermisst.";2001-08-08;"Katharinenstr. 1004109 Leipzig(0341) 216 999 0(0341) 216 999 99mdbk@leipzig.dehttp://www.mdbk.deDr. Jan Nicolaisen  (Chefkurator Malerei und Skulptur)+49 (0) 341 216 999 45jan.nicolaisen@leipzig.deDr. Jeannette Stoschek (Chefkuratorin Grafische Sammlung)+49 (0) 341 216 999 40jeannette.stoschek@leipzig.de";https://www.lostart.de/de/Verlust/9587;
Suchmeldung;Einzelobjekt;9623;"Mignard, Pierre [Künstler:in]";"Weibliches Bildnis";;Malerei;794;"Signatur: Rechts unten: P.M. (Monogramm).";"1903 Stiftung Julius Otto Gottschald, Leipzig. 1945 am Auslagerungsort Rochlitz abhanden gekommen.";2001-08-08;"Katharinenstr. 1004109 Leipzig(0341) 216 999 0(0341) 216 999 99mdbk@leipzig.dehttp://www.mdbk.deDr. Jan Nicolaisen  (Chefkurator Malerei und Skulptur)+49 (0) 341 216 999 45jan.nicolaisen@leipzig.deDr. Jeannette Stoschek (Chefkuratorin Grafische Sammlung)+49 (0) 341 216 999 40jeannette.stoschek@leipzig.de";https://www.lostart.de/de/Verlust/9623;
Suchmeldung;Einzelobjekt;8168;"Boser, Friedrich [Künstler:in]";"Kleine Blumenverkäuferin";"1849 [Datierung]";Malerei;15;"Signatur: F. Boser 1849.";"1863 Vermächtnis Amalie Friederike Falcke. 4.12.1943 beim Bombenangriff im Museum am Augustusplatz vernichtet.Verlustgeschichte (Leipzig, 1943-1946)";2001-08-08;"Katharinenstr. 1004109 Leipzig(0341) 216 999 0(0341) 216 999 99mdbk@leipzig.dehttp://www.mdbk.deDr. Jan Nicolaisen  (Chefkurator Malerei und Skulptur)+49 (0) 341 216 999 45jan.nicolaisen@leipzig.deDr. Jeannette Stoschek (Chefkuratorin Grafische Sammlung)+49 (0) 341 216 999 40jeannette.stoschek@leipzig.de";https://www.lostart.de/de/Verlust/8168;
Suchmeldung;Einzelobjekt;8321;"Busch, Wilhelm [Künstler:in]";"Landschaft mit Hirt und Kühen";;Malerei;968;;"1914 von der Kunsthandlung Hugo Moses, Berlin, erworben. 1945 am Auslagerungsort Rochlitz abhanden gekommen.";2001-08-08;"Katharinenstr. 1004109 Leipzig(0341) 216 999 0(0341) 216 999 99mdbk@leipzig.dehttp://www.mdbk.deDr. Jan Nicolaisen  (Chefkurator Malerei und Skulptur)+49 (0) 341 216 999 45jan.nicolaisen@leipzig.deDr. Jeannette Stoschek (Chefkuratorin Grafische Sammlung)+49 (0) 341 216 999 40jeannette.stoschek@leipzig.de";https://www.lostart.de/de/Verlust/8321;
Suchmeldung;Einzelobjekt;19042;"Neuhaus, Hermann (1863) [Künstler:in]";"Der verlorene Sohn (Triptychon)";"1892 [Datierung]";Malerei;"730 a,b";"Signatur: Auf dem Mittelbild: Herm.Neuhaus 1892. Maße der Flügel: 95 x 60 cm.";"1896 erworben. 1945 bis auf den rechten Flügel zerstört.";2001-08-08;"Katharinenstr. 1004109 Leipzig(0341) 216 999 0(0341) 216 999 99mdbk@leipzig.dehttp://www.mdbk.deDr. Jan Nicolaisen  (Chefkurator Malerei und Skulptur)+49 (0) 341 216 999 45jan.nicolaisen@leipzig.deDr. Jeannette Stoschek (Chefkuratorin Grafische Sammlung)+49 (0) 341 216 999 40jeannette.stoschek@leipzig.de";https://www.lostart.de/de/Verlust/19042;
Suchmeldung;Einzelobjekt;10025;"Schadow, Hans [Künstler:in]";"Bildnis Rudolf Virchow";"1894 [Datierung]";Malerei;1143;"Signatur: Oben rechts: Rudolf Virchow Aet. su. LXXIII H. Schadow. Stempel: Sign. weiter: ... pinxit 1894";"1922 Geschenk von der Buchhandlung K.F. Koeller, Leipzig. Beim Bombenangriff am 4.12.1943 im Museum am Augustusplatz vernichtet.Verlustgeschichte (Leipzig, 1943-1946)";2001-08-08;"Katharinenstr. 1004109 Leipzig(0341) 216 999 0(0341) 216 999 99mdbk@leipzig.dehttp://www.mdbk.deDr. Jan Nicolaisen  (Chefkurator Malerei und Skulptur)+49 (0) 341 216 999 45jan.nicolaisen@leipzig.deDr. Jeannette Stoschek (Chefkuratorin Grafische Sammlung)+49 (0) 341 216 999 40jeannette.stoschek@leipzig.de";https://www.lostart.de/de/Verlust/10025;
Suchmeldung;Einzelobjekt;8270;"Brouwer, Adriaen [Künstler:in]";"Lesender Bauer";;Malerei;993;;"1916 aus der Sammlung Alfred Thieme, Leipzig, erworben. 1945 am Auslagerungsort Rochlitz abhanden gekommen.";2001-08-08;"Katharinenstr. 1004109 Leipzig(0341) 216 999 0(0341) 216 999 99mdbk@leipzig.dehttp://www.mdbk.deDr. Jan Nicolaisen  (Chefkurator Malerei und Skulptur)+49 (0) 341 216 999 45jan.nicolaisen@leipzig.deDr. Jeannette Stoschek (Chefkuratorin Grafische Sammlung)+49 (0) 341 216 999 40jeannette.stoschek@leipzig.de";https://www.lostart.de/de/Verlust/8270;
