Meldungsart;Datensatzart;"Lost Art ID";Hersteller/Künstler/Autor:in;Titel;Datierung;Objektart;Inventarnummer/Signatur;Beschreibung;Provenienz;"Veröffentlicht seit";Kontakt;Link;"Literatur / Quelle"
Suchmeldung;Einzelobjekt;568379;"Unbekannt (Chinesisch) [Künstler:in]";"Tuschmalerei. Darstellungen aus dem täglichen Leben.";"1701/1800 [Datierung]";Malerei;"16 (Lepke)";"Quelle: Rudolph Lepke's Kunst-Auctions-Haus: Antiquitäten, Gemälde: Bestände der Kunsthandlung B., Berlin, Alt-Meissener Porzellan der Sammlung Demiani u. and. Beiträge ; Möbel des 16. bis 18. Jahrhunderts, europäisches und chinesisches Porzellan, Fayencen, Steinzeug, Teppiche, Tapisserien, Bronzen, Silber, Kleinkunst, Inkunabeln u.a. (Katalog Nr. 2106). Versteigerung vom 7.10.1936. Berlin 1936; LAB, A Rep. 243-04 Nr. 3, Versteigerung vom 7./8.10.1936, Versteigerungsantrag Ball. Gerahmt";"Sammlung Alexander und Richard Ball, BerlinAuktion Lepke, Berlin 07.- 08.10. 1936, Losnummer ausgefallen";2017-08-15;"Rosbach & Fremy (Rechtsanwälte)+49 (0) 30 280 70 71/72office@ra-rff.de";https://www.lostart.de/de/Verlust/568379;
Suchmeldung;Einzelobjekt;568380;"Unbekannt (Chinesisch) [Künstler:in]";"Serie von zehn Tuschmalereien. Darstellungen aus dem täglichen Leben.";"1701/1800 [Datierung]";Malerei;"17 (Lepke)";"Ähnlich wie 14-16 (Lepke). Quelle: Rudolph Lepke's Kunst-Auctions-Haus: Antiquitäten, Gemälde: Bestände der Kunsthandlung B., Berlin, Alt-Meissener Porzellan der Sammlung Demiani u. and. Beiträge ; Möbel des 16. bis 18. Jahrhunderts, europäisches und chinesisches Porzellan, Fayencen, Steinzeug, Teppiche, Tapisserien, Bronzen, Silber, Kleinkunst, Inkunabeln u.a. (Katalog Nr. 2106). Versteigerung vom 7.10.1936. Berlin 1936; LAB, A Rep. 243-04 Nr. 3, Versteigerung vom 7./8.10.1936, Versteigerungsantrag Ball. Gerahmt";"Sammlung Alexander und Richard Ball, BerlinAuktion Lepke, Berlin 07.- 08.10. 1936, Losnummer ausgefallen";2017-08-15;"Rosbach & Fremy (Rechtsanwälte)+49 (0) 30 280 70 71/72office@ra-rff.de";https://www.lostart.de/de/Verlust/568380;
Suchmeldung;Einzelobjekt;568381;"Cosway, [Richard] [Künstler:in]";Miniaturbild;"1701/1800 [Datierung]";Malerei;"130 e (WGA)";"Quelle: D - LAB, B Rep. 025-04, Nr. 671/ 57.";"Sammlung Alexander und Richard BallFirma Wouters, ParisBeschlagnahme 08.02.1943";2017-08-15;"Rosbach & Fremy (Rechtsanwälte)+49 (0) 30 280 70 71/72office@ra-rff.de";https://www.lostart.de/de/Verlust/568381;
Suchmeldung;Einzelobjekt;568382;"Unbekannt (Deutsch) [Künstler:in]";Elfenbein-Miniatur;"1701/1800 [Datierung]";Malerei;"34 (Lepke)";"kleiner als 33 (Lepke). Dame in grauem Kleid mit Spitzenkragen, auf dem schwarzen Haar ein farbiges Tuch. Als Brosche montiert Silberverg. Rähmchen. Quelle: Rudolph Lepke's Kunst-Auctions-Haus: Antiquitäten, Gemälde: Bestände der Kunsthandlung B., Berlin, Alt-Meissener Porzellan der Sammlung Demiani u. and. Beiträge ; Möbel des 16. bis 18. Jahrhunderts, europäisches und chinesisches Porzellan, Fayencen, Steinzeug, Teppiche, Tapisserien, Bronzen, Silber, Kleinkunst, Inkunabeln u.a. (Katalog Nr. 2106). Versteigerung vom 7.10.1936. Berlin 1936; LAB, A Rep. 243-04 Nr. 3, Versteigerung vom 7./8.10.1936, Versteigerungsantrag Ball.";"Sammlung Alexander und Richard Ball, BerlinAuktion Lepke, Berlin 07.- 08.10. 1936 Käufer: Albrecht, 70 RM";2017-08-15;"Rosbach & Fremy (Rechtsanwälte)+49 (0) 30 280 70 71/72office@ra-rff.de";https://www.lostart.de/de/Verlust/568382;
Suchmeldung;Einzelobjekt;568383;"Unbekannt (Deutsch (Süddeutschland)) [Künstler:in]";Auferstehung;;Malerei;"19 (Lepke)";"in Bleifassung; viereckig: Auferstehung mit Inschrift: bzw. H. H. Reyff, Seckelmeister 73. Quelle: Rudolph Lepke's Kunst-Auctions-Haus: Antiquitäten, Gemälde: Bestände der Kunsthandlung B., Berlin, Alt-Meissener Porzellan der Sammlung Demiani u. and. Beiträge ; Möbel des 16. bis 18. Jahrhunderts, europäisches und chinesisches Porzellan, Fayencen, Steinzeug, Teppiche, Tapisserien, Bronzen, Silber, Kleinkunst, Inkunabeln u.a. (Katalog Nr. 2106). Versteigerung vom 7.10.1936. Berlin 1936; LAB, A Rep. 243-04 Nr. 3, Versteigerung vom 7./8.10.1936, Versteigerungsantrag Ball.";"Sammlung Alexander und Richard Ball, BerlinAuktion Lepke, Berlin 07.- 08.10. 1936 Käufer: [Ferdinand] Knapp, Nr. 18/19, zusammen 80 RM";2017-08-15;"Rosbach & Fremy (Rechtsanwälte)+49 (0) 30 280 70 71/72office@ra-rff.de";https://www.lostart.de/de/Verlust/568383;
Suchmeldung;Einzelobjekt;568384;"Unbekannt (Deutsch (Süddeutschland)) [Künstler:in]";Kreuzigung;"1573 [Datierung]";Malerei;"18 (Lepke)";"in Bleifassung; viereckig: Kreuzigung mit Inschrift: J. L. von Affry 1573 Schulths. Quelle: Rudolph Lepke's Kunst-Auctions-Haus: Antiquitäten, Gemälde: Bestände der Kunsthandlung B., Berlin, Alt-Meissener Porzellan der Sammlung Demiani u. and. Beiträge ; Möbel des 16. bis 18. Jahrhunderts, europäisches und chinesisches Porzellan, Fayencen, Steinzeug, Teppiche, Tapisserien, Bronzen, Silber, Kleinkunst, Inkunabeln u.a. (Katalog Nr. 2106). Versteigerung vom 7.10.1936. Berlin 1936; LAB, A Rep. 243-04 Nr. 3, Versteigerung vom 7./8.10.1936, Versteigerungsantrag Ball.";"Sammlung Alexander und Richard Ball, BerlinAuktion Lepke, Berlin 07.- 08.10. 1936 Käufer: [Ferdinand] Knapp, Nr. 18/19, zusammen 80 RM";2017-08-15;"Rosbach & Fremy (Rechtsanwälte)+49 (0) 30 280 70 71/72office@ra-rff.de";https://www.lostart.de/de/Verlust/568384;
Suchmeldung;Einzelobjekt;568387;"Unbekannt (Englisch (?) (Meister)) [Künstler:in]";"Brustbild einer jungen Dame";;Malerei;"679 (Lepke)";"mit gepudertem Haar, auf dem ein Häubchen mit roter Schleife sitzt. Blaues Kleid, Tüllkragen. Hochoval. Alter geschnitzter Goldrahmen. Quelle: Rudolph Lepke's Kunst-Auctions-Haus: Antiquitäten, Gemälde: Bestände der Kunsthandlung B., Berlin, Alt-Meissener Porzellan der Sammlung Demiani u. and. Beiträge ; Möbel des 16. bis 18. Jahrhunderts, europäisches und chinesisches Porzellan, Fayencen, Steinzeug, Teppiche, Tapisserien, Bronzen, Silber, Kleinkunst, Inkunabeln u.a. (Katalog Nr. 2106). Versteigerung vom 7.10.1936. Berlin 1936; LAB, A Rep. 243-04 Nr. 3, Versteigerung vom 7./8.10.1936, Versteigerungsantrag Ball.";"Sammlung Alexander und Richard BallAuktion Lepke, Berlin 07.- 08.10. 1936Käufer: f.E.";2017-08-15;"Rosbach & Fremy (Rechtsanwälte)+49 (0) 30 280 70 71/72office@ra-rff.de";https://www.lostart.de/de/Verlust/568387;
Suchmeldung;Einzelobjekt;568388;"Ferguson, William Gowe [Künstler:in]";Stilleben;;Malerei;"681 (Lepke)";"Rebhuhn und Singvögel, rechts eine Distel. Alter geschnitzter G.-R. Links unten Signaturreste. Quelle: Rudolph Lepke's Kunst-Auctions-Haus: Antiquitäten, Gemälde: Bestände der Kunsthandlung B., Berlin, Alt-Meissener Porzellan der Sammlung Demiani u. and. Beiträge ; Möbel des 16. bis 18. Jahrhunderts, europäisches und chinesisches Porzellan, Fayencen, Steinzeug, Teppiche, Tapisserien, Bronzen, Silber, Kleinkunst, Inkunabeln u.a. (Katalog Nr. 2106). Versteigerung vom 7.10.1936. Berlin 1936; LAB, A Rep. 243-04 Nr. 3, Versteigerung vom 7./8.10.1936, Versteigerungsantrag Ball.";"Sammlung Alexander und Richard BallAuktion Lepke, Berlin 07.- 08.10. 1936Käufer: f.E.";2017-08-15;"Rosbach & Fremy (Rechtsanwälte)+49 (0) 30 280 70 71/72office@ra-rff.de";https://www.lostart.de/de/Verlust/568388;
Suchmeldung;Einzelobjekt;568389;"Unbekannt (Flämisch (Schule)) [Künstler:in]";"Zwei Stilleben";;Malerei;"683 (Lepke)";"Stilleben mit Jagdbeute. Auf dem einen Vögel um einen großen Tonkrug gruppiert; auf dem anderen Pfau, Puter und andere Vögel. Beide Stilleben in landschaftlicher Umgebung. Gegenstücke.Größe je 114X152 cm. Goldrahmen. Quelle: Rudolph Lepke's Kunst-Auctions-Haus: Antiquitäten, Gemälde: Bestände der Kunsthandlung B., Berlin, Alt-Meissener Porzellan der Sammlung Demiani u. and. Beiträge ; Möbel des 16. bis 18. Jahrhunderts, europäisches und chinesisches Porzellan, Fayencen, Steinzeug, Teppiche, Tapisserien, Bronzen, Silber, Kleinkunst, Inkunabeln u.a. (Katalog Nr. 2106). Versteigerung vom 7.10.1936. Berlin 1936; LAB, A Rep. 243-04 Nr. 3, Versteigerung vom 7./8.10.1936, Versteigerungsantrag Ball.";"Sammlung Alexander und Richard BallAuktion Lepke, Berlin 07.- 08.10. 1936Käufer: f.E.";2017-08-15;"Rosbach & Fremy (Rechtsanwälte)+49 (0) 30 280 70 71/72office@ra-rff.de";https://www.lostart.de/de/Verlust/568389;
Suchmeldung;Einzelobjekt;568390;"Unbekannt (Französisch (Meister)) [Künstler:in]";Damenbildnis;"1701/1800 [Datierung]";Malerei;"687 (Lepke)";"Art des Nattier, Kniestück, Dame sitzend in grauem Seidenkleid, mit blauem Umhang, Rosen in der linken Hand. Alter geschnitzter G.-R. Quelle: Rudolph Lepke's Kunst-Auctions-Haus: Antiquitäten, Gemälde: Bestände der Kunsthandlung B., Berlin, Alt-Meissener Porzellan der Sammlung Demiani u. and. Beiträge ; Möbel des 16. bis 18. Jahrhunderts, europäisches und chinesisches Porzellan, Fayencen, Steinzeug, Teppiche, Tapisserien, Bronzen, Silber, Kleinkunst, Inkunabeln u.a. (Katalog Nr. 2106). Versteigerung vom 7.10.1936. Berlin 1936; LAB, A Rep. 243-04 Nr. 3, Versteigerung vom 7./8.10.1936, Versteigerungsantrag Ball.";"Sammlung Alexander und Richard BallAuktion Lepke, Berlin 07.- 08.10. 1936Käufer: f.E.";2017-08-15;"Rosbach & Fremy (Rechtsanwälte)+49 (0) 30 280 70 71/72office@ra-rff.de";https://www.lostart.de/de/Verlust/568390;
Suchmeldung;Einzelobjekt;568391;"Unbekannt (Französisch) [Künstler:in]";"Dekoratives Panneau";;Malerei;"691 (Lepke)";"auf goldgelbem Grund: Grotesken mit Füllungen in der Art antiker Gemmen. Quelle: Rudolph Lepke's Kunst-Auctions-Haus: Antiquitäten, Gemälde: Bestände der Kunsthandlung B., Berlin, Alt-Meissener Porzellan der Sammlung Demiani u. and. Beiträge ; Möbel des 16. bis 18. Jahrhunderts, europäisches und chinesisches Porzellan, Fayencen, Steinzeug, Teppiche, Tapisserien, Bronzen, Silber, Kleinkunst, Inkunabeln u.a. (Katalog Nr. 2106). Versteigerung vom 7.10.1936. Berlin 1936; LAB, A Rep. 243-04 Nr. 3, Versteigerung vom 7./8.10.1936, Versteigerungsantrag Ball.";"Sammlung Alexander und Richard BallAuktion Lepke, Berlin 07.- 08.10. 1936Käufer: f.E.";2017-08-15;"Rosbach & Fremy (Rechtsanwälte)+49 (0) 30 280 70 71/72office@ra-rff.de";https://www.lostart.de/de/Verlust/568391;
Suchmeldung;Einzelobjekt;568392;"Unbekannt (Französisch) [Künstler:in]";Elfenbein-Miniatur;"1701/1800 [Datierung]";Malerei;"36 (Lepke)";"rund: Junge Dame in dekolletiertem graublauem Kleid, das lockige Haar von einem roten Band gehalten, den linken Arm auf eine Balustrade gestützt. Goldrähmchen. Quelle: Rudolph Lepke's Kunst-Auctions-Haus: Antiquitäten, Gemälde: Bestände der Kunsthandlung B., Berlin, Alt-Meissener Porzellan der Sammlung Demiani u. and. Beiträge ; Möbel des 16. bis 18. Jahrhunderts, europäisches und chinesisches Porzellan, Fayencen, Steinzeug, Teppiche, Tapisserien, Bronzen, Silber, Kleinkunst, Inkunabeln u.a. (Katalog Nr. 2106). Versteigerung vom 7.10.1936. Berlin 1936; LAB, A Rep. 243-04 Nr. 3, Versteigerung vom 7./8.10.1936, Versteigerungsantrag Ball.";"Sammlung Alexander und Richard Ball, BerlinAuktion Lepke, Berlin 07.- 08.10. 1936 Käufer: [Fritz] Rehbein, 85 RM";2017-08-15;"Rosbach & Fremy (Rechtsanwälte)+49 (0) 30 280 70 71/72office@ra-rff.de";https://www.lostart.de/de/Verlust/568392;
Suchmeldung;Einzelobjekt;568393;"Unbekannt (Französisch) [Künstler:in]";Elfenbein-Miniatur;"1701/1800 [Datierung]";Malerei;"37 (Lepke)";"oval: Brustbild einer jungen Dame in grauem Kleid mit blauer Garnierung, schwarzes Halsband. Bronzerähmchen. Quelle: Rudolph Lepke's Kunst-Auctions-Haus: Antiquitäten, Gemälde: Bestände der Kunsthandlung B., Berlin, Alt-Meissener Porzellan der Sammlung Demiani u. and. Beiträge ; Möbel des 16. bis 18. Jahrhunderts, europäisches und chinesisches Porzellan, Fayencen, Steinzeug, Teppiche, Tapisserien, Bronzen, Silber, Kleinkunst, Inkunabeln u.a. (Katalog Nr. 2106). Versteigerung vom 7.10.1936. Berlin 1936; LAB, A Rep. 243-04 Nr. 3, Versteigerung vom 7./8.10.1936, Versteigerungsantrag Ball.";"Sammlung Alexander und Richard BallAuktion Lepke, Berlin 07.- 08.10. 1936Käufer: f.E.";2017-08-15;"Rosbach & Fremy (Rechtsanwälte)+49 (0) 30 280 70 71/72office@ra-rff.de";https://www.lostart.de/de/Verlust/568393;
Suchmeldung;Einzelobjekt;568394;"Unbekannt (Französisch (Schule)) [Künstler:in]";"Junge Dame";"1800 (um) [Datierung]";Malerei;"680 (Lepke)";"Junge Dame mit braunen Locken; weißes Kleid, brauner Überwurf. Leinwand.Goldrahmen. Hochoval. G.-R. Quelle: Rudolph Lepke's Kunst-Auctions-Haus: Antiquitäten, Gemälde: Bestände der Kunsthandlung B., Berlin, Alt-Meissener Porzellan der Sammlung Demiani u. and. Beiträge ; Möbel des 16. bis 18. Jahrhunderts, europäisches und chinesisches Porzellan, Fayencen, Steinzeug, Teppiche, Tapisserien, Bronzen, Silber, Kleinkunst, Inkunabeln u.a. (Katalog Nr. 2106). Versteigerung vom 7.10.1936. Berlin 1936; LAB, A Rep. 243-04 Nr. 3, Versteigerung vom 7./8.10.1936, Versteigerungsantrag Ball.";"Sammlung Alexander und Richard BallAuktion Lepke, Berlin 07.- 08.10. 1936Käufer: f.E.";2017-08-15;"Rosbach & Fremy (Rechtsanwälte)+49 (0) 30 280 70 71/72office@ra-rff.de";https://www.lostart.de/de/Verlust/568394;
Suchmeldung;Einzelobjekt;569067;"Liebermann, Max [Künstler:in]";"Reiter in einer Allee";"1924 [Datierung]";Malerei;;"Reiter kommen dem Betrachter auf einem Reitweg zwischen hohen Bäumen einer perspektivisch leuchtenden Allee entgegen; genaue Maßangaben liegen nicht vor; Motiv vergleichbar mit Eberle-Werkverzeichnis, Nr. 1924/39: Reiter in der Allee bei Sakrow";"ca. 1924/1925 von Paul und Minna Lindemann erworben; 1936 Emigration nach Italien; 1939 Emigration nach Montevideo/Uruguay, Gemälde wahrscheinlich zusammen mit dem Lift abhandengekommen";2017-08-29;"Von Trott zu Solz - Lammek (Rechtsanwälte - Notar)+49 (0) 30 59 00 33 00kanzlei@vontrott-lammek.de";https://www.lostart.de/de/Verlust/569067;
Suchmeldung;Einzelobjekt;569164;"Moll, Carl [Künstler:in]";"Gödinger Park im Frühling";;Malerei;;;"Dr. Paul und Irene Hellmann, Wien; 26.08.1938 Anmeldung der Vermögensgegenstände zur Ausfuhr bei der Zentralstelle für Denkmalschutz in Wien; Verbleib unbekannt, derzeit wird von einem NS-verfolgungsbedingten Entzug des Werkes ausgegangen";2017-09-14;"Lansky, Ganzger + partner (Rechtsanwälte GmbH)+43 1 533 33 30 0office@lansky.at";https://www.lostart.de/de/Verlust/569164;
Suchmeldung;Einzelobjekt;568172;"Unbekannt (Holländisch) [Künstler:in]";"Porträt eines Mannes in gelber Jacke";"1601/1700 [Datierung]";Malerei;"No. 66[?]";"ovalQuelle: Algemeen Politieblad van het Koninkrijk der Nederlanden, Jg. 95, Nr. 34, 30. November 1946 publizierten Liste 719 „Te ‘s-Gravenhage ontvreemd in 1943/1944, hollandsche teekeningen, t. w.“; BArch Koblenz, B 323/462 fol. 266-270";"Frits Lugt, Den Haag; verschollen seit 1945";2017-07-20;"Marc Parein+41 79 953 06 08contact@frits-lugt.orgNico Y. Lugt+41 79 413 44 67contact@frits-lugt.org";https://www.lostart.de/de/Verlust/568172;
Suchmeldung;Einzelobjekt;568173;"Potter, Pieter Symonsz [Künstler:in]";Vanitas;"1638 [Datierung]";Malerei;"No. 71[?]";"signiertQuelle: Algemeen Politieblad van het Koninkrijk der Nederlanden, Jg. 95, Nr. 34, 30. November 1946 publizierten Liste 719 „Te ‘s-Gravenhage ontvreemd in 1943/1944, hollandsche teekeningen, t. w.“; BArch Koblenz, B 323/462 fol. 266-270";"Frits Lugt, Den Haag; verschollen seit 1945";2017-07-20;"Marc Parein+41 79 953 06 08contact@frits-lugt.orgNico Y. Lugt+41 79 413 44 67contact@frits-lugt.org";https://www.lostart.de/de/Verlust/568173;
Suchmeldung;Einzelobjekt;568174;"Hondecoeter, Gillis Claesz.de (?) [Künstler:in]Hondecoeter, Gysbert Gillisz. de (?) [Künstler:in]";"Waldlandschaft mit Jägern";"1609 [Datierung]";Malerei;"No. 79[?]";"signiertQuelle: Algemeen Politieblad van het Koninkrijk der Nederlanden, Jg. 95, Nr. 34, 30. November 1946 publizierten Liste 719 „Te ‘s-Gravenhage ontvreemd in 1943/1944, hollandsche teekeningen, t. w.“; BArch Koblenz, B 323/462 fol. 266-270";"Frits Lugt, Den Haag; verschollen seit 1945";2017-07-20;"Marc Parein+41 79 953 06 08contact@frits-lugt.orgNico Y. Lugt+41 79 413 44 67contact@frits-lugt.org";https://www.lostart.de/de/Verlust/568174;
Suchmeldung;Einzelobjekt;568175;"Leyster, Judith [Künstler:in]";"Musizierende Gesellschaft";;Malerei;"No. 96[?]";"Quelle: Algemeen Politieblad van het Koninkrijk der Nederlanden, Jg. 95, Nr. 34, 30. November 1946 publizierten Liste 719 „Te ‘s-Gravenhage ontvreemd in 1943/1944, hollandsche teekeningen, t. w.“; BArch Koblenz, B 323/462 fol. 266-270";"Frits Lugt, Den Haag; verschollen seit 1945";2017-07-20;"Marc Parein+41 79 953 06 08contact@frits-lugt.orgNico Y. Lugt+41 79 413 44 67contact@frits-lugt.org";https://www.lostart.de/de/Verlust/568175;
Suchmeldung;Einzelobjekt;568176;"Lugt, H. [Künstler:in]";"Ansicht auf ein italienisches Städtchen im Tal";;Malerei;;"Quelle: Algemeen Politieblad van het Koninkrijk der Nederlanden, Jg. 95, Nr. 34, 30. November 1946 publizierten Liste 719 „Te ‘s-Gravenhage ontvreemd in 1943/1944, hollandsche teekeningen, t. w.“";"Frits Lugt, Den Haag; verschollen seit 1945";2017-07-20;"Marc Parein+41 79 953 06 08contact@frits-lugt.orgNico Y. Lugt+41 79 413 44 67contact@frits-lugt.org";https://www.lostart.de/de/Verlust/568176;
Suchmeldung;Einzelobjekt;571274;"Meister der Magdalenen-Legende [Künstler:in]";"Madonna mit dem Kind";"1510-1520 [Datierung]";Gemälde;;;"Sammlung Edmond Noël, Paris; 27.05.1924 Auktion Edmond Noël, Galerie Georges Petit, Paris, lot. 18; 07.07.1926, Auktion Weber, Nr. 112; 19.07.1927 Auktion Luzern, Nr. 65, mit Abb. (Fischer?/ Gilhofer?); 1928 Goudstikker, Inv. Nr. 23; Richard Semmel; 07.12.1935 Auktion Galerie Moos, Genf, Sammlungen Jan W. Vos, Amsterdam und H. Schauwecker, Brüssel, Nr. 41, Abb. 20 (mit Gutachten von Max J. Friedländer), dort laut Weltkunst verkauft für 4.425 sfr; Auktion Kende Galleries, New York 1944, Kat. S. 25, Nr. 56, mit Abb., verkauft für 1.300,50 $; 07.-08.12.1960, Auktion Weinmüller, München; 06.12.1961, Auktion Weinmüller, München, Nr. 973, Tafel 69; 28.04.1965 Auktion Lempertz, Köln, Nr. 72, Tafel 3; 10.07.1968 Sotheby's New York, Coll. Prince de Ligne e.a., Lot 42";2017-10-23;"Olaf S. Ossmann (Rechtsanwalt)office@ossmann.ch";https://www.lostart.de/de/Verlust/571274;
Suchmeldung;Einzelobjekt;584050;"Nolde, Emil [Künstler:in]";"Glühende Abendwolken";"1927 [Datierung]";Malerei;;;"Nach der Liste Emil Noldes vom 25.11.1946 auf der Liste der 62 zwischen dem 9.7.1941 und 7.1.1942 aus der Wohnung in der Bayernallee 10, Berlin, verschwundenen Bilder; 2019 gelten 28 von ihnen weiterhin als verschollen.";2019-09-20;"Seebüll 3125927 Neukirchen, Seebüll+49 (0)4664-98 39 30+49 (0)4664-98 39 329info@nolde-stiftung.dehttp://www.nolde-stiftung.deDr. Astrid Becker (Stellvertretende Direktorin)becker@nolde-stiftung.de";https://www.lostart.de/de/Verlust/584050;"Werkverzeichnis Urban, Nr. 1055."
Suchmeldung;Einzelobjekt;584051;"Nolde, Emil [Künstler:in]";"Hof am Wassesr";"1927 [Datierung]";Malerei;;;"Nach der Liste Emil Noldes vom 25.11.1946 auf der Liste der 62 zwischen dem 9.7.1941 und 7.1.1942 aus der Wohnung in der Bayernallee 10, Berlin, verschwundenen Bilder; 2019 gelten 28 von ihnen weiterhin als verschollen.";2019-09-20;"Seebüll 3125927 Neukirchen, Seebüll+49 (0)4664-98 39 30+49 (0)4664-98 39 329info@nolde-stiftung.dehttp://www.nolde-stiftung.deDr. Astrid Becker (Stellvertretende Direktorin)becker@nolde-stiftung.de";https://www.lostart.de/de/Verlust/584051;"Werkverzeichnis Urban, Nr. 1058."
Suchmeldung;Einzelobjekt;584052;"Nolde, Emil [Künstler:in]";"Negerplastik und Blumen";"1928 [Datierung]";Malerei;;;"Nach der Liste Emil Noldes vom 25.11.1946 auf der Liste der 62 zwischen dem 9.7.1941 und 7.1.1942 aus der Wohnung in der Bayernallee 10, Berlin, verschwundenen Bilder; 2019 gelten 28 von ihnen weiterhin als verschollen.";2019-09-20;"Seebüll 3125927 Neukirchen, Seebüll+49 (0)4664-98 39 30+49 (0)4664-98 39 329info@nolde-stiftung.dehttp://www.nolde-stiftung.deDr. Astrid Becker (Stellvertretende Direktorin)becker@nolde-stiftung.de";https://www.lostart.de/de/Verlust/584052;"Werkverzeichnis Urban, Nr. 1061."
Suchmeldung;Einzelobjekt;584053;"Nolde, Emil [Künstler:in]";Spanierin;"1928 [Datierung]";Malerei;;;"Nach der Liste Emil Noldes vom 25.11.1946 auf der Liste der 62 zwischen dem 9.7.1941 und 7.1.1942 aus der Wohnung in der Bayernallee 10, Berlin, verschwundenen Bilder; 2019 gelten 28 von ihnen weiterhin als verschollen.";2019-09-20;"Seebüll 3125927 Neukirchen, Seebüll+49 (0)4664-98 39 30+49 (0)4664-98 39 329info@nolde-stiftung.dehttp://www.nolde-stiftung.deDr. Astrid Becker (Stellvertretende Direktorin)becker@nolde-stiftung.de";https://www.lostart.de/de/Verlust/584053;"Werkverzeichnis Urban, Nr. 1066."
Suchmeldung;Einzelobjekt;584054;"Nolde, Emil [Künstler:in]";"Stilleben ® Blattblumen und Kaktus";"1929 [Datierung]";Malerei;;;"Nach der Liste Emil Noldes vom 25.11.1946 auf der Liste der 62 zwischen dem 9.7.1941 und 7.1.1942 aus der Wohnung in der Bayernallee 10, Berlin, verschwundenen Bilder; 2019 gelten 28 von ihnen weiterhin als verschollen.";2019-09-20;"Seebüll 3125927 Neukirchen, Seebüll+49 (0)4664-98 39 30+49 (0)4664-98 39 329info@nolde-stiftung.dehttp://www.nolde-stiftung.deDr. Astrid Becker (Stellvertretende Direktorin)becker@nolde-stiftung.de";https://www.lostart.de/de/Verlust/584054;"Werkverzeichnis Urban, Nr. 1083."
Suchmeldung;Einzelobjekt;584055;"Nolde, Emil [Künstler:in]";"Meer F";"1930 [Datierung]";Malerei;;;"Mai 1932, Ausstellung Kopenhagen Nyere Tysk Kunst. Maleri og Skulptur, Nr. 158; Juni - Juli 1932 Großer Kongressal des Messegeländes Köln, Neuere deutsche Kunst. Malerei und Skulptur; Nach der Liste Emil Noldes vom 25.11.1946 auf der Liste der 62 zwischen dem 9.7.1941 und 7.1.1942 aus der Wohnung in der Bayernallee 10, Berlin, verschwundenen Bilder. 2019 gelten 28 von ihnen weiterhin als verschollen.";2019-09-20;"Seebüll 3125927 Neukirchen, Seebüll+49 (0)4664-98 39 30+49 (0)4664-98 39 329info@nolde-stiftung.dehttp://www.nolde-stiftung.deDr. Astrid Becker (Stellvertretende Direktorin)becker@nolde-stiftung.de";https://www.lostart.de/de/Verlust/584055;"Werkverzeichnis Urban, Nr. 1105."
Suchmeldung;Einzelobjekt;584056;"Nolde, Emil [Künstler:in]";"Herbstblumen (B)";"1931 [Datierung]";Malerei;;;"Nach der Liste Emil Noldes vom 25.11.1946 auf der Liste der 62 zwischen dem 9.7.1941 und 7.1.1942 aus der Wohnung in der Bayernallee 10, Berlin, verschwundenen Bilder; 2019 gelten 28 von ihnen weiterhin als verschollen.";2019-09-20;"Seebüll 3125927 Neukirchen, Seebüll+49 (0)4664-98 39 30+49 (0)4664-98 39 329info@nolde-stiftung.dehttp://www.nolde-stiftung.deDr. Astrid Becker (Stellvertretende Direktorin)becker@nolde-stiftung.de";https://www.lostart.de/de/Verlust/584056;"Werkverzeichnis Urban, Nr. 1117."
Suchmeldung;Einzelobjekt;584057;"Nolde, Emil [Künstler:in]";"Gestalten der Dämmerstunde";"1932 [Datierung]";Malerei;;;"Nach der Liste Emil Noldes vom 25.11.1946 auf der Liste der 62 zwischen dem 9.7.1941 und 7.1.1942 aus der Wohnung in der Bayernallee 10, Berlin, verschwundenen Bilder; 2019 gelten 28 von ihnen weiterhin als verschollen.";2019-09-20;"Seebüll 3125927 Neukirchen, Seebüll+49 (0)4664-98 39 30+49 (0)4664-98 39 329info@nolde-stiftung.dehttp://www.nolde-stiftung.deDr. Astrid Becker (Stellvertretende Direktorin)becker@nolde-stiftung.de";https://www.lostart.de/de/Verlust/584057;"Werkverzeichnis Urban, Nr. 1126."
Suchmeldung;Einzelobjekt;584058;"Nolde, Emil [Künstler:in]";Figurenbild;"1932 [Datierung]";Malerei;;;"Nach der Liste Emil Noldes vom 25.11.1946 auf der Liste der 62 zwischen dem 9.7.1941 und 7.1.1942 aus der Wohnung in der Bayernallee 10, Berlin, verschwundenen Bilder; 2019 gelten 28 von ihnen weiterhin als verschollen.";2019-09-20;"Seebüll 3125927 Neukirchen, Seebüll+49 (0)4664-98 39 30+49 (0)4664-98 39 329info@nolde-stiftung.dehttp://www.nolde-stiftung.deDr. Astrid Becker (Stellvertretende Direktorin)becker@nolde-stiftung.de";https://www.lostart.de/de/Verlust/584058;"Werkverzeichnis Urban, Nr. 1127."
Suchmeldung;Einzelobjekt;584059;"Nolde, Emil [Künstler:in]";"Teich im Blumengarten";"1935 [Datierung]";Malerei;;;"Nach der Liste Emil Noldes vom 25.11.1946 auf der Liste der 62 zwischen dem 9.7.1941 und 7.1.1942 aus der Wohnung in der Bayernallee 10, Berlin, verschwundenen Bilder; 2019 gelten 28 von ihnen weiterhin als verschollen.";2019-09-20;"Seebüll 3125927 Neukirchen, Seebüll+49 (0)4664-98 39 30+49 (0)4664-98 39 329info@nolde-stiftung.dehttp://www.nolde-stiftung.deDr. Astrid Becker (Stellvertretende Direktorin)becker@nolde-stiftung.de";https://www.lostart.de/de/Verlust/584059;"Werkverzeichnis Urban, Nr. 1144."
Suchmeldung;Einzelobjekt;584060;"Nolde, Emil [Künstler:in]";Marschhof;"1939 [Datierung]";Malerei;;;"Nach der Liste Emil Noldes vom 25.11.1946 auf der Liste der 62 zwischen dem 9.7.1941 und 7.1.1942 aus der Wohnung in der Bayernallee 10, Berlin, verschwundenen Bilder; 2019 gelten 28 von ihnen weiterhin als verschollen.";2019-09-20;"Seebüll 3125927 Neukirchen, Seebüll+49 (0)4664-98 39 30+49 (0)4664-98 39 329info@nolde-stiftung.dehttp://www.nolde-stiftung.deDr. Astrid Becker (Stellvertretende Direktorin)becker@nolde-stiftung.de";https://www.lostart.de/de/Verlust/584060;"Werkverzeichnis Urban, Nr. 1209."
Suchmeldung;Einzelobjekt;584061;"Nolde, Emil [Künstler:in]";Tiefland;"1939 [Datierung]";Malerei;;;"Nach der Liste Emil Noldes vom 25.11.1946 auf der Liste der 62 zwischen dem 9.7.1941 und 7.1.1942 aus der Wohnung in der Bayernallee 10, Berlin, verschwundenen Bilder; 2019 gelten 28 von ihnen weiterhin als verschollen.";2019-09-20;"Seebüll 3125927 Neukirchen, Seebüll+49 (0)4664-98 39 30+49 (0)4664-98 39 329info@nolde-stiftung.dehttp://www.nolde-stiftung.deDr. Astrid Becker (Stellvertretende Direktorin)becker@nolde-stiftung.de";https://www.lostart.de/de/Verlust/584061;"Werkverzeichnis Urban, Nr. 1211."
