Meldungsart;Datensatzart;"Lost Art ID";Hersteller/Künstler/Autor:in;Titel;Datierung;Objektart;Inventarnummer/Signatur;Beschreibung;Provenienz;"Veröffentlicht seit";Kontakt;Link;"Literatur / Quelle"
Fundmeldung;Einzelobjekt;284935;"Baier, Hans K. ((zugeschr. / attr.)) [Künstler:in]";"Tümpel mit Brücke";"1600 (um) / 1930 (um) [Zeitraum]";Gemälde;;"Vordergrund: Tümpel mit Brücke, rechts/links Bäume, Hintergrund: zwei Häuser; Zuschreibung lt. ursprünglicher Melderangabe: ""Baier H.K.""";"Stammt aus dem Landesamt für gesperrte Vermögen und dem Eigentum der früheren NSDAP. Durch Beschluss des Allgemeinen Organisationsausschusses in Celle nach der Kontrollratsdirektive 50 dem Finanzministerium des Landes Nordrhein-Westfalen übertragen.";2003-06-27;"Ministerium für Kultur und Wissenschaft
des Landes Nordrhein-WestfalenVölklinger Str. 4940221 Düsseldorf(0211) 896-04(0211) 896-4555";https://www.lostart.de/de/Fund/284935;
Suchmeldung;Einzelobjekt;238717;"Bach, Alois [Künstler:in]";"Vor dem Schloss";;Malerei;;"im Park zwei promenierende Damen, bez. r. u.: Bach, Goldrahmen.";"1925 (spätestens) – Nürnberg, Abraham Adelsberger, Erwerb, Zi-Nr. 121; 22.03.1930 – Nürnberg, Gebrüder Isay, Sicherungsübereignung durch Abraham Adelsberger, Nr. 1; 08.10.1930 – München, Galerie Hugo Helbing, Versteigerungsangebot, Los 5; 15.11.1932 (um) – vmtl. Nürnberg, Sicherungsübereignung Immobilien AG Noris i.L. Nürnberg / Dresdner Bank durch Abraham und Paul Adelsberger, Nr. 3; 15.08.1935 – Berlin, Nationalgalerie, En-bloc-Ankauf des Kunstbesitzes der Dresdner Bank durch das Kultusministerium an die Nationalgalerie überwiesen, Inv. Nr. D.B.3";2001-09-05;;https://www.lostart.de/de/Verlust/238717;"Boetticher, Friedrich von, Malerwerke des neunzehnten Jahrhunderts, Bd. 1, Dresden 1891; Zimmermann, Walther, Sammlung A. Adelsberger, München 1925, S. 5; Sicherungsübereignungsvertrag zwischen H. Fischer & Co., Nürnberg, und Gebrüder Isay, Köln, 22.03.1930, NL-AsdJHM, D017188, o. B.; Sammlung A. Adelsberger, Nürnberg, Teil 1: Gemälde alter Meister/Deutsche Gemälde des 19. und 20. Jahrhunderts, 08.10.1930, Aukt. Kat. Hugo Helbing, München 1930, [Externer Link], Stand: 01.05.2018; Aukt. Kat. Hugo Helbing 1930a Annotiertes Exemplar Kunsthaus Zürich, Bibliothek, Handexemplar Hugo Helbing; Aukt. Kat. Hugo Helbing 1930a: Annotiertes Exemplar ZI München (DL Nathan), Handexemplar Marie Ducrue; Aukt. Kat. Hugo Helbing 1930a: Annotiertes Exemplar Bayerisches Nationalmuseum, München; o. V. Preisberichte 1930b: o. V., Preisberichte, in: Weltkunst, Jg. IV, Nr. 44, 02.11.1930, S. 6; o. V. Preisberichte 1930c: o. V., Preisberichte, in: Weltkunst, Jg. IV, Nr. 45, 09.11.1930, S. 6; Vertrag (nicht unterzeichnet) samt Anlagen zwischen Immobilien AG Noris i. L. Nürnberg und Abraham und Paul Adelsberger, 15.11.1932, NL-AsdJHM, D017148; Schenker & Co., Transportliste [Von der Dresdner Bank Direktion, Industrie Büro, an die Nationalgalerie], 26.08.1935, SMB-ZA, I-NG 1347, Bl. 09; A. Adelsberger i/Fa. H. Fischer & Co., Nürnberg, Verzeichnis wie in Kisten H.F. & Co. 102-105 die Bilder verpackt sind, SMB-ZA, I-NG 1347, Bl. 10; Best. Kat. Nationalgalerie 1976: Nationalgalerie. Verzeichnis der Gemälde und Skulpturen des 19. Jahrhunderts, bearb. v. Barbara Dieterich und Peter Krieger und Elisabeth Krimmel-Decker, Berlin 1976 ; Fischer & Co., Nürnberg, Liste 23 (alte Liste 17) in: Rother 2017: Rother, Lynn, Kunst durch Kredit. Die Berliner Museen und ihre Erwerbungen von der Dresdner Bank 1935, Berlin 2017, S. 412"
Suchmeldung;Einzelobjekt;623344;"Anastasi, Auguste-Paul-Charles [Künstler:in]";"Rue d'Andresy / Rue d'Andresy a Andresy /Andresy-Straße";"1873 (um) [Datierung]";Gemälde;;"derzeit keine weiteren Angaben verfügbar";"1925 (spätestens) – Nürnberg, Abraham Adelsberger, Zi-Nr. 124; 22.03.1930 – Nürnberg, Gebrüder Isay, Sicherungsübereignung durch Abraham Adelsberger, Nr. 36; 15.11.1932 (um) – vmtl. Nürnberg, Sicherungsübereignung Immobilien AG Noris i.L. Nürnberg / Dresdner Bank durch Abraham und Paul Adelsberger;bis 10.08.1937 – Nürnberg, Abraham Adelsberger Aufstellung; 10.08.1937 (frühestens) – vmtl. Nürnberg, Karolinenstraße 16, deponiert im Tresor bei der Dresdner Bank, Filiale Nürnberg; 13.02.1940 – Nürnberg, Kunst-Auktionshaus B. Pfeuffer, Versteigerungsangebot, Los 214, Einlieferer J.; 13.02.1940 – Nürnberg, Unbekannt, Ersteigerung, Zuschlag: 105 RM. Verbleib unbekannt.";2024-09-23;;https://www.lostart.de/de/Verlust/623344;"Boetticher, Friedrich von, Malerwerke des neunzehnten Jahrhunderts, Bd. 1, Dresden 1891; Gemälde aus vier Jahrhunderten: (XVI.‒XIX. Jahrhundert). U.a. aus der Sammlung des Herrn Generalkonsul Otto von Neufville †, Frankfurt a. M., 17.02.1925, Aukt. Kat. Rudolf Bangel Nr. 1057, Frankfurt am Main 1925, [Externer Link], Stand: 23.04.2020; Zimmermann, Walther, Sammlung A. Adelsberger, München 1925, S. 10; Sicherungsübereignungsvertrag zwischen H. Fischer & Co., Nürnberg, und Gebrüder Isay, Köln, 22.03.1930, NL-AsdJHM, D017188, o. B.; [3]Vertrag (nicht unterzeichnet) samt Anlagen zwischen Immobilien AG Noris i. L. Nürnberg und Abraham und Paul Adelsberger, 15.11.1932, NL-AsdJHM, D017148, o. B. Anlage I.; [4] Aufstellung Abraham Adelsberger, 10.08.1937, NL-AsdJHM, D017147, o. B.; Altes Kunstgewerbe, Möbel, Plastik, Gemälde, Fayencen, antike Uhrensammlung, Perser-Teppiche, 13.02.1940, Aukt. Kat. B. Pfeuffer Nr. 36, Nürnberg 1940, [Externer Link], Stand: 29.07.2020; Kunstpreisverzeichnis 1939-1940, Weltkunst-Verlag (Hg.), Kunstpreisverzeichnis 1939-1940, Berlin-Paris 1941, S. 73."
Suchmeldung;Einzelobjekt;623345;"Baisch, Hermann [Künstler:in]";"Herbstlandschaft / Wald-Interieur / Waldinneres im Herbst";;Gemälde;;"Herbstliche Birken, gemischt mit Tannwald an einem Weiher. Naturstudie. Goldrahmen";"1925 (spätestens) – Nürnberg, Abraham Adelsberger, Erwerb, Zi.-Nr. 2; 08.10.1930 – München, Galerie Hugo Helbing, Versteigerungsangebot, Los 11, ohne Zuschlag; 07.11.1933 – Köln, Abtretungserklärung Wistri GmbH an Alfred Isay, Nr. 2; vmtl. 1933 (um) – vmtl. Köln / Amsterdam, Versicherungsliste Fam. Adelsberger und Isay, Nr. 1; 23.11.1933 – Köln, Kunsthaus Lempertz, Versteigerungsangebot, Los 10, ohne Zuschlag; 12.-14.12.1935 – Köln, Kunsthaus Lempertz, Versteigerungsangebot, Los 25, Einlieferer Ad., ohne Zuschlag; Verbleib unbekannt";2024-09-23;;https://www.lostart.de/de/Verlust/623345;"Boetticher, Friedrich von, Malerwerke des neunzehnten Jahrhunderts, Bd. 1, Dresden 1891; Zimmermann, Walther, Sammlung A. Adelsberger, München 1925, S. 5; Aukt. Kat. Hugo Helbing 1930a: Annotiertes Exemplar Kunsthaus Zürich, Bibliothek, Handexemplar Hugo Helbing; Aukt. Kat. Hugo Helbing 1930a: Annotiertes Exemplar ZI München (DL Nathan), Handexemplar Marie Ducrue; Aukt. Kat. Hugo Helbing 1930a: Annotiertes Exemplar Bayerisches Nationalmuseum, München; o. V., Preisberichte, in: Weltkunst, Jg. IV, Nr. 44, 02.11.1930, S. 6; o. V., Preisberichte, in: Weltkunst, Jg. IV, Nr. 45, 09.11.1930, S. 6; Abtretungserklärung Wistri GmbH an Alfred Isay, 07.11.1933, NL-AsdJHM, D017142; Versicherungsliste Fam. Adelsberger und Isay, vmtl. um 1933; Gemälde neuzeitlicher Meister aus drei Kölner Privatsammlungen: darunter Sammlung Jean Marie Heimann, Köln sowie anderem Privatbesitz, Auktion 358, 23.11.1933, Aukt. Kat. Math. Lempertz, Köln 1933, [Externer Link], Stand: 10.09.2018; o. V., Preisberichte, in: Weltkunst, Jg. VII, Nr. 51, 17.12.1933, S. 3; Postkarte Kunst-Auktionshaus Math. Lempertz an Alfred Isay, o.D., NL-AsdJHM, D017142, o.B.; Gemälde neuzeitlicher und alter Meister, antikes Mobiliar des XVI.‒XIX. Jahrhunderts, altes Kunsthandwerk in Silber, Kupfer, Zinn, Plastiken in Elfenbein und Bronze, Porzellane, Fayencen, Orientteppiche: Nachlässe: von Leonhart, Königswinter, von Ophoven, Bad Soden und anderer Privatbesitz, Auktion 378, 12.‒14.12.1935, Aukt. Kat. Math. Lempertz, Köln 1935, [Externer Link], Stand: 02.07.2020; Aukt. Kat. Lempertz 1935 Annotiertes Exemplar ZI München; Aukt. Kat. Lempertz 1935: Annotiertes Exemplar Kunsthistorisches Institut, Universität Köln; o. V., Preisberichte, in: Weltkunst, Jg. X, Nr. 1, 05.01.1936, S. 4f.; Staatliche Kunsthalle Karlsruhe (Hg.), Katalog Neuere Meister. 19. und 20. Jahrhundert, bearb. von Jan Lauts und Werner Zimmermann, Bd. 1: Textband, Karlsruhe 1971, S. 18.; Mülfarth, Leo, Kleines Lexikon Karlsruher Maler, Karlsruhe 1980."
Suchmeldung;Einzelobjekt;623346;"Bartels, Hans von [Künstler:in]";"Brandung / Holländische Strandszene";;Gemälde;;"Die sich überstürzenden Wogen zerstieben am felsigen Strande.Möglicherweise auch Bleistift- oder Aquarellstudie. Holzrahmen";"1925 (spätestens) – Nürnberg, Abraham Adelsberger, Erwerb, Zi.-Nr. 107; 08.10.1930 – München, Galerie Hugo Helbing, Versteigerungsangebot, Los 13, ohne Zuschlag; vmtl. 1933 (um) – vmtl. Köln / Amsterdam, Versicherungsliste Fam. Adelsberger und Isay, Nr. 2; 07.11.1933 – Köln, Abtretungserklärung Wistri GmbH an Alfred Isay, Nr. 107; 23.11.1933 – Köln, Kunsthaus Lempertz, Versteigerungsangebot, Los 12, ohne Zuschlag; 12.-14.12.1935 – Köln, Kunsthaus Lempertz, Versteigerungsangebot, Los 26, Einlieferer Ad.; 12.-14.12.1935 – Köln, Unbekannt, Ersteigerung, Nr. 26, Zuschlag: 290 RM; Verbleib unbekannt";2024-09-23;;https://www.lostart.de/de/Verlust/623346;"Boetticher, Friedrich von, Malerwerke des neunzehnten Jahrhunderts, Bd. 1, Dresden 1891; Ausstellungskataloge, Glaspalast München, 1892, [Externer Link], Stand: 07.02.2022; Sonder-Ausstellung: Gemälde, Meister ersten Ranges aus dem Besitze d. D. Heinemann'schen Kunsthandlung zu München bei Louis Bock & Sohn, November 1897, Hamburg, S.6, [Externer Link], Stand: 07.02.2023; Heyck, Ed., Hans von Bartels (Künstler-Monographien, hg. von H. Knackfuß et al., Bd. LXVII), Bielefeld / Leipzig 1903, S. 20 f.; Kunstverein, Hans v. Bartels Ausstellung, Lenbachsaal [vmtl. Schack-Galerie], Westwand 2, Darstellungen der brandenden See [Dezember 1913?]; Zimmermann, Walther, Sammlung A. Adelsberger, München 1925, S5; Aukt. Kat. Hugo Helbing 1930a: Annotiertes Exemplar Kunsthaus Zürich, Bibliothek, Handexemplar Hugo Helbing; Aukt. Kat. Hugo Helbing 1930a: Annotiertes Exemplar ZI München (DL Nathan), Handexemplar Marie Ducrue; Aukt. Kat. Hugo Helbing 1930a: Annotiertes Exemplar Bayerisches Nationalmuseum, München; o. V., Preisberichte, in: Weltkunst, Jg. IV, Nr. 44, 02.11.1930, S. 6.; o. V., Preisberichte, in: Weltkunst, Jg. IV, Nr. 45, 09.11.1930, S. 6; Versicherungsliste Fam. Adelsberger und Isay, vmtl. um 1933; Abtretungserklärung Wistri GmbH an Alfred Isay, 07.11.1933, NL-AsdJHM, D017142; Postkarte Lempertz an Alfred Isay, vor 23.11.1933, NL-AsdJHM, D017142, o.B.; Gemälde neuzeitlicher Meister aus drei Kölner Privatsammlungen: darunter Sammlung Jean Marie Heimann, Köln sowie anderem Privatbesitz, Auktionskatalog, Nr. 358, Math. Lempertz Köln, 23.11.1933, [Externer Link], Stand: 10.09.2018; o. V., Preisberichte, in: Weltkunst, Jg. VII, Nr. 51, 17.12.1933, S. 3; Gemälde neuzeitlicher und alter Meister, antikes Mobiliar des XVI. - XIX. Jahrhunderts, altes Kunsthandwerk in Silber, Kupfer, Zinn, Plastiken in Elfenbein und Bronze, Porzellane, Fayencen, Orientteppiche: Nachlässe: von Leonhart, Königswinter, von Ophoven, Bad Soden und anderer Privatbesitz, Auktionskatalog, Nr. 378, Math. Lempertz Köln, 12.-14.12.1935, [Externer Link], Stand: 02.07.2020; Aukt. Kat. Lempertz 1935; Annotiertes Exemplar ZI München; Aukt. Kat. Lempertz 1935. Annotiertes Exemplar Kunsthistorisches Institut, Universität Köln; o. V., Preisberichte, in: Weltkunst, Jg. X, Nr. 1, 05.01.1936, S. 4f.; Hans von Bartels. Een selektie uit Katwijks bezit, Ausst. Kat. Katwijks Museum, 04.04.-12.09.1987, Katwijk an Zee 1987; Buijsse, Jan (Hg.), Hans von Bartels 1856-1913. Schilder tussen het vissersvolk, Ausst. Kat. Katwijks Museum, Katwijk aan Zee, 10.07.-10.11.2018, Zwolle 2018"
Suchmeldung;Einzelobjekt;623348;"Bompard, Maurice [Künstler:in]";"Szene in Tunis";;Gemälde;;"Figuren in Gruppen und einzeln vor, von der Sonne beschienene, weißen Häuser. In der Mitte ein bepackter Esel.";"1925 (spätestens) – Nürnberg, Abraham Adelsberger, Erwerb, Zi.-Nr. 129; 08.10.1930 – München, Galerie Hugo Helbing, Versteigerungsangebot, Los 17, ohne Zuschlag; vmtl. 1933 (um) – vmtl. Köln / Amsterdam, Versicherungsliste Fam. Adelsberger und Isay, Nr. 3; 07.11.1933 – Köln, Abtretungserklärung Wistri GmbH an Alfred Isay, Nr. 29; 23.11.1933 – Köln, Kunsthaus Lempertz, Versteigerungsangebot, Los 29, ohne Zuschlag; 12.-14.12.1935 – Köln, Kunsthaus Lempertz, Versteigerungsangebot, Los 29, Einlieferer Ad., ohne Zuschlag; Verbleib unbekannt";2024-09-23;;https://www.lostart.de/de/Verlust/623348;"Boetticher, Friedrich von, Malerwerke des neunzehnten Jahrhunderts, Bd. 1, Dresden 1891; Zimmermann, Walther, Sammlung A. Adelsberger, München 1925; S.6; Aukt. Kat. Hugo Helbing 1930a: Annotiertes Exemplar Kunsthaus Zürich, Bibliothek, Handexemplar Hugo Helbing; Aukt. Kat. Hugo Helbing 1930a: Annotiertes Exemplar ZI München (DL Nathan), Handexemplar Marie Ducrue; Aukt. Kat. Hugo Helbing 1930a: Annotiertes Exemplar Bayerisches Nationalmuseum, München; o. V., Preisberichte, in: Weltkunst, Jg. IV, Nr. 44, 02.11.1930, S. 6; o. V., Preisberichte, in: Weltkunst, Jg. IV, Nr. 45, 09.11.1930, S. 6; Liste Fam. Adelsberger und Isay, vmtl. um 1933; Abtretungserklärung Wistri GmbH an Alfred Isay, 07.11.1933, NL-AsdJHM, D017142, o. B.; Gemälde neuzeitlicher Meister aus drei Kölner Privatsammlungen: darunter Sammlung Jean Marie Heimann, Köln sowie anderem Privatbesitz, Auktionskatalog, Nr. 358, Math. Lempertz Köln, 23.11.1933, [Externer Link], Stand: 10.09.2018; o. V., Preisberichte, in: Weltkunst, Jg. VII, Nr. 51, 17.12.1933, S. 3; Gemälde neuzeitlicher und alter Meister, antikes Mobiliar des XVI. - XIX. Jahrhunderts, altes Kunsthandwerk in Silber, Kupfer, Zinn, Plastiken in Elfenbein und Bronze, Porzellane, Fayencen, Orientteppiche: Nachlässe: von Leonhart, Königswinter, von Ophoven, Bad Soden und anderer Privatbesitz, Auktionskatalog, Nr. 378, Math. Lempertz Köln, 12.-14.12.1935, [Externer Link], Stand: 02.07.2020; o. V., Preisberichte, in: Weltkunst, Jg. VII, Nr. 51, 17.12.1933, S. 3; Gemälde neuzeitlicher und alter Meister, antikes Mobiliar des XVI. - XIX. Jahrhunderts, altes Kunsthandwerk in Silber, Kupfer, Zinn, Plastiken in Elfenbein und Bronze, Porzellane, Fayencen, Orientteppiche: Nachlässe: von Leonhart, Königswinter, von Ophoven, Bad Soden und anderer Privatbesitz, Auktionskatalog, Nr. 378, Math. Lempertz Köln, 12.-14.12.1935, [Externer Link], Stand: 02.07.2020; Aukt. Kat. Lempertz 1935: Annotiertes Exemplar ZI München; Aukt. Kat. Lempertz 1935: Annotiertes Exemplar ZI München; Aukt. Kat. Lempertz 1935: Annotiertes Exemplar Kunsthistorisches Institut, Universität Köln; o. V., Preisberichte, in: Weltkunst, Jg. X, Nr. 1, 05.01.1936, S. 4f.; Thornton, Lynne, Les orientalistes peintres voyageurs, Paris 1994; Maurice Bompard. Voyage en Orient, Ausst. Kat. Musée Denys-Puech, Rodez, 22.02.–09.06.2013; Musée de Millau et des Grands Causses, 13.07.–16.11.2013, Souyri 2013, [Externer Link], Stand: 14.02.2023"
Suchmeldung;Einzelobjekt;623350;"Bough, Samuel [Künstler:in]";"Gebirgsfluss / Romantische Gebirgslandschaft mit Fluss";;Gemälde;;"Romantische Gebirgslandschaft mit Fluss, englisch, in Goldrahmen";"1925 (spätestens) – Nürnberg, Abraham Adelsberger, Erwerb, Zi.-Nr. 202; 22.03.1930 – Nürnberg, Gebrüder Isay, Sicherungsübereignung durch Abraham Adelsberger, Nr. 9; 15.11.1932 – vmtl. Nürnberg, Sicherungsübereignung Immobilien AG Noris i.L. Nürnberg / Dresdner Bank durch Abraham und Paul Adelsberger; 1938 (um) vmtl. Nürnberg, Karolinenstraße 16, deponiert im Tresor bei der Dresdner Bank, Filiale Nürnberg; 13.02.1940 – Nürnberg, Kunst-Auktionshaus B. Pfeuffer, Versteigerungsangebot, Los 216, Einlieferer J.; 13.02.1940 – Nürnberg, unbekannt, Ersteigerung, Nr. 940, Zuschlag: 110 RM; Verbleib unbekannt";2024-09-23;;https://www.lostart.de/de/Verlust/623350;"Boetticher, Friedrich von, Malerwerke des neunzehnten Jahrhunderts, Bd. 1, Dresden 1891; Zimmermann, Walther, Sammlung A. Adelsberger, München 1925, S. 6; Sicherungsübereignungsvertrag zwischen H. Fischer & Co., Nürnberg, und Gebrüder Isay, Köln, 22.03.1930, NL-AsdJHM, D017188, o. B.; Sicherungsübereignungsvertrag zwischen H. Fischer & Co., Nürnberg, und Gebrüder Isay, Köln, 22.03.1930, NL-AsdJHM, D017188, o. B.; Beschreibung in A’dam, Alfred Isay, 06.06.1938, NL-AsdJHM, D017142, o.B.; Altes Kunstgewerbe, Möbel, Plastik, Gemälde, Fayencen, antike Uhrensammlung, Perser-Teppiche, Auktionskatalog, Nr. 36, B. Pfeuffer Nürnberg, 13.02.1940, [Externer Link], Stand: 29.07.2020; Weltkunst-Verlag (Hg.), Kunstpreisverzeichnis 1939-1940, Berlin-Paris 1941, S. 73"
Suchmeldung;Einzelobjekt;623351;"Courtois, Jacques [Künstler:in]";"Reiterschlacht / Schlachtenszene / Ruitergevecht";;Gemälde;;"derzeit keine weiteren Angaben verfügbar";"1925 (spätestens) – Nürnberg, Abraham Adelsberger, Erwerb, Zi.-Nr. 205; 08.10.1930 – München, Galerie Hugo Helbing, Versteigerungsangebot, Los 19, ohne Zuschlag; 09.12.1931 – München, Galerie Hugo Helbing, Versteigerungsangebot, Los 383, ohne Zuschlag; 07.11.1933 – Köln, Abtretungserklärung Wistri GmbH an Alfred Isay, Nr. 205; vmtl. 1933 (um) – vmtl. Köln / Amsterdam, Versicherungsliste Fam. Adelsberger und Isay, Nr. 4 oder 5; Verbleib unbekannt";2024-09-23;;https://www.lostart.de/de/Verlust/623351;"Boetticher, Friedrich von, Malerwerke des neunzehnten Jahrhunderts, Bd. 1, Dresden 1891; Aukt. Kat. Rudolph Lepke 1917; Zimmermann, Walther, Sammlung A. Adelsberger, München 1925, S. 6; Sammlung A. Adelsberger, Nürnberg, Teil 1: Gemälde alter Meister / Deutsche Gemälde des 19. und 20. Jahrhunderts, Auktionskatalog, Hugo Helbing München, 08.10.1930, [Externer Link], Stand: 01.05.2018; Aukt. Kat. Hugo Helbing 1930a: Annotiertes Exemplar Kunsthaus Zürich, Bibliothek, Handexemplar Hugo Helbing; Aukt. Kat. Hugo Helbing 1930a: Annotiertes Exemplar ZI München (DL Nathan), Handexemplar Marie Ducrue; Aukt. Kat. Hugo Helbing 1930a; Annotiertes Exemplar Bayerisches Nationalmuseum, München; o. V., Preisberichte, in: Weltkunst, Jg. IV, Nr. 44, 02.11.1930, S. 6; Altes Kunstgewerbe, Skulpturen, Wand- und Orientteppiche, Möbel, Gemälde alter Meister: aus dem Nachlass Universitäts-Professor Dr. Karl Schlösser, München, aus der Sammlung Merkens, Köln, aus dem Nachlass eines mitteldeutschen Sammlers und aus anderem Besitz, Aukt. Kat. Hugo Helbing, 09.12.1931, München 1931, [Externer Link], Stand: 01.05.2018; Aukt. Kat. Hugo Helbing 1931b Annotiertes Exemplar ZI München, Handexemplar Hugo Helbing; o. V., Preisberichte, in: Weltkunst, Jg. VI, Nr. 1, 03.01.1932, S. 6; Abtretungserklärung Wistri GmbH an Alfred Isay, 07.11.1933, NL-AsdJHM, D017142, o. B.; Versicherungsliste Fam. Adelsberger und Isay, vmtl. um 1933; Versicherungsliste Fam. Adelsberger und Isay, vmtl. um 1933; Nancy H. Yeide, Beyond the Dreams of Avarice. The Hermann Goering Collection, Dallas 2009, Kat. Nr. A1068, S.367; Rossi, Franca, Jacques Courtois detto il Borgognone. tesi di laurea, Università di Milano 1938 [mit WVZ]"
Suchmeldung;Einzelobjekt;623352;"Courtois, Jacques [Künstler:in]";"Belagerung / Kriegsvolk";;Gemälde;;"Mit den Familien auf der Rast. Holzrahmen";"1925 (spätestens) – Nürnberg, Abraham Adelsberger, Zi-Nr. 204; 08.10.1930 – München, Galerie Hugo Helbing, Versteigerungsangebot, Los 18, ohne Zuschlag; 09.12.1931 – München, Galerie Hugo Helbing, Versteigerungsangebot, Los 383, ohne Zuschlag; 07.11.1933 – Köln, Abtretungserklärung Wistri GmbH an Alfred Isay; vmtl. 1933 (um) – vmtl. Köln / Amsterdam, Versicherungsliste Fam. Adelsberger und Isay, Nr. 4 oder 5; Verbleib unbekannt";2024-09-23;;https://www.lostart.de/de/Verlust/623352;"Boetticher, Friedrich von, Malerwerke des neunzehnten Jahrhunderts, Bd. 1, Dresden 1891; Zimmermann, Walther, Sammlung A. Adelsberger, München 1925, S. 6; Aukt. Kat. Hugo Helbing 1930a: Annotiertes Exemplar Kunsthaus Zürich, Bibliothek, Handexemplar Hugo Helbing; Aukt. Kat. Hugo Helbing 1930a: Annotiertes Exemplar ZI München (DL Nathan), Handexemplar Marie Ducrue; Aukt. Kat. Hugo Helbing 1930a: Annotiertes Exemplar Bayerisches Nationalmuseum, München; Aukt. Kat. Hugo Helbing 1930a: Annotiertes Exemplar Bayerisches Nationalmuseum, München; o. V., Preisberichte, in: Weltkunst, Jg. IV, Nr. 44, 02.11.1930, S. 6; Altes Kunstgewerbe, Skulpturen, Wand- und Orientteppiche, Möbel, Gemälde alter Meister: aus dem Nachlass Universitäts-Professor Dr. Karl Schlösser, München, aus der Sammlung Merkens, Köln, aus dem Nachlass eines mitteldeutschen Sammlers und aus anderem Besitz, 09.12.1931, Aukt. Kat. Hugo Helbing, München 1931, [Externer Link], Stand: 01.05.2018, Stand: 01.05.2018; Aukt. Kat. Hugo Helbing 1931b: Annotiertes Exemplar ZI München, Handexemplar Hugo Helbing; o. V., Preisberichte, in: Weltkunst, Jg. VI, Nr. 1, 03.01.1932, S. 6; Abtretungserklärung Wistri GmbH an Alfred Isay, 07.11.1933, NL-AsdJHM, D017142, o. B.; Versicherungsliste Fam. Adelsberger und Isay, vmtl. um 1933; Versteigerung der Villeneinrichtung und der Gemälde aus dem Nachlasse des Herrn Dr. Albert Weishut, und Kunstsammlungen, Teppiche, Antiquitäten, Möbel usw. aus hocharistokratischem und anderem Besitze, 11.‒16.12.1933, Aukt. Kat. Wiener Auktionshaus J. Fischer, Wien 1933, S. 7, [Externer Link], Stand: 10.03.2023; Rossi, Franca, Jacques Courtois detto il Borgognone. tesi di laurea, Università di Milano 1938 [mit WVZ]"
Suchmeldung;Einzelobjekt;623353;"Brean [Künstler:in]";"Abendstimmung am Fluss";;Gemälde;;"in Goldrahmen";"1925 (spätestens) – Nürnberg, Abraham Adelsberger, Zi-Nr. 112; 22.03.1930 – Nürnberg, Gebrüder Isay, Sicherungsübereignung durch Abraham Adelsberger, Nr. 10; 15.11.1932 – vmtl. Nürnberg, Sicherungsübereignung Immobilien AG Noris i.L. Nürnberg / Dresdner Bank durch Abraham und Paul Adelsberger; 1938 (um) – vmtl. Nürnberg, Karolinenstraße 16, deponiert im Tresor bei der Dresdner Bank, Filiale Nürnberg; 13.02.1940 – Nürnberg, Kunst-Auktionshaus B. Pfeuffer, Versteigerungsangebot, Los 217, Einlieferer J.; 13.02.1940 – Nürnberg, Unbekannt, Ersteigerung, Nr. 941, Zuschlag: 110 RM; Verbleib unbekannt";2024-09-23;;https://www.lostart.de/de/Verlust/623353;"Boetticher, Friedrich von, Malerwerke des neunzehnten Jahrhunderts, Bd. 1, Dresden 1891; Zimmermann, Walther, Sammlung A. Adelsberger, München 1925, S. 6; Sicherungsübereignungsvertrag zwischen H. Fischer & Co., Nürnberg, und Gebrüder Isay, Köln, 22.03.1930, NL-AsdJHM, D017188, o. B.; Vertragsentwurf (?) samt Anlagen zwischen Immobilien AG Noris i. L. Nürnberg und Abraham und Paul Adelsberger, 15.11.1932, NL-AsdJHM, D017148, Anlage I, o. B.; Beschreibung in A’dam, Alfred Isay, 06.06.1938, NL-AsdJHM, D017142, o.B.; Altes Kunstgewerbe, Möbel, Plastik, Gemälde, Fayencen, antike Uhrensammlung, Perser-Teppiche, Auktionskatalog, Nr. 36, B. Pfeuffer Nürnberg, 13.02.1940, [Externer Link], Stand: 29.07.2020; Weltkunst-Verlag (Hg.), Kunstpreisverzeichnis 1939-1940, Berlin-Paris 1941, S. 73"
Suchmeldung;Einzelobjekt;623354;"Brean [Künstler:in]";"Gebirgslandschaft/ Zigeunerwagen im Gebirge / Gebirgslandschaft mit Zigeunerwagen";;Gemälde;;"derzeit keine weiteren Angaben verfügbar";"1925 (spätestens) – Nürnberg, Abraham Adelsberger, Zi-Nr. 130; 22.03.1930 – Nürnberg, Gebrüder Isay, Sicherungsübereignung durch Abraham Adelsberger, Nr. 11; 15.11.1932 – vmtl. Nürnberg, Sicherungsübereignung Immobilien AG Noris i.L. Nürnberg / Dresdner Bank durch Abraham und Paul Adelsberger; 1938 (um) – vmtl. Nürnberg, Karolinenstraße 16, deponiert im Tresor bei der Dresdner Bank, Filiale Nürnberg; 13.02.1940 – Nürnberg, Kunst-Auktionshaus B. Pfeuffer, Versteigerungsangebot, Los 218, Einlieferer J.13.02.1940 – Nürnberg, Unbekannt, Ersteigerung, Nr. 942, Zuschlag: 110 RM; Verbleib unbekannt";2024-09-23;;https://www.lostart.de/de/Verlust/623354;"Boetticher, Friedrich von, Malerwerke des neunzehnten Jahrhunderts, Bd. 1, Dresden 1891; Zimmermann, Walther, Sammlung A. Adelsberger, München 1925, S. 6; Sicherungsübereignungsvertrag zwischen H. Fischer & Co., Nürnberg, und Gebrüder Isay, Köln, 22.03.1930, NL-AsdJHM, D017188, o. B.; Vertragsentwurf (?) samt Anlagen zwischen Immobilien AG Noris i. L. Nürnberg und Abraham und Paul Adelsberger, 15.11.1932, NL-AsdJHM, D017148, o. B., Anlage I; Beschreibung in A’dam, Alfred Isay, 06.06.1938, NL-AsdJHM, D017142, o.B.; Altes Kunstgewerbe, Möbel, Plastik, Gemälde, Fayencen, antike Uhrensammlung, Perser-Teppiche, Auktionskatalog, Nr. 36, B. Pfeuffer Nürnberg, 13.02.1940, [Externer Link], Stand: 29.07.2020; Altes Kunstgewerbe, Möbel, Plastik, Gemälde, Fayencen, antike Uhrensammlung, Perser-Teppiche, Auktionskatalog, Nr. 36, B. Pfeuffer Nürnberg, 13.02.1940, [Externer Link], Stand: 29.07.2020; Boetticher, Friedrich von, Malerwerke des neunzehnten Jahrhunderts, Bd. 1, Dresden 1891; Zimmermann, Walther, Sammlung A. Adelsberger, München 1925, S. 6; Sicherungsübereignungsvertrag zwischen H. Fischer & Co., Nürnberg, und Gebrüder Isay, Köln, 22.03.1930, NL-AsdJHM, D017188, o. B.; Vertragsentwurf (?) samt Anlagen zwischen Immobilien AG Noris i. L. Nürnberg und Abraham und Paul Adelsberger, 15.11.1932, NL-AsdJHM, D017148, Anlage I, o. B.; Beschreibung in A’dam, Alfred Isay, 06.06.1938, NL-AsdJHM, D017142, o.B.; Altes Kunstgewerbe, Möbel, Plastik, Gemälde, Fayencen, antike Uhrensammlung, Perser-Teppiche, Auktionskatalog, Nr. 36, B. Pfeuffer Nürnberg, 13.02.1940, [Externer Link], Stand: 29.07.2020; Weltkunst-Verlag (Hg.), Kunstpreisverzeichnis 1939-1940, Berlin-Paris 1941, S. 73"
