Meldungsart;Datensatzart;"Lost Art ID";Hersteller/Künstler/Autor:in;Titel;Datierung;Objektart;Inventarnummer/Signatur;Beschreibung;Provenienz;"Veröffentlicht seit";Kontakt;Link;"Literatur / Quelle"
Suchmeldung;Einzelobjekt;420863;"Unbekannt [Künstler:in]";"Sophia Anhalt-Zerbst (1654-1724)";;Gemälde;3264;"Gemahlin des Carl Wilhelm zu Anhalt-Zerbst, Tochter des August von Sachsen-Weißenfels";"Herzog Joachim Ernst von Anhalt, Dessauer Schloss";2010-08-31;"Wolf von Trotha (Bevollmächtigter)+49 (0) 69 710 35 554office@trotha.de";https://www.lostart.de/de/Verlust/420863;
Suchmeldung;Einzelobjekt;421260;"Unbekannt [Künstler:in]";"Weibliches Bildnis";;Gemälde;4038;"Bildnis einer Unbekannten";"Herzog Joachim Ernst von Anhalt, Ballenstedter Schloss, zuvor Rotall";2010-08-31;"Wolf von Trotha (Bevollmächtigter)+49 (0) 69 710 35 554office@trotha.de";https://www.lostart.de/de/Verlust/421260;
Suchmeldung;Einzelobjekt;420024;"Unbekannt [Künstler:in]";"Weibliche Bildnis";;Gemälde;1928;"Unbekannte Frau in blauem Kleide Orden, Hermelin und Purpurmantel";"Herzog Joachim Ernst von Anhalt, Dessauer Schloss";2010-08-31;"Wolf von Trotha (Bevollmächtigter)+49 (0) 69 710 35 554office@trotha.de";https://www.lostart.de/de/Verlust/420024;
Suchmeldung;Einzelobjekt;419115;"Rugendas, Georg Philipp (1) [Künstler:in]";"Junges Paar musizierend";"1601/1800 [Datierung]";Gemälde;21;;"Herzog Joachim Ernst von Anhalt, Ballenstedter Schloss, Nordflügel 28";2010-08-31;"Wolf von Trotha (Bevollmächtigter)+49 (0) 69 710 35 554office@trotha.de";https://www.lostart.de/de/Verlust/419115;
Suchmeldung;Einzelobjekt;419485;"Longanstre, Louis von [Künstler:in]";"Luise Henriette Wilhelmine von Anhalt-Dessau (1750-1811)";"1733 (?) [Datierung]";Gemälde;526;"Gemahlin des Leopold Friedrich Franz Herzog von Anhalt, Tochter Friedrich Heinrich von Brandenburg-Schwedt";"Herzog Joachim Ernst von Anhalt, Dessauer Schloss, eingelagert im Schlosstresor";2010-08-31;"Wolf von Trotha (Bevollmächtigter)+49 (0) 69 710 35 554office@trotha.de";https://www.lostart.de/de/Verlust/419485;
Suchmeldung;Einzelobjekt;420814;"Unbekannt [Künstler:in]";"Wilhelm Ludwig Prinz zu Anhalt-Bernburg-Hoym-Schaumburg (1771-1799)";;Gemälde;3179;"Gefallen in der Schlacht bei Stockach in Schwaben 23.3.1799 als kaiserlicher Oberst und ist dort begraben";"Herzog Joachim Ernst von Anhalt, Dessauer Schloss";2010-08-31;"Wolf von Trotha (Bevollmächtigter)+49 (0) 69 710 35 554office@trotha.de";https://www.lostart.de/de/Verlust/420814;
Suchmeldung;Einzelobjekt;419236;"Unbekannt [Künstler:in]";"Männliches Bildnis";;Gemälde;197;"Unbekannter Mann mit Spitzbart; Nach Rubens";"Herzog Joachim Ernst von Anhalt, Dessauer Schloss, altdeutsches Zimmer 138g";2010-08-31;"Wolf von Trotha (Bevollmächtigter)+49 (0) 69 710 35 554office@trotha.de";https://www.lostart.de/de/Verlust/419236;
Suchmeldung;Einzelobjekt;420960;"Unbekannt [Künstler:in]";"Lesender Mann";;Gemälde;3445;;"Herzog Joachim Ernst von Anhalt, Dessauer Schloss";2010-08-31;"Wolf von Trotha (Bevollmächtigter)+49 (0) 69 710 35 554office@trotha.de";https://www.lostart.de/de/Verlust/420960;
Suchmeldung;Einzelobjekt;420898;"Unbekannt [Künstler:in]";"Johann Georg II. Fürst zu Anhalt-Dessau (1627-1693)";;Gemälde;3345;;"Herzog Joachim Ernst von Anhalt, Dessauer Schloss";2010-08-31;"Wolf von Trotha (Bevollmächtigter)+49 (0) 69 710 35 554office@trotha.de";https://www.lostart.de/de/Verlust/420898;
Suchmeldung;Einzelobjekt;419227;"Hüfer [Künstler:in]";"Papst Pius VII.";;Gemälde;182;"Papst Puis VII. 1740-1823, auf einem Lehnstuhle sitzend; Nach David";"Herzog Joachim Ernst von Anhalt, Dessauer Schloss";2010-08-31;"Wolf von Trotha (Bevollmächtigter)+49 (0) 69 710 35 554office@trotha.de";https://www.lostart.de/de/Verlust/419227;
Suchmeldung;Einzelobjekt;420843;"Unbekannt [Künstler:in]";"Leopold III. Friedrich Franz Herzog zu Anhalt-Dessau (1740-1817)";;Gemälde;3232;"In rotem Rock zu Pferde in Landschaft";"Herzog Joachim Ernst von Anhalt, Dessauer Schloss, Museum";2010-08-31;"Wolf von Trotha (Bevollmächtigter)+49 (0) 69 710 35 554office@trotha.de";https://www.lostart.de/de/Verlust/420843;
Suchmeldung;Einzelobjekt;420927;"Krüger, Franz [Künstler:in]";"Friedrich I. Herzog zu Anhalt-Dessau (1831-1904)";;Gemälde;3402;"Als Erbprinz";"Herzog Joachim Ernst von Anhalt, Dessauer Schloss";2010-08-31;"Wolf von Trotha (Bevollmächtigter)+49 (0) 69 710 35 554office@trotha.de";https://www.lostart.de/de/Verlust/420927;
Suchmeldung;Einzelobjekt;420522;"Unbekannt [Künstler:in]";"Leopold III. Friedrich Herzog von Anhalt-Dessau (1794-1871)";;Gemälde;2653;;"Herzog Joachim Ernst von Anhalt, Dessauer Schloss, eingelagert im Schlosstresor";2010-08-31;"Wolf von Trotha (Bevollmächtigter)+49 (0) 69 710 35 554office@trotha.de";https://www.lostart.de/de/Verlust/420522;
Suchmeldung;Einzelobjekt;420342;"Schwendy, Albert [Künstler:in]";"Johanniskirche und ""Unter den Linden"" in Dessau";;Gemälde;2424;;"Herzog Joachim Ernst von Anhalt, Dessauer Schloss";2010-08-31;"Wolf von Trotha (Bevollmächtigter)+49 (0) 69 710 35 554office@trotha.de";https://www.lostart.de/de/Verlust/420342;
Suchmeldung;Einzelobjekt;420715;"Unbekannt [Künstler:in]";Kopfstück;;Gemälde;2974;"Unbekanntes männliches Bildnis";"Herzog Joachim Ernst von Anhalt, Dessauer Schloss";2010-08-31;"Wolf von Trotha (Bevollmächtigter)+49 (0) 69 710 35 554office@trotha.de";https://www.lostart.de/de/Verlust/420715;
Suchmeldung;Einzelobjekt;420674;"Unbekannt [Künstler:in]";"Weibliches Bildnis";;Gemälde;2903;"Brustbild einer Unbekannten, fürstlich; oval";"Herzog Joachim Ernst von Anhalt, Dessauer Schloss, ...Galerie";2010-08-31;"Wolf von Trotha (Bevollmächtigter)+49 (0) 69 710 35 554office@trotha.de";https://www.lostart.de/de/Verlust/420674;
Suchmeldung;Einzelobjekt;420839;"Krause, Wilhelm August Leopold Christian [Künstler:in]";"Bewegte See mit Fahrzeugen";;Gemälde;3228;;"Herzog Joachim Ernst von Anhalt, Ballenstedter Schloss";2010-08-31;"Wolf von Trotha (Bevollmächtigter)+49 (0) 69 710 35 554office@trotha.de";https://www.lostart.de/de/Verlust/420839;
Suchmeldung;Einzelobjekt;420018;"Unbekannt [Künstler:in]";"Friedrich August I. der Starke, Kurfürst von Sachsen, König von Polen (1670-1733)";;Gemälde;1920;;"Herzog Joachim Ernst von Anhalt, Dessauer Schloss";2010-08-31;"Wolf von Trotha (Bevollmächtigter)+49 (0) 69 710 35 554office@trotha.de";https://www.lostart.de/de/Verlust/420018;
Suchmeldung;Einzelobjekt;419809;"Lisiewski, Christian Friedrich Reinhold von [Künstler:in]";"Luise Henriette Wilhelmine zu Anhalt-Dessau (1750-1811)";;Gemälde;1103;"Gemahlin des Leopold Friedrich Franz Herzog zu Anhalt-Dessau, geborene Prinzessin von Brandenburg-Schwedt";"Rotall, Herzog Joachim Ernst von Anhalt, Ballenstedter Schloss";2010-08-31;"Wolf von Trotha (Bevollmächtigter)+49 (0) 69 710 35 554office@trotha.de";https://www.lostart.de/de/Verlust/419809;
Suchmeldung;Einzelobjekt;419354;"Schulz, Karl Friedrich [Künstler:in]";Seestück;;Gemälde;351;;"Herzog Joachim Ernst von Anhalt, Dessauer Schloss, vorher Georgium";2010-08-31;"Wolf von Trotha (Bevollmächtigter)+49 (0) 69 710 35 554office@trotha.de";https://www.lostart.de/de/Verlust/419354;
Suchmeldung;Einzelobjekt;420073;"Unbekannt [Künstler:in]";"Christian August Fürst zu Anhalt-Zerbst (1690-1747)";;Gemälde;2027;"Governeur von Stettin, Vater der Kaierin Katherina II. von Rußland";"Herzog Joachim Ernst von Anhalt, Dessauer Schloss";2010-08-31;"Wolf von Trotha (Bevollmächtigter)+49 (0) 69 710 35 554office@trotha.de";https://www.lostart.de/de/Verlust/420073;
Suchmeldung;Einzelobjekt;420101;"Unbekannt [Künstler:in]";"Bewegte See mit Segelschiffen";;Gemälde;2074;"Links im Bild alte Burg; Nach Bakhuysen, Ludolf (1631-1708)";"Herzog Joachim Ernst von Anhalt, Dessauer Schloss";2010-08-31;"Wolf von Trotha (Bevollmächtigter)+49 (0) 69 710 35 554office@trotha.de";https://www.lostart.de/de/Verlust/420101;
Suchmeldung;Einzelobjekt;421073;"Unbekannt [Künstler:in]";"Ernestine von Sonnenberg (1789-1845)";;Gemälde;3701;"(Frau von Hoym) III. Gemahlin des Alexius Friedrich Christian von Anhalt-Bernburg";"Herzog Joachim Ernst von Anhalt, Ballenstedter Schloss, Vorzimmer zur Kirche";2010-08-31;"Wolf von Trotha (Bevollmächtigter)+49 (0) 69 710 35 554office@trotha.de";https://www.lostart.de/de/Verlust/421073;
Suchmeldung;Einzelobjekt;420341;"Schwendy, Albert [Künstler:in]";"Die alte herzogliche Mühle in Dessau";;Gemälde;2423;;"Herzog Joachim Ernst von Anhalt, Dessauer Schloss";2010-08-31;"Wolf von Trotha (Bevollmächtigter)+49 (0) 69 710 35 554office@trotha.de";https://www.lostart.de/de/Verlust/420341;
Suchmeldung;Einzelobjekt;419434;"Unbekannt [Künstler:in]";"Sophie Dorothea Preußen (1687-1757)";;Gemälde;455;"Gemahlin Friedrich Wilhelm I. v. Preußen, Tochter Georg I. von Großbritannien";"Herzog Joachim Ernst von Anhalt, Dessauer Schloss";2010-08-31;"Wolf von Trotha (Bevollmächtigter)+49 (0) 69 710 35 554office@trotha.de";https://www.lostart.de/de/Verlust/419434;
Suchmeldung;Einzelobjekt;419142;"Molijn, Pieter de [Künstler:in]";"Historische Landschaft";;Gemälde;59;;"Herzog Joachim Ernst von Anhalt, Dessauer Schloss";2010-08-31;"Wolf von Trotha (Bevollmächtigter)+49 (0) 69 710 35 554office@trotha.de";https://www.lostart.de/de/Verlust/419142;
Suchmeldung;Einzelobjekt;420867;"Unbekannt [Künstler:in]";"Romanow, Elisabeth Kaiserin von Rußland (1729-1761/62)";;Gemälde;3269;;"Herzog Joachim Ernst von Anhalt, Dessauer Schloss";2010-08-31;"Wolf von Trotha (Bevollmächtigter)+49 (0) 69 710 35 554office@trotha.de";https://www.lostart.de/de/Verlust/420867;
Suchmeldung;Einzelobjekt;419525;"Unbekannt [Künstler:in]";"Friedrich I. König von Preußen (1657-1713)";;Gemälde;572;;"Herzog Joachim Ernst von Anhalt, Dessauer Schloss";2010-08-31;"Wolf von Trotha (Bevollmächtigter)+49 (0) 69 710 35 554office@trotha.de";https://www.lostart.de/de/Verlust/419525;
Suchmeldung;Einzelobjekt;419756;"Franke, Ph. [Künstler:in]";"Friedrich Erbprinz von Anhalt-Dessau (1769-1714)";;Gemälde;890;"Sohn des Herzog Leopold Friedrich Franz von Anhalt-Dessau, als Kind";"Herzog Joachim Ernst von Anhalt, Dessauer Schloss, zuvor Georgium, Roter Salon";2010-08-31;"Wolf von Trotha (Bevollmächtigter)+49 (0) 69 710 35 554office@trotha.de";https://www.lostart.de/de/Verlust/419756;
Suchmeldung;Einzelobjekt;420488;"Unbekannt [Künstler:in]";"Grafen von Nassau-Dillenburg";;Gemälde;2615;"Johann I. 1536-1606, Ludwig 1538-1574, Adolf 1540-1568 und Heinrich 1550-1574; Nach Wybrand van Geest (1590-1659)";"Herzog Joachim Ernst von Anhalt, Dessauer Schloss, Hauptportal 132";2010-08-31;"Wolf von Trotha (Bevollmächtigter)+49 (0) 69 710 35 554office@trotha.de";https://www.lostart.de/de/Verlust/420488;
Suchmeldung;Einzelobjekt;420496;"Unbekannt [Künstler:in]";Bildnis;;Gemälde;2623;"Bildnis einer unbekannten Person, fürstlich, mit Purpurmantel";"Herzog Joachim Ernst von Anhalt, Dessauer Schloss, Hauptportal 132";2010-08-31;"Wolf von Trotha (Bevollmächtigter)+49 (0) 69 710 35 554office@trotha.de";https://www.lostart.de/de/Verlust/420496;
Suchmeldung;Einzelobjekt;420639;"Höhn, Georg [Künstler:in]";Gebirgslandschaft;;Gemälde;2839;;"Herzog Joachim Ernst von Anhalt, Ballenstedter Schloss";2010-08-31;"Wolf von Trotha (Bevollmächtigter)+49 (0) 69 710 35 554office@trotha.de";https://www.lostart.de/de/Verlust/420639;
Suchmeldung;Einzelobjekt;419303;"Neeffs, Peeter (der Ältere) [Künstler:in]";Kircheninneres;;Gemälde;276;"Inneres einer gotischen Kirche";"Herzog Joachim Ernst von Anhalt, Dessauer Schloss";2010-08-31;"Wolf von Trotha (Bevollmächtigter)+49 (0) 69 710 35 554office@trotha.de";https://www.lostart.de/de/Verlust/419303;
Suchmeldung;Einzelobjekt;420710;"Unbekannt [Künstler:in]";"Marie Auguste Anhalt-Dessau";;Gemälde;2969;"Tochter des Eduard von Anhalt-Dessau, als Kind; achteckig";"Herzog Joachim Ernst von Anhalt, Ballenstedter Schloss";2010-08-31;"Wolf von Trotha (Bevollmächtigter)+49 (0) 69 710 35 554office@trotha.de";https://www.lostart.de/de/Verlust/420710;
Suchmeldung;Einzelobjekt;420542;"Unbekannt [Künstler:in]";"Moritz von Anhalt-Dessau (1712-1760)";;Gemälde;2685;"Sohn des Leopold I. von Anhalt-Dessau";"Herzog Joachim Ernst von Anhalt, Dessauer Schloss, eingelagert im Schlosstresor";2010-08-31;"Wolf von Trotha (Bevollmächtigter)+49 (0) 69 710 35 554office@trotha.de";https://www.lostart.de/de/Verlust/420542;
Suchmeldung;Einzelobjekt;420617;"Höhn, Georg [Künstler:in]";"Waldlandschaft mit zwei Damhirschen";;Gemälde;2810;;"Herzog Joachim Ernst von Anhalt, Ballenstedter Schloss";2010-08-31;"Wolf von Trotha (Bevollmächtigter)+49 (0) 69 710 35 554office@trotha.de";https://www.lostart.de/de/Verlust/420617;
Suchmeldung;Einzelobjekt;419245;"Brand, Johann Christian [Künstler:in]";Ruinenlandschaft;;Gemälde;209;"Römische Ruinen, ruhende Wanderer, beladenes Maultier, Bach";"Herzog Joachim Ernst von Anhalt, Dessauer Schloss";2010-08-31;"Wolf von Trotha (Bevollmächtigter)+49 (0) 69 710 35 554office@trotha.de";https://www.lostart.de/de/Verlust/419245;
Suchmeldung;Einzelobjekt;419547;"Krägen, G. C. [Künstler:in]";"Waldlandschaft bei Dessau";;Gemälde;604;;"Herzog Joachim Ernst von Anhalt, Ballenstedter Schloss";2010-08-31;"Wolf von Trotha (Bevollmächtigter)+49 (0) 69 710 35 554office@trotha.de";https://www.lostart.de/de/Verlust/419547;
Suchmeldung;Einzelobjekt;421142;"Unbekannt [Künstler:in]";Landschaft;;Gemälde;3825;;"Herzog Joachim Ernst von Anhalt, Ballenstedter Schloss";2010-08-31;"Wolf von Trotha (Bevollmächtigter)+49 (0) 69 710 35 554office@trotha.de";https://www.lostart.de/de/Verlust/421142;
Suchmeldung;Einzelobjekt;419465;"Donner, E. [Künstler:in]";Waldlandschaft;"1854 (?) [Datierung]";Gemälde;500;"Hohe Eichen, in der Ferne ein Gewitter";"Herzog Joachim Ernst von Anhalt, Dessauer Schloss";2010-08-31;"Wolf von Trotha (Bevollmächtigter)+49 (0) 69 710 35 554office@trotha.de";https://www.lostart.de/de/Verlust/419465;
Suchmeldung;Einzelobjekt;420334;"Unbekannt [Künstler:in]";"Habsburg, Maria Theresia, Kaiserin von Österreich (1717-1780)";;Gemälde;2416;;"Herzog Joachim Ernst von Anhalt, Dessauer Schloss";2010-08-31;"Wolf von Trotha (Bevollmächtigter)+49 (0) 69 710 35 554office@trotha.de";https://www.lostart.de/de/Verlust/420334;
Suchmeldung;Einzelobjekt;420271;"Anhalt, Leopold Friedrich Herzog von [Künstler:in]";"Anhaltiner Landschaft";;Gemälde;2339;;"Herzog Joachim Ernst von Anhalt, Ballenstedter Schloss";2010-08-31;"Wolf von Trotha (Bevollmächtigter)+49 (0) 69 710 35 554office@trotha.de";https://www.lostart.de/de/Verlust/420271;
Suchmeldung;Einzelobjekt;421291;"Unbekannt (deutsch) [Künstler:in]";"Frucht- und Blumenstück";;Gemälde;4224;;"Herzog Joachim Ernst von Anhalt, Dessauer Schloss";2010-08-31;"Wolf von Trotha (Bevollmächtigter)+49 (0) 69 710 35 554office@trotha.de";https://www.lostart.de/de/Verlust/421291;
Suchmeldung;Einzelobjekt;420473;"Rentzell, August von [Künstler:in]";Dorfstube;;Gemälde;2597;"Mutter Brot schneidend, Kinder, aufrecht sitzender Hund";"Herzog Joachim Ernst von Anhalt, Dessauer Schloss";2010-08-31;"Wolf von Trotha (Bevollmächtigter)+49 (0) 69 710 35 554office@trotha.de";https://www.lostart.de/de/Verlust/420473;
Suchmeldung;Einzelobjekt;420179;"Unbekannt [Künstler:in]";"Ludwig von Anhalt-Köthen-Pleß (1783-1841)";;Gemälde;2175;"Sohn des Friedrich Erdmann von Anhalt-Köthen-Pleß";"Herzog Joachim Ernst von Anhalt, Dessauer Schloss";2010-08-31;"Wolf von Trotha (Bevollmächtigter)+49 (0) 69 710 35 554office@trotha.de";https://www.lostart.de/de/Verlust/420179;
Suchmeldung;Einzelobjekt;419393;"Carracci, Ludovico [Künstler:in]";"Maria mit Kind und buchhaltendem Engel";;Gemälde;401;;"Herzog Joachim Ernst von Anhalt, Dessauer Schloss, Altdeutsches Zimmer 138h";2010-08-31;"Wolf von Trotha (Bevollmächtigter)+49 (0) 69 710 35 554office@trotha.de";https://www.lostart.de/de/Verlust/419393;
Suchmeldung;Einzelobjekt;421252;"Unbekannt [Künstler:in]";"Leopold Erbprinz von Anhalt-Dessau (1855-1886)";;Gemälde;4026;"In der Uniform des I. Gardedragonerregiments";"Herzog Joachim Ernst von Anhalt, Dessauer Schloss-Museum";2010-08-31;"Wolf von Trotha (Bevollmächtigter)+49 (0) 69 710 35 554office@trotha.de";https://www.lostart.de/de/Verlust/421252;
Suchmeldung;Einzelobjekt;419435;"Unbekannt [Künstler:in]";"Madame la duchesse de Brissac";;Gemälde;456;"Madame la duchesse de Brissac auf Delphin sitzend";"Herzog Joachim Ernst von Anhalt, Dessauer Schloss, Lange Galerie 18b2";2010-08-31;"Wolf von Trotha (Bevollmächtigter)+49 (0) 69 710 35 554office@trotha.de";https://www.lostart.de/de/Verlust/419435;
Suchmeldung;Einzelobjekt;419945;"Mytens, Daniel d.Ä. [Künstler:in]";"Eine Prinzessin von Oranien";;Gemälde;1764;;"Herzog Joachim Ernst von Anhalt, Dessauer Schloss";2010-08-31;"Wolf von Trotha (Bevollmächtigter)+49 (0) 69 710 35 554office@trotha.de";https://www.lostart.de/de/Verlust/419945;
Suchmeldung;Einzelobjekt;419159;"Ossenbeeck, Jan van [Künstler:in]";"Viehherde und Stall";;Gemälde;82;Landschaft;"Herzog Joachim Ernst von Anhalt, Dessauer Schloss";2010-08-31;"Wolf von Trotha (Bevollmächtigter)+49 (0) 69 710 35 554office@trotha.de";https://www.lostart.de/de/Verlust/419159;
Suchmeldung;Einzelobjekt;419632;"Triebel, Carl [Künstler:in]";"Zwei Knaben mit Vieh";;Gemälde;712;Landschaft;"Herzog Joachim Ernst von Anhalt, Ballenstedter Schloss";2010-08-31;"Wolf von Trotha (Bevollmächtigter)+49 (0) 69 710 35 554office@trotha.de";https://www.lostart.de/de/Verlust/419632;
Suchmeldung;Einzelobjekt;419652;"Krause, Wilhelm August Leopold Christian [Künstler:in]";Seestück;;Gemälde;736;;"Herzog Joachim Ernst von Anhalt, Ballenstedter Schloss. Am 18.09.1945 an die Russische Komandantur Ballenstedt übergeben.";2010-08-31;"Wolf von Trotha (Bevollmächtigter)+49 (0) 69 710 35 554office@trotha.de";https://www.lostart.de/de/Verlust/419652;
Suchmeldung;Einzelobjekt;420983;"Unbekannt [Künstler:in]";Hoze;;Gemälde;3509;"Der Arzt Johann Hoze im Pelzrock";"Herzog Joachim Ernst von Anhalt, Dessauer Schloss, Vorrat";2010-08-31;"Wolf von Trotha (Bevollmächtigter)+49 (0) 69 710 35 554office@trotha.de";https://www.lostart.de/de/Verlust/420983;
Suchmeldung;Einzelobjekt;419252;"Bouts, Pieter [Künstler:in]";"Viehherde am Wasser";;Gemälde;216;"Landschaft; Viehherde am Wasser stehend, Gebirge";"Herzog Joachim Ernst von Anhalt, Dessauer Schloss";2010-08-31;"Wolf von Trotha (Bevollmächtigter)+49 (0) 69 710 35 554office@trotha.de";https://www.lostart.de/de/Verlust/419252;
Suchmeldung;Einzelobjekt;420126;"Trautmann, Carl Friedrich [Künstler:in]";"Waldlandschaft mit Staffage";;Gemälde;2113;"Frau mit Kind auf Waldweg kommend";"Herzog Joachim Ernst von Anhalt, Dessauer Schloss";2010-08-31;"Wolf von Trotha (Bevollmächtigter)+49 (0) 69 710 35 554office@trotha.de";https://www.lostart.de/de/Verlust/420126;
Suchmeldung;Einzelobjekt;419914;"Donner, E., [Künstler:in]";Landschaft;;Gemälde;1707;;"Herzog Joachim Ernst von Anhalt, Ballenstedter Schloss";2010-08-31;"Wolf von Trotha (Bevollmächtigter)+49 (0) 69 710 35 554office@trotha.de";https://www.lostart.de/de/Verlust/419914;
Suchmeldung;Einzelobjekt;420470;"Unbekannt [Künstler:in]";"Männliches Bildnis";;Gemälde;2591;"Bildnis eines Unbekannt, fürstlich, in roter Uniform mit schwarzem Adlerorden";"Herzog Joachim Ernst von Anhalt, Dessauer Schloss";2010-08-31;"Wolf von Trotha (Bevollmächtigter)+49 (0) 69 710 35 554office@trotha.de";https://www.lostart.de/de/Verlust/420470;
Suchmeldung;Einzelobjekt;420487;"Unbekannt [Künstler:in]";"Männliches Bildnis";;Gemälde;2614;"Bildnis eines Unbekannten, fürstlich, mit Perücke, Sturmhaube, Harnisch; Nach Wybrand van Geest (1590-1659)";"Herzog Joachim Ernst von Anhalt, Dessauer Schloss, Steintreppe 80";2010-08-31;"Wolf von Trotha (Bevollmächtigter)+49 (0) 69 710 35 554office@trotha.de";https://www.lostart.de/de/Verlust/420487;
Suchmeldung;Einzelobjekt;420133;"Unbekannt [Künstler:in]";"Gustav Adolph II. König von Schweden (1594-1632)";;Gemälde;2120;"In dunklem Gewande und weißem Spitzenkragen";"Herzog Joachim Ernst von Anhalt, Dessauer Schloss, Turmtreppe";2010-08-31;"Wolf von Trotha (Bevollmächtigter)+49 (0) 69 710 35 554office@trotha.de";https://www.lostart.de/de/Verlust/420133;
Suchmeldung;Einzelobjekt;420367;"Unbekannt [Künstler:in]";Kinderbildnis;;Gemälde;2461;"Bildnis eines unbekannten Kindes in fürstlicher Kleidung";"Herzog Joachim Ernst von Anhalt, Dessauer Schloss";2010-08-31;"Wolf von Trotha (Bevollmächtigter)+49 (0) 69 710 35 554office@trotha.de";https://www.lostart.de/de/Verlust/420367;
Suchmeldung;Einzelobjekt;419509;"Unbekannt [Künstler:in]";"Friedrich III., Deutscher Kaiser und König von Preußen (1831-1889)";;Gemälde;556;;"Herzog Joachim Ernst von Anhalt, Dessauer Schloss";2010-08-31;"Wolf von Trotha (Bevollmächtigter)+49 (0) 69 710 35 554office@trotha.de";https://www.lostart.de/de/Verlust/419509;
Suchmeldung;Einzelobjekt;420917;"Unbekannt [Künstler:in]";"Leopold I. Fürst zu Anhalt-Dessau (1676-1747)";;Gemälde;3384;;"Herzog Joachim Ernst von Anhalt, Dessauer Schloss";2010-08-31;"Wolf von Trotha (Bevollmächtigter)+49 (0) 69 710 35 554office@trotha.de";https://www.lostart.de/de/Verlust/420917;
Suchmeldung;Einzelobjekt;420837;"Unbekannt [Künstler:in]";"Johann Casimir Fürst zu Anhalt-Dessau (1596-1660)";"1658 [Datierung]";Gemälde;3223;"In schwarzem Gewande";"Herzog Joachim Ernst von Anhalt, Dessauer Schloss";2010-08-31;"Wolf von Trotha (Bevollmächtigter)+49 (0) 69 710 35 554office@trotha.de";https://www.lostart.de/de/Verlust/420837;
Suchmeldung;Einzelobjekt;421177;"Paritius, Christian Jacob [Künstler:in]";"Leopold I. Fürst zu Anhalt-Dessau (1676-1747)";;Gemälde;3879;;"Herzog Joachim Ernst von Anhalt, Dessauer Schloss";2010-08-31;"Wolf von Trotha (Bevollmächtigter)+49 (0) 69 710 35 554office@trotha.de";https://www.lostart.de/de/Verlust/421177;
Suchmeldung;Einzelobjekt;420077;"Anhalt, Leopold Friedrich Herzog von [Künstler:in]";Landschaft;;Gemälde;2035;;"Herzog Joachim Ernst von Anhalt, Ballenstedter Schloss";2010-08-31;"Wolf von Trotha (Bevollmächtigter)+49 (0) 69 710 35 554office@trotha.de";https://www.lostart.de/de/Verlust/420077;
Suchmeldung;Einzelobjekt;419344;"Both, Jan [Künstler:in]";Abendlandschaft;;Gemälde;330;;"Herzog Joachim Ernst von Anhalt, Dessauer Georgium beim Pächter";2010-08-31;"Wolf von Trotha (Bevollmächtigter)+49 (0) 69 710 35 554office@trotha.de";https://www.lostart.de/de/Verlust/419344;
Suchmeldung;Einzelobjekt;419345;"Brand, Christian Hilfgott [Künstler:in]";"Wasserlandschaft mit Fahrzeugen";;Gemälde;338;"Gehöfte und Bäume";"Herzog Joachim Ernst von Anhalt, Dessauer Schloss";2010-08-31;"Wolf von Trotha (Bevollmächtigter)+49 (0) 69 710 35 554office@trotha.de";https://www.lostart.de/de/Verlust/419345;
Suchmeldung;Einzelobjekt;419456;"Triebel, Carl [Künstler:in]";Landschaft;;Gemälde;487;;"Dessau Schloss, vorher Georgium";2010-08-31;"Wolf von Trotha (Bevollmächtigter)+49 (0) 69 710 35 554office@trotha.de";https://www.lostart.de/de/Verlust/419456;
Suchmeldung;Einzelobjekt;419528;"Unbekannt [Künstler:in]";"Anna Luise von Anhalt-Dessau (1677-1745)";;Gemälde;575;"Gemahlin des Leopold Fürst von Anhalt-Dessau, geborene Föse (Reichsgräfin)";"Herzog Joachim Ernst von Anhalt, Dessauer Schloss, vorher Geogium";2010-08-31;"Wolf von Trotha (Bevollmächtigter)+49 (0) 69 710 35 554office@trotha.de";https://www.lostart.de/de/Verlust/419528;
Suchmeldung;Einzelobjekt;419198;"Conca, Sebastiano [Künstler:in]";"Amphitrite und junger Triton";;Gemälde;131;;"Herzog Joachim Ernst von Anhalt, Ballenstedter Schloss, Nordflügel 14";2010-08-31;"Wolf von Trotha (Bevollmächtigter)+49 (0) 69 710 35 554office@trotha.de";https://www.lostart.de/de/Verlust/419198;
Suchmeldung;Einzelobjekt;419147;"Brand, Christian Hilfgott [Künstler:in]";"Kleine Landschaft mit Baum und Wasser";;Gemälde;67;;"Herzog Joachim Ernst von Anhalt, Ballenstedter Schloss";2010-08-31;"Wolf von Trotha (Bevollmächtigter)+49 (0) 69 710 35 554office@trotha.de";https://www.lostart.de/de/Verlust/419147;
Suchmeldung;Einzelobjekt;419363;"Hoet, Gerard (1) [Künstler:in]";"Diana im Bade";;Gemälde;361;;"Herzog Joachim Ernst von Anhalt, Dessauer Schloss";2010-08-31;"Wolf von Trotha (Bevollmächtigter)+49 (0) 69 710 35 554office@trotha.de";https://www.lostart.de/de/Verlust/419363;
Suchmeldung;Einzelobjekt;419875;"Unbekannt [Künstler:in]";"Elisabeth von Brandenburg (1563-1607)";;Gemälde;1415;"Gemahlin des Kurfürsten Johann Georg von Brandenburg, Tochter des Fürsten Joachim Ernst von Anhalt";"Herzog Joachim Ernst von Anhalt, Dessauer Schloss";2010-08-31;"Wolf von Trotha (Bevollmächtigter)+49 (0) 69 710 35 554office@trotha.de";https://www.lostart.de/de/Verlust/419875;
Suchmeldung;Einzelobjekt;419896;"Pesne, Antoine [Künstler:in]";"Leopold II. Maximilian Fürst zu Anhalt-Dessau (1700-1751)";;Gemälde;1550;;"Herzog Joachim Ernst von Anhalt, Dessauer Schloss";2010-08-31;"Wolf von Trotha (Bevollmächtigter)+49 (0) 69 710 35 554office@trotha.de";https://www.lostart.de/de/Verlust/419896;
Suchmeldung;Einzelobjekt;420324;"Unbekannt [Künstler:in]";"Weibliches Bildnis";;Gemälde;2404;"Unbekannte Frau mit blauem Umhang und Schleifen";"Herzog Joachim Ernst von Anhalt, Dessauer Schloss";2010-08-31;"Wolf von Trotha (Bevollmächtigter)+49 (0) 69 710 35 554office@trotha.de";https://www.lostart.de/de/Verlust/420324;
Suchmeldung;Einzelobjekt;420605;"Wernecke, Paul [Künstler:in]";"Suporte mit dem Schloss in Sigmaringen";;Malerei;2798;;"Herzog Joachim Ernst von Anhalt, Dessauer Schloss";2010-08-31;"Wolf von Trotha (Bevollmächtigter)+49 (0) 69 710 35 554office@trotha.de";https://www.lostart.de/de/Verlust/420605;
Suchmeldung;Einzelobjekt;420345;"Preyer, Johann Wilhelm [Künstler:in]";"Stillleben mit Früchten";;Gemälde;2428;;"Herzog Joachim Ernst von Anhalt, Ballenstedter Schloss";2010-08-31;"Wolf von Trotha (Bevollmächtigter)+49 (0) 69 710 35 554office@trotha.de";https://www.lostart.de/de/Verlust/420345;
