Meldungsart;Datensatzart;"Lost Art ID";Hersteller/Künstler/Autor:in;Titel;Datierung;Objektart;Inventarnummer/Signatur;Beschreibung;Provenienz;"Veröffentlicht seit";Kontakt;Link;"Literatur / Quelle"
Suchmeldung;Einzelobjekt;5000005061;;"Ebert, Johann Arnold";"1770 [Datierung]";Malerei;A/37;"Rückseite beschriftet:""Johann Arnold Ebert, gemalt von Calau mit Oel und Wachs zu Braunschweig 1770.""";;2006-08-04;"Gleimhaus
LiteraturmuseumDomplatz 3138820 Halberstadt(03941) 68710(03941) 687140gleimhaus@halberstadt.dehttp://www.gleimhaus.deLacher, Dr. Reimar (Kunstsammlung)+49 (0)39 41.68 710gleimhaus@halberstadt.deLoose, Annegret (Bibliothekarin)+49 (0)3941.68710gleimhaus@halberstadt.dePott, Dr. Ute (Direktorin)+49 (0)3941.68710gleimhaus@halberstadt.de";https://www.lostart.de/de/Verlust/5000005061;
Suchmeldung;Einzelobjekt;5000005063;;"Gleim, Matthias Leberecht Kaspar";"1778 [Datierung]";Malerei;A/7;"Rückseite beschriftet:""Für Gleim wegen seines edlen Herzens, das sichtbar wurde vielen, die es sahn, wie er Pfirsiche austheilte, C. F. R. v. Liszewsky 1778.""";;2006-08-04;"Gleimhaus
LiteraturmuseumDomplatz 3138820 Halberstadt(03941) 68710(03941) 687140gleimhaus@halberstadt.dehttp://www.gleimhaus.deLacher, Dr. Reimar (Kunstsammlung)+49 (0)39 41.68 710gleimhaus@halberstadt.deLoose, Annegret (Bibliothekarin)+49 (0)3941.68710gleimhaus@halberstadt.dePott, Dr. Ute (Direktorin)+49 (0)3941.68710gleimhaus@halberstadt.de";https://www.lostart.de/de/Verlust/5000005063;
Fundmeldung;Einzelobjekt;5000003569;"Piglhein, Bruno [Künstler:in]";Selbstbildnis;"1874 [Datierung]";Malerei;HK-2758;"Selbstbildnis des Künstlers mit Hund";"Elimar Ulrich Bruno Piglhein (1848 - 1894), 1874; Ludwig Piglhein (Vater des Künstlers), 1874 - ca. 1876; Schwester des Künstlers (verheiratet seit 1873 mit Nachfolgendem), 1876 - ?; Pastor prim. Gramberg, Jever, (Schwager des Künstlers und Ehemann der Schwester seit 1873), ca. 1895 - mind. 1898; [...]; Frau M. Gramberg,? - 6.3.1941; Kunstkabinett Dr. Hildebrand Gurlitt, Hamburg, 6.3. - 9.3.1941; Ankauf von dort, 9.3.1941 (als Leihgabe bereits seit 1940 im Bestand)";2004-03-04;"Hamburger KunsthalleGlockengießerwall20095 Hamburg(040) 428131-207(040) 42854-2559info@hamburger-kunsthalle.dehttp://www.hamburger-kunsthalle.deProf. Dr. Alexander Klar  (Direktor (ab 01.08.2019))040 428131 207";https://www.lostart.de/de/Fund/5000003569;
Fundmeldung;Einzelobjekt;5000003908;"Thoma, Hans [Künstler:in]";Abendfrieden;"1871 [Datierung]";Gemälde;HK-2761;"Am Fuße eines Wiesenhanges führt eine Bäuerin zwei Ziegen nach links, vor ihr geht ein kleines Kind mit einem Blumenstrauß in den Händen.";"Hans Thoma (1839 - 1924), 1871 - ?; [...]; ? Slg. Thomas Tee, Manchester, 1872; [...]; Galerie Gurlitt, Berlin, mind. seit 1940 - 1941; Ankauf von dort, 29.3.1941";2004-07-20;"Hamburger KunsthalleGlockengießerwall20095 Hamburg(040) 428131-207(040) 42854-2559info@hamburger-kunsthalle.dehttp://www.hamburger-kunsthalle.deProf. Dr. Alexander Klar  (Direktor (ab 01.08.2019))040 428131 207";https://www.lostart.de/de/Fund/5000003908;
Fundmeldung;Einzelobjekt;5000004051;"Kalckreuth, Leopold von (Graf) [Künstler:in]";"Landschaft mit Schober";"1900 [Datierung]";Malerei;HK-2763;"Zwei Strohschober stehen links auf einem abgeerneten Feld. Im Hintergrund sind Häuser und rechts oben am Himmel ein Vogelschwarm.";"Leopold Karl Walter von Kalckreuth (1855 - 1928), 1900 - mind. 1902; [...]; Slg. Adolf Rothermundt (1846 - 1930), Dresden, ? - längstens 1930; [...]; (Kunsthändler) Paul Roemer, Berlin,? - 6./9.3.1941; Kunstkabinett Dr. Hildebrand Gurlitt, Hamburg, 9.3.1941 - 9.3.1941; Ankauf von dort gemeinsam mit dem Gemälde ""Landschaft mit Regenbogen"" von Hans Thoma (Inv. Nr. E-2762), im Tausch gegen Abgabe von Max Liebermanns Gemälden ""Christus im Tempel (E-1586, heute HK-5424), ""Wagen an den Dünen"" (Inv. Nr. E-1588), ""Beim Tischgebet"" (Inv. Nr. E-1581) und ""Polospieler"" (Inv. Nr. E-1589) (Wert aller Werke zusammen 14.000 RM) sowie dem Gemälde ""Florenz"" von Oskar Kokoschka (Inv. Nr. E-2387, Wert 4.000 Reichsmark (RM), 6./9.3.1941";2005-01-13;"Hamburger KunsthalleGlockengießerwall20095 Hamburg(040) 428131-207(040) 42854-2559info@hamburger-kunsthalle.dehttp://www.hamburger-kunsthalle.deProf. Dr. Alexander Klar  (Direktor (ab 01.08.2019))040 428131 207";https://www.lostart.de/de/Fund/5000004051;
Fundmeldung;Einzelobjekt;5000004052;"Kalckreuth, Leopold von (Graf) [Künstler:in]";"Der Dorfschulze / Onkel Andreas";"1890 [Datierung]";Malerei;HK-2726;"Andreas Volquardsen, der Dargestellte, steht nach links gewandt, mit den Armen auf den Rücken, in einem bäuerlich eingerichteten Raum. Er trägt einen dunklen Anzug mit hochgeschlossener Weste. Im Hintergrund ist sein Schreibpult zu erkennen.";"Leopold Karl Walter von Kalckreuth, 1890 - vermutl. mind. 1902 (1); [...] (2); Slg. Adolf Rothermundt, Dresden, mind. 1910 - mind. 1918 (2); eventuell Galerie Ernst Arnold, Dresden, 1918 (3); [...] (4); Paul Roemer, ? - 30.11.1938 (5); Kunstkabinett Dr. Hildebrand Gurlitt, Hamburg, 30.11.1938 - 11.1. / 1.2.1939 (6); Ankauf von dort mit Mitteln aus dem Vermächtnis von Beer Carl Heine (1810-1865), 11.1./1.2.1939";2005-01-13;"Hamburger KunsthalleGlockengießerwall20095 Hamburg(040) 428131-207(040) 42854-2559info@hamburger-kunsthalle.dehttp://www.hamburger-kunsthalle.deProf. Dr. Alexander Klar  (Direktor (ab 01.08.2019))040 428131 207";https://www.lostart.de/de/Fund/5000004052;
Fundmeldung;Einzelobjekt;5000004131;"Eybe, Carl Gottfried [Künstler:in]";Caritas;"1844/45 o. 1847 [Datierung]";Malerei;HK-2745;"Eine junge entblößte Frau sitzt unter einem Baum. Zu ihrer linken befinden sich zwei ebenfalls nackte Kinder, ebenso zu ihrer Rechten, hinter ihr steht ein weiteres Kind.";"Carl Gottfried Eybe, 1844/45 o. 1847 - ?; [...]; Verlosung des Kunstvereins Hamburg, 1868; Slg. und Leihgabe von Ferdinand Benjamin Leo, Hamburg, 1868 - 1881; Vermächtnis desselben, Hamburg, 1881; Hamburger Kunsthalle, 1881 - 22.12.1919; Verkauf an die Kunsthandlung Louis Bock & Sohn, Hamburg, 22.12.1919; [...]; Aukt. Rudolf Bangel, Frankfurt a. M., Nr. 44, 22.-25.02.1921; [...]; Martha Ottmer, Hamburg, ? - 1940; Max Behrens, Hamburg, 1940";2005-01-26;"Hamburger KunsthalleGlockengießerwall20095 Hamburg(040) 428131-207(040) 42854-2559info@hamburger-kunsthalle.dehttp://www.hamburger-kunsthalle.deProf. Dr. Alexander Klar  (Direktor (ab 01.08.2019))040 428131 207";https://www.lostart.de/de/Fund/5000004131;
Fundmeldung;Einzelobjekt;5000003568;"Thoma, Hans [Künstler:in]";"Feierabend / Märchenstunde / Bibelstunde";"1868 [Datierung]";Malerei;HK-2734;"Eine junge Frau sitzt rechts neben einer älteren Frau auf einer Bank, die aus einem Buch vorliest. Am Boden vor den beiden liegt ein Junge.";"Hans Thoma, 1871; Sammlung Thomas Tee, Manchester; Barkleay 1938; Kunsthändler Dr. H. Roland und Dr. G. Delbanco, London, 1938; Kunsthändler Karl Haberstock, Berlin, 1938; Ankauf von diesem durch die Hamburger Kunsthalle, 1939";2004-03-04;"Hamburger KunsthalleGlockengießerwall20095 Hamburg(040) 428131-207(040) 42854-2559info@hamburger-kunsthalle.dehttp://www.hamburger-kunsthalle.deProf. Dr. Alexander Klar  (Direktor (ab 01.08.2019))040 428131 207";https://www.lostart.de/de/Fund/5000003568;
Suchmeldung;Einzelobjekt;616157;"Bassano, Jacopo (oder seine Schule) [Künstler:in]";"Anbetung der Hirten";;Gemälde;;;"Marcell Nemes, Budapest-München; verkauft auf der Auktion Ernst, EMA, XXIII. 1923. Nr. 36. IV. Tabelle; Baron Mor Lipot Herzog, Budapest; Baronin Mor Lipot Herzog, Budapest, 1934, durch Erbfolge; Herzog Andras, Erzsebet, Istvan, 1940, durch Erbfolge; Während des Zweiten Weltkriegs verschollen - NS-verfolgungsbedingter Entzug wird vermutet; Verbleib unbekannt";2023-11-09;"Agnes Peresztegi (Avocat)agnes@peresztegi.com";https://www.lostart.de/de/Verlust/616157;"Takács, Zoltán, Új szerzemények Nemes Marcell gyűjteményében [New Acquisitions in the Collection of Marcell Nemes] In: A gyűjtő I. 1912 [The Collector] 18, illustrated.; Kőszeghy, Elemér: „Ingó műemlékek leltára” [Summary Inventory of Moveable Assets] 1934/35. Archives of the Museum of Applied Arts, Budapest. Herzog. Paintings, Bassano.; A Herzog palotában zárolt Herzog és Sváb féle műtárgyak [Impounded artworks of the Herzog and Sváb families in the Herzog-palace] 452/1944. Kormánybiztosság a zsidók zár alá vet műtárgyainak számbavételére és megőrzésére [Government Commission for the Inventory and Preservation of the Impounded Jewish-owned Artworks] Magyar Nemzeti Múzeum. Országos Magyar Szépművészeti Múzeum [Hungarian National Museum. National Hungarian Museum of Fine Arts] Magyar Nemzeti Levéltár [National Archives of Hungary] OL K 643-1944-452.. p. 32, No. 52.; Régi mesterek magyar magántulajdonban. Exhibition of Old Masters in Hungarian Private Collections. Országos Szépművészeti Múzeum. Museum of Fine Arts Budapest, 1946. No. 6 (Jacopo Bassano, size 104 x 152.5 cm); Mravik, László, The ""Sacco Di Budapest"" and Depredation of Hungary, 1938-1949: Works of Art Missing from Hungary as a Result of the Second World War : Looted, Smuggled, Captured, Lost and Destroyed Art Works, Books and Archival Documents : Preliminary and Provisional Catalog, 1998, Hungarian National Gallery, Budapest. No. 19845, p. 312."
Suchmeldung;Einzelobjekt;616170;"Giorgione (Stil von) [Künstler:in]De'Pitati, Bonifacio [Künstler:in]";"Christus und die Ehebrecherin";"1501/1600 [Datierung]";Gemälde;;"Komposition mit vielen Figuren";"Lord Northwick; Northwick Estate Sale, Thirlestane House, Cheltenham, 26. Juli 1859 und folgende Tage, Lot 1577 (als Giorgione); Christie, Manson and Woods, London, 25. November 1911, Lot 116 (als Giorgione); Knoedler, London, erworben bei der oben genannten Versteigerung (von Knoedler als ein Werk von Bonifacio Veronese angesehen); Marcell Nemes, Budapest-München, erworben von dem oben genannten, Dezember 1912; Baron Mor Lipot Herzog, Budapest, erworben von dem oben Genannten, Juli 1915; Baronin Mor Lipot Herzog, Budapest, 1934 durch Erbfolge; Herzog Andras, Erzsebet, Istvan, 1940, durch Erbfolge; im Zweiten Weltkrieg verloren, von den Nazis geraubt, Budapest, 1944, und danach auf Schloss Fischhorn deponiert; von der US-Armee nach Polen überführt, nachdem es fälschlicherweise als polnisches Eigentum identifiziert worden war; Muzeum Narodowe, Warschau, Inv. 2191 (alt. 187150), erworben im Jahr 1946";2023-11-09;"Agnes Peresztegi (Avocat)agnes@peresztegi.com";https://www.lostart.de/de/Verlust/616170;"A köztulajdonba vett műkincsek első kiállítása [The First Exhibition of the Nationalized Artworks.] Budapest, Műcsarnok [Exposition of Art] 1919. Room I, no. 38.; Herzog Mór Lipót műtárgyainak lefoglalása. Lefoglalási jegyzőkönyvek, [Seizure of Lipót Mór Herzog's artworks. Seizure records] March, 1919. Budapest. Archives of the Museum of Fine Arts, Budapest. No. 60.; Jegyzőkönyv a báró Herzog Lipót Mór úr köztulajdonba vett képzőművészeti alkotások visszaadása tárgyában. [Minutes regarding the return of artworks of baron Herzog Lipót Mór taken into public ownership.] September 5, 1921. Archives of the Museum of Fine Arts, Budapest. No. 60.; Éber, László ed., Művészeti Lexikon. Építészet. Szobrászat. Festészet. Iparművészet. [Art Lexicon. Architecture. Sculpture. Painting. Applied Art.] 1926, Andor Győző kiadása, Budapest. vol. 1, p. 110.; Németek által elhurcolt műkincsek [Artworks carried away by Germans] 67.896/1947, Magyar Nemzeti Levéltár [National Archives of Hungary] XXIX-L-2-r. Baroness Alfonz Weiss, No. 5.; Wer kann Auskunft geben über den Verbleib nachstendend abgebildeter bzw. beschriebener Bilde der früheren Sammlung Baron Herzog, Budapest, welche seit der deutscher Besetzung von 1944 wermiesst werden? „Die Weltkunst” XX. 1. Oktober, 1950. No. 19.; Mravik, László, The ""Sacco Di Budapest"" and Depredation of Hungary, 1938-1949: Works of Art Missing from Hungary as a Result of the Second World War : Looted, Smuggled, Captured, Lost and Destroyed Art Works, Books and Archival Documents : Preliminary and Provisional Catalog, 1998, Hungarian National Gallery, Budapest. No. 19840, p. 310.; Serenissima: Światło Wenecji [Serenissima: The Light of Venice], Muzeum Narodwe, Warsaw, October–December 1999."
Suchmeldung;Einzelobjekt;616173;"El Greco (und Werkstatt) [Künstler:in]";"Der Apostel Jakobus der Jüngere als Pilger";"1600 (ca.) [Datierung]";Gemälde;;;"Sammlung Theodore Duret, Paris; Marcell Nemes, Budapest-München, erworben von den oben genannten; Baron Mor Lipot Herzog, Budapest, 1915; Baronin Mor Lipot Herzog, Budapest, 1934 durch Erbfolge; Herzog Andras, Erzsebet, Istvan, 1940, durch Erbfolge; während des Zweiten Weltkriegs verschollen - NS-verfolgungsbedingter Entzug wird vermutet; Staatliches Kunstmuseum Nischni Nowgorod";2023-11-09;"Agnes Peresztegi (Avocat)agnes@peresztegi.com";https://www.lostart.de/de/Verlust/616173;"Ludwig Baldass, “Herzog báró gyűjteménye [The Collection of Baron Herzog],” in: Magyar Művészet [Hungarian Art], vol III (1927), 179, 190, illustrated; Kőszeghy, Elemér: „Ingó műemlékek leltára” [Summary Inventory of Moveable Assets] 1934/35. Archives of the Museum of Applied Arts, Budapest. Herzog Paintings. No. 38.; Németek által elhurcolt műkincsek [Artworks carried away by Germans] 67.896/1947, Magyar Nemzeti Levéltár [National Archives of Hungary] XXIX-L-2-r. Baroness Alfonz Weiss, No. 5.; Wer kann Auskunft geben über den Verbleib nachstendend abgebildeter bzw. beschriebener Bilde der früheren Sammlung Baron Herzog, Budapest, welche seit der deutscher Besetzung von 1944 wermiesst werden? „Die Weltkunst” XX. 1. Oktober, 1950. No. 19.; Mravik, László, The ""Sacco Di Budapest"" and Depredation of Hungary, 1938-1949: Works of Art Missing from Hungary as a Result of the Second World War : Looted, Smuggled, Captured, Lost and Destroyed Art Works, Books and Archival Documents : Preliminary and Provisional Catalog, 1998, Hungarian National Gallery, Budapest. No. 19875, p. 319.; Project “Heritage Revealed”, Catalog of art Objects from Hungarian Private Collections, Moscow, Rudomino, 2003. p. 96, illustrated."
Suchmeldung;Einzelobjekt;616174;"Fantin-Latour, Henri [Künstler:in]";"Stillleben mit Blume";;Gemälde;;signiert;"Paul Rosenberg Pére, Paris; Baron Mor Lipot Herzog, Budapest, 1911; Baronin Mor Lipot Herzog, Budapest, 1934, durch Erbfolge; Herzog Andras, Erzsebet, Istvan, 1940, durch Erbfolge; während des Zweiten Weltkriegs verschollen - NS-verfolgungsbedingter Entzug wird vermutet; Verbleib unbekannt";2023-11-09;"Agnes Peresztegi (Avocat)agnes@peresztegi.com";https://www.lostart.de/de/Verlust/616174;"Biermann, Georg, Die Gemäldesammlung des Baron Herzog in Budapest. In: Der Cicerone IV, 1912.1912, p. 13, 16.; A köztulajdonba vett műkincsek első kiállítása [The First Exhibition of the Nationalized Artworks.] Budapest, Műcsarnok [Exposition of Art] 1919. Room VI. No. 22.; Herzog Mór Lipót műtárgyainak lefoglalása. Lefoglalási jegyzőkönyvek, [Seizure of Lipót Mór Herzog's artworks. Seizure records] March, 1919. Budapest. Archives of the Museum of Fine Arts, Budapest. No. 10.; Jegyzőkönyv a báró Herzog Lipót Mór úr köztulajdonba vett képzőművészeti alkotások visszaadása tárgyában. [Minutes regarding the return of artworks of baron Herzog Lipót Mór taken into public ownership.] September 5, 1921. Archives of the Museum of Fine Arts, Budapest. No. 10.; Éber, László ed., Művészeti Lexikon. Építészet. Szobrászat. Festészet. Iparművészet. [Art Lexicon. Architecture. Sculpture. Painting. Applied Art.] 1926, Andor Győző kiadása, Budapest. p.110.; Artworks handed over to the Jewish Ministerial Commissioner. 1944. Magyar Nemzeti Levéltár [National Archives of Hungary] 151/1949. Private collection, No.109 (from the owner András Herzog); Mravik, László, The ""Sacco Di Budapest"" and Depredation of Hungary, 1938-1949: Works of Art Missing from Hungary as a Result of the Second World War : Looted, Smuggled, Captured, Lost and Destroyed Art Works, Books and Archival Documents : Preliminary and Provisional Catalog, 1998, Hungarian National Gallery, Budapest. No. 19903, p. 325."
Suchmeldung;Einzelobjekt;616176;"Goya y Lucientes, Francisco José de [Künstler:in]";Karneval-Szene;"1815-16 (ca.) [Datierung]";Gemälde;;"späte Arbeit";"Sammlung Lopez, Madrid; Privatsammlung, Biarritz; Sammlung Ch. Cherfils, Paris; Sammlung Stchoukine, Paris; Marcell Nemes, Budapest-München, 1913 in Paris ersteigert; Baron Mor Lipot Herzog, Budapest, 1915; Baronin Mor Lipot Herzog, Budapest, 1934 durch Erbfolge; Herzog Andras, Erzsebet, Istvan, 1940, durch Erbfolge; während des Zweiten Weltkriegs verschollen - NS-verfolgungsbedingter Entzug wird vermutet; Staatliches Puschkin-Museum für Bildende Kunst, Moskau";2023-11-09;"Agnes Peresztegi (Avocat)agnes@peresztegi.com";https://www.lostart.de/de/Verlust/616176;"Katalog der aus der Sammlung des Kgl. Rates Marczell von Nemes-Budapest ausgestellten Gemälde. Kgl. Alte Pinakothek München, 1911. No. 6.; Katalog der aus der Sammlung des Kgl. Rates Marczell von Nemes-Budapest ausgestellten Gemälde. Düsseldorf, Bagel, 1912, No. 77.; A köztulajdonba vett műkincsek első kiállítása [The First Exhibition of the Nationalized Artworks.] Budapest, Műcsarnok [Exposition of Art] 1919. Rm. IV. No. 6.; Baldass, Ludwig, Herzog báró gyűjteménye [The Art Collection of Baron Herzog] In: Magyar Művészet III 1927 [Hungarian Art] 182, 197 illustrated.; Kőszeghy, Elemér: „Ingó műemlékek leltára” [Summary Inventory of Moveable Assets] 1934/35. Archives of the Museum of Applied Arts, Budapest. Herzog Paintings. No. 27.; Mravik, László, The ""Sacco Di Budapest"" and Depredation of Hungary, 1938-1949: Works of Art Missing from Hungary as a Result of the Second World War : Looted, Smuggled, Captured, Lost and Destroyed Art Works, Books and Archival Documents : Preliminary and Provisional Catalog, 1998, Hungarian National Gallery, Budapest.. No. 19882, p. 321.; Project “Heritage Revealed”, Catalog of art Objects from Hungarian Private Collections, Moscow, Rudomino, 2003. p. 120, illustrated."
Suchmeldung;Einzelobjekt;616177;"Goya y Lucientes, Francisco José de [Künstler:in]";"Pikadore mit Stieren vor einem Turm";"1787 [Datierung]";Gemälde;;;"Auftrag des Herzogs von Osuna für das Schloss La Almeda, Madrid, als Teil einer großen Gemäldeserie, 1787; Böhler, München; Baron Mor Lipot Herzog, Budapest, 1917; Baronin Mor Lipot Herzog, Budapest, 1934 durch Erbfolge; Herzog Andras, Erzsebet, Istvan, 1940, durch Erbfolge; im Zweiten Weltkrieg verschollen - NS-verfolgungsbedingter Entzug wird vermutet; Verbleib unbekannt";2023-11-09;"Agnes Peresztegi (Avocat)agnes@peresztegi.com";https://www.lostart.de/de/Verlust/616177;"A köztulajdonba vett műkincsek első kiállítása [The First Exhibition of the Nationalized Artworks.] Budapest, Műcsarnok [Exposition of Art] 1919. Room III. No. 5.; Herzog Mór Lipót műtárgyainak lefoglalása. Lefoglalási jegyzőkönyvek, [Seizure of Lipót Mór Herzog's artworks. Seizure records] March, 1919. Budapest. Archives of the Museum of Fine Arts, Budapest. No. 42.; Jegyzőkönyv a báró Herzog Lipót Mór úr köztulajdonba vett képzőművészeti alkotások visszaadása tárgyában. [Minutes regarding the return of artworks of baron Herzog Lipót Mór taken into public ownership.] September 5, 1921. Archives of the Museum of Fine Arts, Budapest. No. 42.; Baldass, Ludwig, Herzog báró gyűjteménye [The Art Collection of Baron Herzog] In: Magyar Művészet III 1927 [Hungarian Art] 182, 196 illustrated.; Kőszeghy, Elemér: „Ingó műemlékek leltára” [Summary Inventory of Moveable Assets] 1934/35. Archives of the Museum of Applied Arts, Budapest. Herzog. Painting No. 26.; Németek által elhurcolt műkincsek [Artworks carried away by Germans] 67.896/1947, Magyar Nemzeti Levéltár [National Archives of Hungary] XXIX-L-2-r. Baroness Alfonz Weiss, No. 2.; Artworks handed over to the Jewish Ministerial Commissioner. 1944. Magyar Nemzeti Levéltár [National Archives of Hungary] 151/1949. No. 15. (from the Owner Erzsébet Herzog); Wer kann Auskunft geben über den Verbleib nachstendend abgebildeter bzw. beschriebener Bilde der früheren Sammlung Baron Herzog, Budapest, welche seit der deutscher Besetzung von 1944 wermiesst werden? „Die Weltkunst” XX. 1. Oktober, 1950. No. 19.; Angelis, Rita de, L’opera pittorica complete di Goya, 1974, Rizzoli, Milano. No 192.; Mravik, László, The ""Sacco Di Budapest"" and Depredation of Hungary, 1938-1949: Works of Art Missing from Hungary as a Result of the Second World War : Looted, Smuggled, Captured, Lost and Destroyed Art Works, Books and Archival Documents : Preliminary and Provisional Catalog, 1998, Hungarian National Gallery, Budapest. No. 19880, p. 320-321."
Suchmeldung;Einzelobjekt;599102;"Unbekannt [Künstler:in]";Damenporträt;;Gemälde;;"leicht nach links sitzend, unter Glas (?) gerahmt";"Sammlung Victor von Klemperer, Dresden; Verbleib unbekannt; Entzug durch nationalsozialistiche Verfolgung nicht ausgeschlossen";2022-04-04;"Dr. Sabine Rudolph (Rechtsanwältin)+49 (0)351 / 448 333-0s.rudolph@steinmeier.eu";https://www.lostart.de/de/Verlust/599102;"Privatarchiv Klemperer, Foto Interieur Villa Tiergartenstraße 64  [um 1936/1938]"
Suchmeldung;Einzelobjekt;599048;"Unbekannt [Künstler:in]";"Porträt eines Mannes (?)";;Malerei;;"mit Kragen und turbanähnlicher Kopfbedeckung. Er/Sie liest ein Buch oder schreibt in ein solches.";"Sammlung Ralph von Klemperer, Dresden; Verbleib unbekannt; Entzug durch nationalsozialistische Verfolgung nicht ausgeschlossen";2022-04-04;"Dr. Sabine Rudolph (Rechtsanwältin)+49 (0)351 / 448 333-0s.rudolph@steinmeier.eu";https://www.lostart.de/de/Verlust/599048;"Privatalbum Ralph von Klemperer, Dresden, Wiener Str. 86 [undatiert], Privatbesitz"
Suchmeldung;Einzelobjekt;613361;"Unbekannt (nach Raphael) [Künstler:in]";Grablegung;"1649 (um) [Datierung]";Gemälde;;"Mittleres Bild des Hochaltars der St. Petrikirche in Braunschweig. Grablegungsszene: Im Vordergrund die Bettung des Leichnams Jesu in das Grab (über dem Grab), mehrere anbetende Personen um die zentralen Personen, im Hintergrund Golgatha und ein wie eine Kirche aussehender Tempel, vorne am linken unteren Bildrand zwei gekreuzte Werkzeuge auf einem (Stein-?)Podest";"Zentrales Bild im zweiten Geschoss des Hochaltars von St. Petri Braunschweig; Teile des Hochaltars während des Zweiten Weltkrieges (ab 1942) nach Kneitlingen bzw. in die St. Martinikirche Braunschweig ausgelagert, unklar ist ob das betreffende Gemälde darunter war; 1950 fehlte das Gemälde bei der Aufstellung des Hochaltars, ebenso ein weiteres Auferstehungs-Gemälde aus dem dritten Geschoss des Altars. Verlustumstand sowie genauer Verlustzeitpunkt unklar; angenommender Verlustzeitraum 1945-1950; Kriegsverlust nicht auszuschließen.";2023-04-12;"Kirchengemeinde St. Andreas-Petri in Braunschweig
Pfarrverband Braunschweig-Mitte
Bezirke II + IVAn der Andreaskirche 138100 Braunschweig braunschweig-mitte.pfa@lk-bs.de Peter Kapp (Pfarrer)peter.kapp@lk-bs.de";https://www.lostart.de/de/Verlust/613361;"Wolfgang A. Juenke, Zertörte Kunst aus Braunschweigs Gotteshäusern, Groß Oesingen 1994, S. 261; zum Hochalter von St. Petri Braunschweig vgl auch: Paul Jonas Meier: Die Kunstdenkmäler der Stadt Braunschweig, Braunschweig 1926, S. 34; Ders.: Das Kunsthandwerk des Bildhauers in der Stadt Braunschweig seit der Reformation, Braunschweig 1936, S. 86f.Abbildung des Altars liegt intern vor | Illustration of the altar is available internally:Hochaltar St. Petri Braunschweig vor 1942, S. 261 aus Jünke, Fotothek der Bau- und Kunstdenkmalpflege, IfD-Hannover (Landesdenkmalamt Hannover)"
Suchmeldung;Einzelobjekt;613612;"Flinck, Govert [Künstler:in]";"Schäfer und Schäferin / Bergère et Bergerette";;Gemälde;;;"Sammlung Max Rosenfeld, Stuttgart/Amsterdam; 1942 Bankhaus Lippmann, Rosenthal & Co. Sarphatistraat (LiRo), Amsterdam; 11. Februar 1944 LiRo an Steinecker, gekauft von Hermann von Rautenberg; Verbleib unbekannt";2023-05-09;"HCPO (Holocaust Claims Processing Office)claimsques@dfs.ny.gov";https://www.lostart.de/de/Verlust/613612;"National Archives of the Netherlands, the Stichting Nederlands Kunstbezits record group, Blok Br. F28058, Inv. Nr. 715 A.; SNK-Bericht, Archief SNK nr.751: Externer Link und Externer Link"
Suchmeldung;Einzelobjekt;613620;"Kaulbach, Hermann [Künstler:in]";"Blumenstilleben, Feuerlilien in hoher Vase";;Gemälde;"30 (Kunsthaus Heinrich Hahn, 1940)";"Bezeichnet: H.K.";"Sammlung Oskar Spier 1879-1940), Frankfurt a.M.; 27./28. August 1940 Auktion Kunsthaus Heinrich Hahn, Frankfurt a. M.; Verbleib unbekannt";2023-05-11;"Dr. Sabine Rudolph (Rechtsanwältin)+49 (0)351 / 448 333-0s.rudolph@steinmeier.eu";https://www.lostart.de/de/Verlust/613620;"Kunsthaus Heinrich Hahn, Frankfurt a.M.: Gemälde, Graphik, Kunsthandwerk, Hans Thoma-Sammlung, Seltene Perserteppiche. Versteigerung LXII vom 27. und 28. August 1940."
Suchmeldung;Einzelobjekt;613621;"Lenbach, Franz von [Künstler:in]";"Bildnis des Altertumsforschers Theodor Mommsen";"1893 [Datierung]";Gemälde;"38 (Kunsthaus Heinrich Hahn, 1940)";"G. R.; bezeichnet: F. Lenbach, 1893.";"Sammlung Oskar Spier 1879-1940), Frankfurt a.M.; 27./28. August 1940 Auktion Kunsthaus Heinrich Hahn, Frankfurt a. M.; Verbleib unbekannt";2023-05-11;"Dr. Sabine Rudolph (Rechtsanwältin)+49 (0)351 / 448 333-0s.rudolph@steinmeier.eu";https://www.lostart.de/de/Verlust/613621;"Kunsthaus Heinrich Hahn, Frankfurt a.M.: Gemälde, Graphik, Kunsthandwerk, Hans Thoma-Sammlung, Seltene Perserteppiche. Versteigerung LXII vom 27. und 28. August 1940."
