Meldungsart,Datensatzart,Lost Art ID,Hersteller/Künstler/Autor:in,Titel,Datierung,Objektart,Inventarnummer/Signatur,Beschreibung,Provenienz,Veröffentlicht seit,Kontakt,Link,Literatur / Quelle
Suchmeldung,Einzelobjekt,589707,"Unbekannt (Italienisch, Florenz) [Künstler:in]Uccello, Paolo (Schule des) [Künstler:in]Meister des Turniers von Santa Croce; Meister der Anghiari-Schlacht (?); Apollonio di Giovanni; Bernardo Rosselli [Künstler:in]",Einnahme von Karthago,1440 (um) [Datierung],Gemälde,121341 (KHI Bildnummer); 1156 (RM); MNR 246; MBA 1668 Dép,Cassonemalerei; L'Assedio di Cartagine / Die Belagerung von Carthago / Scène de bataille. Siège de Carthage par Scipio l'Aemilianus / Panneau de cassonne / Siege of Carthage,"Florentiner Patrizierbesitz; Sammlung Heinrich Freiherr von Tucher (und Erben), Wien - 08.12.1925; Auktion Cassirer & Helbing, Berlin 08.12.1925, Lot 63; Sammlung Veil Picard Kleinberger (?); Sammlung Agathe und Ernst Saulmann, Erlenhof, Württemberg/Florenz - 1938/1942 (um) aufgrund des Schicksals der Geschädigten kann der NS-verfolgungsbedingte Entzug des Gemäldes nicht ausgeschlossen werden; die genauen Verlustumstände sind unklar; Kunsthandel Paul Tulino, Paris 1941; Kunsthandel Walter Bornheim, München Paris 1941; Sammlung Dr. Friedrich Flick, - 24.12.1941 (als Geschenk für Hermann Göring); Sammlung Hermann Göring, 24.12.1941 -; Depot Berchtesgaden, Nr. 483; CCP München, 29.07.1945 - 19.10.1946, Mü-Nr. 5528; L'Office des Biens et Intérêts Privés, - 1950; Musée du Louvre, 1950 - 1969; Musée des Beaux-Arts d'Angers, 1969",2020-07-13,von Trott zu Solz Lammek (Rechtsanwälte • Notar)+49 (0) 30 59 00 33 0-0kanzlei@vontrott-lammek.de,https://www.lostart.de/de/Verlust/589707,"Edmund Wilhelm Braun-Troppau: Die Sammlung Tucher. In: Münchener Jahrbuch für Kunstgeschichte. (1910)II, S.178-208, hier S. 183-184, 187; D - BA, B323/319, Bd. 1: Gemälde der ""Sammlung Göring"", Bd. 1/4, Künstler S - Z sowie unbekannte Künstler; D - BA, B323/570, ""Verzeichnis der der Treuhandverwaltung bekannt gewordenen Restitutionen von 1945 bis 1962"", Bd. 1, Restitutionen nach Frankreich / 9, Aktentitel, Blatt 181; Ellen Callmann: Apollonio di Giovanni. Oxford 1974. S.87, 96 (Index); IT - Kunsthistorisches Institut, Florenz, Photothek, Konvolut Ernst Saulmann; Kunstsalon Paul Cassirer, Hugo Helbing: Die Sammlung Heinrich Freiherr von Tucher. Kunstgegenstände aus dem Nachlass seiner Exzellenz des Gesandten Heinrich Freiherrn von Tucher. Mit einem Anhang von Kunstgegenständen aus ausländischem und deutschem Privatbesitz. Auktion vom 08.12.1925. Berlin 1925. Lot 63; Tammaro de Marinis, Filippo Rossi (Hrsg.): Notice sur les miniatures ""Virgilius"" de la Bibliothèque Riccardi a Florence. In: Bulletin de la Société Française de Reproductions de Manuscrits à Peintures. 13(1930), S.17-31, hier S. 30; Raimond van Marle: The Development of the Italian Schools of Painting. New York 1970. Band X. S. 551- 554; Charlotte van Marle: The Development of the Italian Schools of Painting: Volume XIX General Index. Berlin 2013. S. 88; US - NARA, RG 239, M1944. Records of the American Commission for the Protection and Salvage of Artistic and Historic Monuments in War Areas, 1943-1946. Roll 153. Italian Private Collections Files, compiled 1943 - 1945. Blatt 16; US - NARA, RG 260, M1946. Photographs of art objects stolen by the Nazis from the Linz Museum and other collections in Europe. Roll 291. Photographs Taken by the Munich Central Collecting Point, OMGUS, of Artworks Appropriated by Germany during World War II. 260-MP-5528. Blatt 827-828; US - NARA, RG 260, M1946. Property cards from the Munich Central Collecting Point documenting the movement and disposition of each looted object. Roll 178. Records Relating to the Munich Central Collecting Point Property Accessions, 5528/Berchtesgaden 483, Paintings, Assault of Carthage. Blatt 1 und 2; US - NARA, RG 260, M1947. Textual records created at the Wiesbaden Central Collecting Point include administrative files and monthly reports. Roll 82. Restitution, Research, And Reference Records, Hofer, Walter A. : Hofer Goring Documents, Goring Lists. Blatt 38; US - NARA, RG 239, M1782. Reports by the Art Looting Investigation Unit of the OSS relating to jewels, paintings, and other art objects appropriated during WWII. Roll M1782_10F1. Consolidated Interrogation Reports (CIR) 2, The Goering Collection. S.56, Blatt 63; US - NARA, RG 260, M1947. Textual records created at the Wiesbaden Central Collecting Point include administrative files and monthly reports. Roll 81. Restitution, Research, And Reference Records. Göring: Art Museum Unterstein - Berchtesgaden, Germany. Blatt 2, 26; Mario Salmi: Paolo Uccello, Andrea del Castagno, Domenico Veneziano. Rom 1936. S. 114; www.christies.com/lotfinder/Lot/florentine-school-mid-15th-century-the-siege-of-5221710-details.aspx; www.pop.culture.gouv.fr/notice/mnr/MNR00246; ow-mba.angers.fr/ow4/mba18022013/voir.xsp?id=00101-27&qid=sdx_q0&n=7&e="
Suchmeldung,Einzelobjekt,589708,"Ferrari, Defendente [Künstler:in]Unbekannt (Italienisch, Padua) [Künstler:in]Giambellino [Giovanni Bellini] [Künstler:in]",Marienbild,1490 (um) [Datierung],Gemälde,50549 (Bildnummer KHI); RM 1165; 12488 (French Run Nr.); MNR 253; M.P.P. 4031,Madonna del LatteMadonna con BambiniLa Vierge à l'Enfant,"Sammlung Heinrich Freiherr von Tucher (und Erben), Wien - 08.12.1925; Auktion Cassirer & Helbing, Berlin 08.12.1925, Lot 64; Sammlung Agathe und Ernst Saulmann, Erlenhof, Württemberg/Florenz - 1928 - 1939 (um) - aufgrund des Schicksals der Geschädigten kann der NS-verfolgungsbedingte Entzug des Gemäldes nicht ausgeschlossen werden; die genauen Verlustumstände sind unklar; Kunsthandel (?) Frankreich; Kunsthandel Walter Bornheim, München/Paris; O[scar R.?] Henschel, 12.01.1942 (als Geschenk für Göring); Kunstsammlung Hermann Göring (G - 17); Depot Berchtesgaden, Nr. 2105; CCP München, 06.08.1945 - 25.09.1947, Mü-Nr. 7155; 25.09.1947 Restitution Frankreich, Paris; 1953 Musée de Picardie, Amiens",2020-07-13,von Trott zu Solz Lammek (Rechtsanwälte • Notar)+49 (0) 30 59 00 33 0-0kanzlei@vontrott-lammek.de,https://www.lostart.de/de/Verlust/589708,"Anonym: Versteigerung der Sammlung Tucher. In: Kunst und Künstler. 24(1926)5, S.199-200, hier S. 199; D - BA, B 323, 319, Bd. 1: Gemälde der ""Sammlung Göring"", Bd. 1 / 4, Künstler S - Z sowie unbekannte Künstler. Blatt 411; L. Gielly: La Donation de Holzer. In: Genava. Revue d'histoire de l'art et d'archéologie. 16(1938), S.164-168, hier S.164, 167, Tafel III, 2; IT - Kunsthistorisches Institut in Florenz (KHI) - Max Planck Institut, Photothek, Konvolut Besitz Ernst Saulmann; Kunstsalon Paul Cassirer, Hugo Helbing: Die Sammlung Heinrich Freiherr von Tucher. Kunstgegenstände aus dem Nachlass seiner Exzellenz des Gesandten Heinrich Freiherrn von Tucher. Mit einem Anhang von Kunstgegenständen aus ausländischem und deutschem Privatbesitz. Auktion vom 08.12.1925. Berlin 1925. Lot 64; Olga Pujmanová, T. Gottheinerová: Italian Primitives in Czechoslovak Collections. In: The Burlington Magazine. 119(1977)893, S.536, 538-551, hier S.546-547; Musée d'art et d'histoire, Mauro Natale: Peintures italiennes du XIVe au XVIIIe siècle. Genf 1979. S. 147; US - NARA, RG 260, M1947. Textual records created at the Wiesbaden Central Collecting Point include administrative files and monthly reports. Roll 81. Restitution, Research, And Reference Records, Göring: Art Museum Unterstein - Berchtesgaden, Germany. Blatt 7; US - NARA, RG 260, M1946. Photographs of art objects stolen by the Nazis from the Linz Museum and other collections in Europe. Roll 295. Photographs Taken by the Munich Central Collecting Point, OMGUS, of Artworks Appropriated by Germany during World War II. 260-MP-7155. Blatt 291-292; US - NARA, RG 260, M1947. Textual records created at the Wiesbaden Central Collecting Point include administrative files and monthly reports. Roll 82. Restitution, Research, And Reference Records, Hofer, Walter A. : Hofer Goring Documents, Goring Lists. Blatt 38; US - NARA, RG 260, M1946. Property cards from the Munich Central Collecting Point documenting the movement and disposition of each looted object. Roll 181. Records Relating to the Munich Central Collecting Point Property Accessions. 7155/Berchtesgaden 2105. Paintings. Madonna and Child; US - NARA, RG 239, M1944. Records of the American Commission for the Protection and Salvage of Artistic and Historic Monuments in War Areas, 1943-1946. Roll 6. Reports, 73.11c-Status Of Collecting Point MUNICH- Transport Lists FRANCE-Folder III. Blatt 7, 12; Franz Wickhoff: Die Sammlung Tucher. In: Münchener Jahrbuch der bildenden Kunst. (1908) I, S.19-30, hier S.23, 24 (Abb. 6), 25; Nancy Yeide: Beyond the dream of Avarice. The Hermann Göring Collection. Dallas 2009. S. 169, 380; catalogo.fondazionezeri.unibo.it; digitalcollections.frick.org/digico/#/details/bibRecordNumber/b14812447/Photoarchive; www.pop.culture.gouv.fr/notice/mnr/MNR00253"
Suchmeldung,Einzelobjekt,614072,"Courbet, Gustave (Kopie nach) [Künstler:in]",Vue d'Ornans / Ansicht von Ornans,,Gemälde,,,"Sammlung Max Braunthal, Frankfurt/M., Deutschland, und Neuilly-sur-Seine, Frankreich (erworben zu einem unbekannten Zeitpunkt); wahrscheinlich von Max Braunthal zu einem unbekannten Zeitpunkt bei der Galerie Raphaël Gérard hinterlegt und unter Zwang am 10. März 1941 für 50.000 frs (als Courbet ""Village"") an Alfred Daber verkauft; 1941, Verkauf durch Alfred Daber an Ludwig Gutbier zu einem unbekannten Zeitpunkt [laut CCP-Akten 1941 und wahrscheinlich zwischen März und Juli] für 110.000 frs; 6. November 1941, Angebot an Frau Troost (Linzer Käuferin) für RM 15.000; 7. Januar 1942, Verkauf an Frau Troost für Hitler für RM 15. 000,- (Linz 1988); 31. August 1944, Transport vom Führerbau, München, zum Depot in Alt-Aussee, Österreich; 15. Juli 1945, Ankunft im Central Collecting Point (CCP) München; 3. Dezember 1948, Rückgabe nach Paris durch den CCP München; 21. Dezember 1949, Einbehaltung durch die 4. Commission de choix des oeuvres de la récupération artistique [4. Kommission für die Auswahl von Werken der künstlerischen Wiederherstellung]; 1950, Zuweisung an das Musée du Louvre (Abteilung Gemälde) (SMF, sous-direction des collections, dossier Récupération : Arrêté du ministère de l'Education nationale du 16 mai 1951); 19. Januar 1953, Hinterlegung durch das Musée du Louvre im Musée Gustave Courbet, Frankreich; 1986, Zuweisung an das Musée d'Orsay",2023-07-03,Mondex Corporationinfo@mondexcorp.com,https://www.lostart.de/de/Verlust/614072,"WPI, Raphaël Gérard stock book, D 1608 Courbet, Village, 10 March 1941; Dhm -B323-656, Courbet, Landscape near Ornans, property card; CCP Munich: http://www.dhm.de/datenbank/ccp/prj_dhm_ccp/displayimg.php?laufnrid=cp067212_0&prj_short=dhm_ccp&format=gr&folder=ccp; Bundesarchiv Koblenz, B 323_421, p 95, Braunthal Courbet; Bundesarchiv Koblenz, B323_11, Transport list, 31 Aug 1944; Dhm, B323-612, Courbet, Landscape near Ornans"
Suchmeldung,Einzelobjekt,526702,"Cleve, Cornelis van [Künstler:in]Cleve, Joos van (?) [Künstler:in]Vermeyen, Jan Cornelisz. (auch zugeschrieben) Scorel, Jan van (auch zugeschrieben) [Künstler:in]",Männliches Bildnis in schwarzem Mantel mit Pelzkragen,1520 (um) [Datierung],Malerei,1134 (Galerie Weber); 99 (Lepke 1912); 4 (Bromberg 1913); 059 (Galerie Dietrich); 4416 (München); 1557 (Linz); 29180 (RKD); MNR 387,"Männliches Bildnis in schwarzem Mantel mit PelzkragenQuellen: F-Musées Nationaux Récupération (MNR), Ministère des Affaires étrangères, Carton 115, A 48, Convoy of Munich, nr. 36, date: 03.06.1949 - Manuscript, Caisse 2515 (box 2515); Hendrik J. Horn: Jan Cornelisz Vermeyen. Painter of Charles V and his conquest of Tunis. Volume 1. Doornspijk 1989. S.65-66, FN 63; Kunstgegenstände im Hause des Herrn Martin Bromberg. Hamburg 1913. Nr. 4; Rudolph Lepke's Kunst-Auctions-Haus: Galerie Weber, Hamburg: Versteigerung: 20., 21. und 22. Februar 1912 (Katalog Nr. 1634). Lot 99. Tafel 36; NL - Rijksbureau voor Kunsthistorische Documentatie (RKD), documentation, Kunstwerknummer 29180; US - Getty Research Institute, Duveen Brothers Resources. Series II. F. Kleinberger & Co. Inc. Records, 1906-1971. Box 393, Folder 8 (1938), Reel 248; Liste “Inventory of Hitler-Linz Collection by Artist with Hitler Accession NOS. L-Z.”. In: US-NARA, RG 260, M1946. Administrative records, correspondence, denazification orders, custody receipts, property cards, Jewish restitution claim records, property declarations, and other records from the Munich CCP. Roll 140. Restitution Research Records. Linz Museum: Inventory By Artist (L-Z). Blatt 2 und 72; Liste “Sammlungen des Führers”, S.1 und 17. US-NARA, RG 260, M1946. Administrative records, correspondence, denazification orders, custody receipts, property cards, Jewish restitution claim records, property declarations, and other records from the Munich CCP. Roll 141. Restitution Research Records. Linz Museum: Paintings Stored at Alt Ausee. Blatt 21; US-NARA, RG 260, M1946. Administrative records, correspondence, denazification orders, custody receipts, property cards, Jewish restitution claim records, property declarations, and other records from the Munich CCP. Roll 120. Restitution Research Records. Dietrich, Maria Almas: Purchases And Bank Receipts. Blatt 17 und 33; US-NARA, RG 260, M1946. Administrative records, correspondence, denazification orders, custody receipts, property cards, Jewish restitution claim records, property declarations, and other records from the Munich CCP. Roll 120. Restitution Research Records. Dietrich, Maria Almas: Interrogation. Blatt 397-398; Friedrich Winkler: Die Altniederländische Malerei. Die Malerei in Belgien und Holland von 1400-1600. Berlin 1924. S.330 und Kat. Nr. 196; www.dhm.de/datenbank/linzdb/; www.culture.gouv.fr (MNR); www.dhm.de/datenbank/ccp/dhm; www.rkd.nl - explore.rkd.nl/explore/images/29180","Sammlung Prof. Ernst Ewald, - 1905; Sammlung Eduard F. Weber in Galerie Weber, Hamburg, 1909; Auktion Lepke, 20.02-23.02.1912, Lot 99; Sammlung Martin Bromberg (und Erben), Hamburg, 1912 - 1918 - 1937 - 1938 - 20.12.1938 (vor); Kunsthandel M. Kleinberger (Direktor Allan Loebl), Paris vor 20.12.1938 -; Kunsthandel Ludwig Mandl, Wiesbaden [muss heißen: Victor Mandl, Paris], 1939; Kunsthandel Georges Wildenstein, Paris, 1939; Kunsthandel [Yves] Perdoux , Paris, - 22.02.1941; Galerie Dietrich, München, 22.02.1941 - März 1941, gekauft für 18.750 RM (Provision [Paul A.] Jurschewitz); Sonderauftrag Linz, gekauft für 35.000 RM, März 1941 -; CCP München, 15.07.1945 – 03.06.1949; restituiert nach Frankreich, Musées Nationaux Récupération, 03.06.1949 -; Musée des Beaux-Arts, Chambéry, Frankreich",2015-03-20,von Trott zu Solz Lammek (Rechtsanwälte Notar)+49 (0) 30 59 00 33 0-0kanzlei@vontrott-lammek.de,https://www.lostart.de/de/Verlust/526702,
Suchmeldung,Einzelobjekt,567247,"Patinir, Joachim [Künstler:in]Patinir, Joachim (Werkstatt); Südniederländisch [Künstler:in]",Flügelaltar,1520 (um) [Datierung],Malerei,"93 (Cassirer, Helbing); 217518-5 (Dorotheum);  3563 (Aussee); 4914, 4997, 4998 (CCP München); MNR 386 D; 69-6 (Musée Crozatier)","Quellen:Album Haus Bromberg, Nonnenstieg 9, Familienbesitz, o.J. [nach 1935]. Patrice Fontaine: Quentin, Joachim, Joos et les autres. Un triptyque méconnu attribué à l'atelier de Joachim Patinir. Château-Chervix 2016.Kunstsalon Paul Cassirer, Hugo Helbing: Die Sammlung Richard von Kaufmann, Berlin. Auktion vom 04.12.1917. Berlin 1917. Lot 93.NL - RKD, ObjektdokumentationUS - GRI, Getty Research Institute, Duveen Brothers Resources. Series II. F. Kleinberger & Co. Inc. Records, 1906-1971. Box 393, Folder 8, 1938, Blatt 4. Brief von Allen Loebl an Harry Sperling vom 20.12.1938.US - NARA, RG 260, A3389. Records Concerning the Central Collecting Points (""Ardelia Hall Collection""): Selected Microfilm Reproductions And Related Records, 1945-1949. Roll 68. ""Linz Film"". 14.5, Vols. 14a - 17a. Blatt 446 (LF XVI a/58/376).US - NARA, RG 260, A3389. Records Concerning the Central Collecting Points (""Ardelia Hall Collection""): Selected Microfilm Reproductions And Related Records, 1945-1949. Roll 71. ""Linz Film"". 14.8, Vols. 24–27a. Blatt 489 (LF XXVII/7/29) und Blatt 534 (LF XXVII/52/283).US - NARA, RG 260, M1946. Property cards from the Munich Central Collecting Point documenting the movement and disposition of each looted object. Roll 176. Records Relating to Property Accessions. Blatt 1 - 2.US - NARA, RG 260, M1946. Photographs of art objects stolen by the Nazis from the Linz Museum and other collections in Europe. Roll 289. Photographs Taken by the Munich Central Collecting Point, OMGUS, of Artworks Appropriated by Germany during World War II. 260-MP-4914. Blatt 731 - 434.M. Severi: An Allegorical Composition by Joachim Patinier. In: Hoogsteder-Naumann Mercury. (1989)10, S.4-10. (Auszug). Unter www.artwis.com/articles/an-allegorical-composition-by-joachim-patinier/2/Die Versteigerung der Sammlung von Kaufmann. In: Der Cicerone. 10(1918), S.24 -26 (Auszug).www.dhm.de/datenbank/ccpwww.culture.gouv.fr/public/mistral/mnrbis_fr","Sammlung Richard von Kaufmann, Berlin; Auktion Paul Cassirer, Hugo Helbing, Berlin 04.12.1917, Lot 93; Kunsthandel J. & S. Goldschmidt, Frankfurt a.M. 04.12.1917; Sammlung Henry Bromberg, Hamburg [1935 um]; Kunsthandel Hans Wendland gemeinsam mit Kunsthandel F. Kleinberger (Allen Loebl), Paris vor 20.12.1938; Kunsthandel Theo Hermsen, Paris; Kunsthandel Dorotheum, Wien 06.06.1944, Nr. 217518-5; Hermann Voss für Sonderauftrag Linz; CCP München, 18.07.1945 - 03.06.1949; Restitution Frankreich, 03.06.1949; Musée du Louvre, Paris (vom Office des Biens et Intérêts Privés überstellt) 1950; Depot Algier, 1952 - 1961; Musée Crozatier du Puy, 10.01.1966",2017-04-19,von Trott zu Solz Lammek (Rechtsanwälte Notar)+49 (0) 30 59 00 33 0-0kanzlei@vontrott-lammek.de,https://www.lostart.de/de/Verlust/567247,
Suchmeldung,Einzelobjekt,429210,"Gael, Barend [Künstler:in]",Vor der Schenke,,Malerei,,"Vornehme Reiter mit Hunden rechts, links das Wirtshaus mit Staffagefiguren, Bäume im Hintergrund. Breiter Rahmen. Abb. Tafel LXIII","Sammlung Wiener, Hede und Josef, Tschechien; Beschlagnahme durch die Gestapo in Prag; Versteigerung bei Weinmüller, München 13./14.11.1941, Lot 470; MNR Verzeichnis Nr. 707, dort als Asch, Pieter Jansz, heute im Louvre",2011-01-24,von Trott zu Solz Lammek (Rechtsanwälte Notar)+49 (0) 30 59 00 33 0-0kanzlei@vontrott-lammek.de,https://www.lostart.de/de/Verlust/429210,
